"galleggiare","vi. to float; avere galleggiato"
"garantire","vt. <garantisco> to guarantee; (assicurare) to assure; avere garantito"
"garantire qc a qu","to guarantee sb of sth"
"gestire","vt. <gestisco> (amministrare: albergo, azienda, negozio) to run, manage; avere gestito"
"gettare","vt. (lanciare) to throw; avere gettato"
"gettare via","to throw away"
"giocare (a)","vi. (gioco, sport) to play; (cavalli) to bet (on); avere giocato"
"giocare a carte","to play cards"
"giocare a palla","to play ball"
"giocare a flipper","to play pinball"
"giocare ai videogiochi","to play video games"
"girare","vt. (chiave, testa, occhi) to turn; (percorrere, visitare) to go around; vi. to turn; (andare in giro) to wander, go around; avere girato"
"giudicare","vt. (persona) to judge; (ritenere) to consider; avere giudicato"
"giurare","vt. to swear; avere giurato"
"giustificare","vt. to justify; avere giustificato"
"giustificarsi","vr. (scusarsi) to justify o.s.; essersi giustificato"
"grattare","vt. (pelle) to scratch; (raschiare) to scrape; vi. (stridere) to screech; avere grattato"
"grattarsi","vr. to scratch o.s.; essersi grattato"
"gridare","vt. (dire ad alta voce) to shout; vi. (urlare) to shout, (strillare) to scream; avere gridato"
"guadagnare","vt. (denaro) to earn; to gain; (raggiungere: cima, vetta) to reach; vi. (ricevere uno stipendio) to earn; avere guadagnato"
"guardare","vt. (vedere) to look at; (cercare: parola) to look up; (vigilare su: bambino, condannato) to look after; avere guardato"
"guardare qc di buon occhio","to view sth favorably"
"guardare qc di mal occhio","to view sth unfavorably"
"guardare qu dall'alto in basso","to look sb up and down"
"guardarsi","vr. (osservarsi) to look at o.s., (reciproco) to look at each other; essersi guardato"
"guidare","vt. (veicolo) to drive; (indirizzare) to guide; (capeggiare: gruppo, rivolta) to lead; avere guidato"
"gustare","vt. FOOD (provare) to taste; (assaporare) to enjoy; avere gustato"
"imbrunire","vi. <imbrunisco> (farsi sera) to get dark; essere imbrunito"
"immergere","vt. <immergo> (gener) to immerse, plunge; avere immerso"
"immergersi","vr. <immergo> (in liquido, vasca) to plunge; (in profondità) to dive; essersi immerso"
"immergersi in qc","vr. <immergo> (in pensieri, attività) to immerse o.s. in sth; essersi immerso"
"imparare","vt. (con studio, con esperienza) to learn; avere imparato"
"imparare a fare qc","to learn to do sth"
"impazzire","vi. <impazzisco> (ammattire) to go crazy; essere impazzito"
"impazzire per qc/qu","fig. to be crazy about sth/sb"
"fare impazzire qu","to drive sb crazy"
"impiegare","vt. (strumento, oggetto) to use; (tempo) to take; (esperto, specialista) to employ; avere impiegato"
"includere","vt. <includo> (comprendere) to include; (in busta, lettera) to enclose; avere incluso"
"incontrare","vt. (per appuntamento) to meet, (per caso) to bump into; (difficoltà, problema) to come up against; avere incontrato"
"incontrare qn per caso","to bump into sb"
"incontrarsi","vr. (per appuntamento) to meet each other, (per caso) to bump into each other; essersi incontrato"
"indagare","vi. to investigate; avere indagato"
"indebolirsi","vr. <indebolisco> (persona, autorità, capacità) to weaken, become weak; essersi indebolito"
"indicare","vt. (mostrare) to show, indicate; (con gesto) to point to, point out; avere indicato"
"individuare","vt. (colpevole, causa, guasto) to identify; avere individuato"
"indovinare","vt. (scoprire) to guess; (immaginare) to immagine; (il futuro) to prediict; avere indovinato"
"infastidire","vt. <infastidisco> to annoy, irritate; avere infastidito"
"infastidirsi","vr. <infastidisco> to get annoyed, irritated; essersi infastidito"
"infastidirsi per qc","to get annoyed with sth"
"informare","vt. (con notizie) to inform, tell; avere informato"
"informare qn di qc","to inform sb about sth"
"ingrassare","vt. ((persona) to make fat; animale) to fatten; (ingranaggio, motore) to grease; essere ingrassato"
"ingrassarsi","vr. (diventare grasso) to get fat, put on weight; essersi ingrassato"
"inquinare","vt. to pollute; avere inquinato"
"insistere","vi. <insisto> to insist; avere insistito"
"insistere su qc","to insist on sth"
"insistere in qc","to persist in sth"
"insistere a fare qc","to persist in doing sth"
"interferire","vi. <interferisco> (persona) to interfere; avere interferito"
"interrompere","vt. <interrompo> (lavoro, trattativa, persona) to interrupt, break off; avere interrotto"
"interrompersi","vr. <interrompo> (in attività) to break off, stop; essersi interrotto"
"introdurre","vt. <introduco> (prodotto, moda, uso) to introduce; avere introdotto"
"invadere","vt. <invado> (territorio, paese) to invade; avere invaso"
"invitare","vt. (a cena, festa) to invite; avere invitato"
"invitare qn a fare qc","to invite sb to do sth"
"lanciare","vt. (gettare: oggetti) to throw, hurl, fling; (programma, software, prodotto) to launch; avere lanciato"
"lanciarsi","vr. (buttarsi) to throw, hurl, fling o.s.; essersi lanciato"
"lasciar entrare i cani","to let the dogs in"
"lasciar fare qc a qn","to let, allow, permit sb to do sth"
"lasciar fare qc","to let, allow, permit sth to be done"
"lasciar uscire i cani","to let the dogs out"
"lasciare i libri a casa","to leave the books at home"
"lasciare il negozio","to leave the store"
"lasciare il ristorante","to leave the restaurant"
"lasciare qc a qn","to leave sth to sb"
"lasciare qn fare qc","to let sb do sth"
"lasciare stare qn/qc","to leave sb/sth alone"
"lasciare","vt. (gener) to leave; (mollare la presa) to let; avere lasciato"
"lasciarsi","vr. (persone) to part; (coppia) to split up; essersi lasciato"
"lascarsi andare","to let o.s. go"
"lavare","vt. (biancheria, stoviglie) to wash, (pavimento, denti, vetri) to clean; avere lavato"
"lavarsi i mani","to wash one's hands"
"lavarsi","vr. to wash; essersi lavato"
"lavorare a qc","to work on sth"
"lavorare","vt. (ferro, pasta, terreno) to work; vi. (gener) to work; (negozio) to do business; avere lavorato"
"legare","vt. (collegare) to bind, (con spago, funi) to tie up; (unire) to bind together; vi. (andare d'accordo) to get on; avere legato"
"legarsi","vr. (attaccarsi) to tie o.s.; CHEM to bind; essersi legato"
"leggere di qc","to read about sth"
"leggere di storia","to read about history"
"leggere nel pensiero a qn","to read sb's mind"
"leggere qc in un libro","to read sth in a book"
"leggere qc sul giornale","to read sth in the newspaper"
"leggere","vt. <leggo> (libro, testo) to read; vi. <leggo> to read; avere letto"
"liberare","vt. (prigioniero, ostaggio) to release; (da invasione, assedio) to liberate; (sgombrare: tavolo, strada) to clear; (camera, casa) to vacate; avere liberato"
"liberarsi","vr. (posto, casa) to become free; essersi liberato"
"licenziare","vt. (impiegato) to dismiss, (per riduzione del personale) to lay off; avere licenziato"
"licenziarsi","vr. (da un impiego) to resign; essersi licenziato"
"limare","vt. (sbarra, superficie, unghia) to file; (scritto, stile) to polish; avere limato"
"limitare","vt. (ridurre: costi, libertà) to restrict; (delimitare: zona) to delimit; avere limitato"
"limitarsi","vr. to restrict, limit o.s.; essersi limitato"
"lodare","vt. (elogiare, celebrare) to praise; avere lodato"
"lottare","vi. (combattere) to fight; SPORTS (fare alla lotta) to wrestle; (opporsi a: sonno, accuse) to fight; avere lottato"
"macchiare","vt. (sporcare) to stain; (caffè, tè) to add milk to, (latte) to add coffee to; (onore, nome) to sully; avere macchiato"
"macchiarsi","vr. (sporcarsi) to get dirty; essersi macchiato"
"maledire","vt. to curse; avere maledetto"
"mancare","vt. (bersaglio, colpo, palla) to miss; (occasione, opportunità) to miss; vi. (non esserci, non bastare) to be lacking, (acqua, corrente, luce) to go off; (essere assente) to not be there, (provocare nostalgia) to miss; (distare) to be; (morire) to die; (svenire) to faint; (sbagliare) to make a mistake; essere mancato"
"mandare","vt. (persona) to send, (a sede, ufficio) to post; (lettera, pacco, fiori) to send; (luce, fumo, odore) to give off, (grido, verso) to let out; avere mandato"
"mangiare di tutto","to eat anything/everything"
"mangiare fuori","to eat out"
"mangiare qc","to eat sth"
"mangiare","vt. (ingerire) to eat; (rosicchiare, corrodere) to eat away at; (denaro) to get through; (nei giochi) to take; avere mangiato"
"mangiarsi","vr. to eat; essersi mangiato"
"mantenere","vt. (disciplina, calma, ordine) to keep; (impegno, promessa, segreto) to keep; (figli, famiglia) to support, (casa, auto) to maintain; avere mantenuto"
"mantenersi","vr. (conservarsi) to keep; (sostentarsi) to support o.s.; essersi mantenuto"
"mascherare","vt. (viso) to mask, (persona) to dress up; (sentimento) to mask; avere mascherato"
"mascherarsi (da)","vr. to disguise o.s. (as), dress o.s. up (as); essersi mascherato"
"mentire","vi. (dire il falso) to lie; avere mentito"
"meritare","vt. (premio, punizione) to deserve; (prezzo) to be worth; (valere la pena) to be worth; avere meritato"
"metterci molta cura","to take a lot of care"
"metterci molto tempo","to take a lot of time"
"mettere a posto qc","to put in place, fix sth"
"mettere giù la birra","to set the beer down"
"mettere in dubbio qc","to doubt sth"
"mettere in ordine qc","to put in order, tidy up sth"
"mettere insieme qc","to put sth together"
"mettere la pizza sul tavolo","to put the pizza on the table"
"mettere via qc","to put sth away"
"mettere","vt. <metto> (collocare: in luogo) to put, (in posizione) to place; (persona, denaro, annuncio, firma, visto, (energia, forza) to put; (indumento) to put on; avere messo"
"mettersi","vr. <metto> (in posizione) to put o.s.; (in condizione) to make o.s.; (indossare) to put on; essersi messo"
"migliorare","vt. (rendere migliore) to improve; vi. (diventare migliore) to improve; (stare meglio) to get better; essere migliorato"
"migliorarsi","vr. to improve o.s.; essersi migliorato"
"migrare","vi. (uccelli) to migrate; essere migrato"
"minacciare","vt. to threaten; avere minacciato"
"mirare","vi. to aim; avere mirato"
"misurare","vt. (calcolare) to measure; (indossare) to try on; (moderare) to measure; (stimare) to weigh up; vi. to measure; avere misurato"
"misurarsi","vr. (cimentarsi) to measure o.s.; (limitarsi) to control; essersi misurato"
"moderare","vt. (spese, velocità) to curb, (tono, collera) to moderate; (dibattito) to chair; avere moderato"
"moderarsi","vr. to keep o.s. in check; essersi moderato"
"modificare","vt. (cambiare) to alter; (migliorare) to improve; avere modificato"
"mordere","vt. <mordo> (mela, panino) to bite into, (cane, vipera) to bite; (insetto) to sting; vi. <mordo> (freddo) to bite, (sapore) to be sharp; avere morso"
"mordersi","vr. <mordo> (lingua, labbro, unghie) to bite; essersi morso"
"morire dalla voglia di fare qc","to be dying to do sth"
"morire di fame","to die of hunger"
"morire di noia","to die of boredom"
"morire di paura","to die of fright"
"morire di qc","to die from sth"
"morire di sete","to die of thirst"
"morire","vi. <muoio> (persona, animale, pianta) to die; (istituzione, tradizione) to die; (conversazione, discorso) to die off, (progetto, questione) to die; (fuoco, luce) to die out, (passione, speranza) to die off; essere morto"
"mostrare","vt. (far vedere) to show; (additare) to point out; (spiegare, dimostrare) to explain; (palesare) to show; (fingere) to pretend; avere mostrato"
"mostrarsi","vr. (farsi vedere) to appear; (dimostrarsi) to appear; essersi mostrato"