"sopravvivere","vi. to survive; fig. (ricordo) to live on; essere sopravvissuto"
"sopravvivere a qn","to outlive sb"
"sopravvivere a qc","to survive sth"

"salire","vt. <salgo> (scale, gradini, montagna) to climb; vi. <salgo> (gener) to go up; (aereo, strada, sentiero) to climb; (catena montuosa, fumo, urla) to rise; (montare: sul treno) to get on, (sull'auto) to get in; (aumentare: livello, numero, temperatura) to rise; (diventare più caro: prezzo, affitto, frutta) to go up (in price); essere salito"
"saltare","vt. (ostacolo) to jump (over); FOOD to sauté; (omettere, non frequentare) to skip; vi. (da terra) to jump; essere saltato"
"salutare","vt. to greet; avere salutato"
"salutarsi","vr. (incontrandosi) to greet one another, (lasciandosi) to say goodbye to one another; essersi salutato"
"salvare","vt. a. COMPUT (gener) to save; (proteggere: onore, reputazione) to preserve; avere salvato"
"salvarsi","vr. (dalla morte) to survive; (trovare scampo) to find safety; essersi salvato"
"sapere","vt. <so> (gener) to know; (essere in grado di fare qualcosa) to know how to; (apprendere) to find out; avere saputo"
"sbarazzarsi (di)","vr. to get rid (of), rid o.s. (of); essersi sbarazzato"
"sbrigare","vt. (faccenda, questione) to deal with; avere sbrigato"
"sbrigarsi","vr. (affrettarsi) to hurry up; essersi sbrigato"
"sbucare","vi. (animale) to pop out; (apparire improvvisamente) to appear; essere sbucato"
"scaldare","vt. (acqua) to boil, (minestra) to heat (up), (stanza, motore) to warm (up); (agitare: animi, testa) to stir up; avere scaldato"
"scaldarsi","vr. a. SPORTS (diventare caldo) to warm up; (accalorarsi, irritarsi) to grow heated; essersi scaldato"
"scambiare","vt. (fare uno scambio) to exchange; (impressioni, opinioni) to share, (parole) to exchange; avere scambiato"
"scambiarsi","vr. (sostituirsi) to change over; (dare l'un l'altro) to exchange; essersi scambiato"
"scampare","vt. (sfuggire a: morte, prigione) to escape; vi. (sfuggire: a pericolo, morte, massacro) to escape; essere scampato"
"scappare","vi. (darsi alla fuga) to flee; (di prigione) to escape; (andar via in fretta) to run; (sfuggire) to slip out; essere scappato"
"scaraventare","vt. (gettare con impeto) to hurl; avere scaraventato"
"scaraventarsi","vr. (gettarsi con impeto) to hurl oneself; essersi scaraventato"
"scegliere","vt. <scelgo> to choose; avere scelto"
"scendere","vi. <scendo> (andare giù) to go down; (smontare: da macchina) to get out of, (da bus, treno) to get off, (da cavallo) to dismount; (essere in pendenza) to descend; (calare) to drop, (notte) to fall, (sole) to set; (di grado) to decline; essere sceso"
"schermare","vt. (proteggere mediante schermo) to screen; avere schermato"
"schiamazzare","vi. ZOOL (galline) to squawk, (oche) to cackle; (persone) to make a racket; avere schiamazzato"
"scivolare","vi. (perdere l'equilibrio) to slip; (scorrere) to slide; essere scivolato"
"scomparire","vi. (sparire) to disappear; (morire) to die; (fare poca figura) to fade into the background; essere scomparso"
"scompigliare","vt. (capelli) to mess up; avere scompigliato"
"sconfiggere","vt. <sconfiggo> a. MIL to defeat; (eliminare) to overcome; avere sconfitto"
"scongiurare","vt. (pregare) to beg; (pericolo, disastro, tragedia) to avert; avere scongiurato"
"scontrarsi","vr. (treno, auto) to crash; MIL to clash; (divergere) to differ; essersi scontrato"
"sconvolgere","vt. (turbare profondamente) to devastate; (piano, progetto) to upset; avere sconvolto"
"scoprire","vt. <scopro> (gener) to discover; (pentola, statua, gambe) to uncover; (palesare) to reveal; avere scoperto"
"scoprirsi","vr. <scopro> (spogliarsi) to take some clothes off; (rivelarsi) to give oneself away; essersi scoperto"
"scovare","vt. (lepre, volpe) to flush; (scoprire) to discover; avere scovato"
"scrivere","vt. <scrivo> to write; avere scritto"
"scrosciare","vi. (fiume) to thunder, (pioggia, acqua) to pour (down); essere scrosciato"
"scrutare","vt. (osservare intensamente) to scrutinize; avere scrutato"
"scuotere","vt. <scuoto> to shake; avere scosso"
"scuotersi","vr. <scuoto> (dal torpore) to shake oneself; (turbarsi) to be shaken; essersi scosso"
"scurire","vt. <scurisco> (colore, metallo) to make darker; essere scurito"
"scurirsi","vr. <scurisco> (colore, capelli, pelle, metallo) to become darker; essersi scurito"
"scusare","vt. to excuse, (perdonare) to forgive; avere scusato"
"scusarsi","vr. to apologize; essersi scusato"
"seccare","vt. (terreno, aria) to dry (out), (fiori) to wither; (infastidire) to annoy; essere seccato"
"seccarsi","vr. (diventare secco: frutta, pianta) to wither, (pelle) to dry out; (diventare asciutto) to dry up; essersi seccato"
"sedere","vi. <siedo> to be sitting; essere seduto"
"sedersi","vr. <siedo> to sit (down); essersi seduto"
"sedurre","vt. <seduco> (donna, uomo) to seduce; (attrarre) to appeal to; avere sedotto"
"segnare","vt. (gener) to mark; (prendere nota di) to jot down; SPORTS (gol, punto) to score; (indicare: orologio, termometro) to show; avere segnato"
"segnarsi","vr. (fare il segno della croce) to cross oneself; essersi segnato"
"seguire","vt. (corso di studi) to take; (con lo sguardo) to watch, (con l'attenzione) to follow; vi. (venir dopo, derivare) to follow; (continuare) to continue; essere seguito"
"seminare","vt. (campo, grano, odio, discordia) to sow; SPORTS to leave behind; (inseguitore) to shake off; avere seminato"
"sentire","vt. (con le orecchie) to hear, (ascoltare) to listen to; (con il naso) to smell; (col gusto) to taste; (col tatto) to feel; (provare, accorgersi) to feel; (venire a sapere) to hear; avere sentito"
"sentirsi","vr. to feel; essersi sentito"
"separare","vt. (disgiungere) to separate; (tenere distinto) to distinguish; avere separato"
"separarsi","vr. (lasciarsi: coniugi) to separate, (amici, soci) to part company; essersi separato"
"seppellire","vt. <seppellisco> to bury; avere seppellito [o sepolto]"
"servire","vt. (gener) to serve, (come domestico) to work; vi. (essere utile) to be useful; MIL, SPORTS to serve; essere servito"
"servirsi","vr. (a tavola) to help oneself; (essere cliente) to shop; essersi servito"
"sfidare","vt. (gener) to challenge; (pericolo, morte) to defy; avere sfidato"
"sfogliare","vt. (libro, rivista) to flick through; avere sfogliato"
"sfuggire","vi. to escape; essere sfuggito"
"sgomentare","vt. to dismay; avere sgomentato"
"sgualcire","vt. <sgualcisco> (sciupare: abito) to crush; avere sgualcito"
"sistemare","vt. (mettere a posto) to tidy (up); (faccenda) to sort out; (procurare un lavoro) to fix up; (procurare un alloggio a) to put; (punire) to chew out; avere sistemato"
"sistemarsi","vr. (trovare lavoro) to find a job; (trovare alloggio) to find a place to stay; (sposarsi) to settle down; essersi sistemato"
"smaltire","vt. <smaltisco> (digerire: cibo) to digest; (far passare: sbornia, rabbia) to get over; (eliminare: acque) to drain away, (rifiuti) to dispose of; avere smaltito"
"smantellare","vt. (mura) to demolish, (fabbrica) to shut down; (tesi,accusa) to take apart; avere smantellato"
"smettere","vt. (interrompere: lavoro) to stop, (studi) to give up, (discussione) to end; vi. (cessare) to stop; avere smesso"
"sminuire","vt. <sminuisco> (svalutare) to belittle; avere sminuito"
"smontare","vt. (scomporre: scaffare, motore) to take apart; (scoraggiare) to dishearten; essere smontato"
"smontare","vi. (scendere: da treno) to get off, (da cavallo) to dismount; (di turno, lavoro) to finish; essere smontato"
"smontarsi","vr. (scoraggiarsi) to lose heart; essersi smontato"
"soddisfare","vt. to satisfy; avere soddisfatto"
"soffiare","vi. to blow; avere soffiato"
"soffiare","vt. (aria, fumo, vetro) to blow; (portar via) to steal, to swipe; (spifferare: segreto) to whisper; avere soffiato"
"soffrire","vt. <soffro> (patire) to suffer; (sopportare) to bear; vi. <soffro> (patire) to suffer; avere sofferto"
"soggiogare","vt. (sottomettere) to subjugate; avere soggiogato"
"sognare","vt. (vedere in sogno) to dream; (desiderare) to dream of; avere sognato"
"somigliare","vi. (essere simile) to look like; avere somigliato"
"somigliarsi","vr. (essere simile: fisicamente) to look alike, (di carattere) to be alike; essersi somigliato"
"sopportare","vt. (peso, sofferenza, spese) to bear; (persona, caldo, freddo) to stand; avere sopportato"
"sopravvivere","vi. (ricordo) to live on; essere sopravvissuto"
"sorgere","vi. <sorgo> (gener) to rise; (manifestarsi) to arise; essere sorto"
"sorprendere","vt. (stupire) to surprise; avere sorpreso"
"sorridere","vi. (ridere) to smile; (apparire favorevole) to smile on; avere sorriso"
"sospendere","vt. (appendere) to hang; (gener) to suspend; avere sospeso"
"sostenere","vt. (reggere) to hold up; (spese) to bear; (persona, legge, famiglia) to support, (tesi, idea) to hold; (esame) to take; (affermare) to maintain; avere sostenuto"
"sostenersi","vr. (tenersi ritto) to support oneself; (mantenersi vigoroso) to keep in good shape; essersi sostenuto"
"sottomettere","vt. (popolo) to subjugate; avere sottomesso"
"sottomettersi","vr. (assogettarsi) to submit; essersi sottomesso"
"spalancare","vt. (porta, finestra) to fling open; (occhi, bocca, braccia) to open wide, (gambe) to spread; avere spalancato"
"spalancarsi","vr. (aprirsi) to open wide; essersi spalancato"
"spalmare","vt. to spread; avere spalmato"
"spargere","vt. <spargo> (semi, fiori) to scatter; (luce, calore, notizia) to spread; (liquidi) to spill, (lacrime, sangue) to shed; avere sparso"
"spargersi","vr. <spargo> (persone, animali) to scatter; (notizie, dicerie) to spread; essersi sparso"
"sparire","vi. <sparisco> to disappear; essere sparito"
"spedire","vt. <spedisco> (inviare) to send; avere spedito"
"spegnere","vt. <spengo> (fuoco, fiamma, sigaretta) to put out; (luce, radio, motore, apparecchio) to turn off; (entusiasmo) to extinguish; (sete) to quench; avere spento"
"spegnersi","vr. <spengo> (fuoco, sigaretta) to go out; (motore, apparecchio) to go off; (entusiasmo) to fizzle out; (morire) to pass away; essersi spento"
"spendere","vt. <spendo> (soldi, tempo) to spend; (impiegare: energie, forze) to expend; avere speso"
"sperare","vt. to hope; avere sperato"
"spezzare","vt. (rompere) to break; avere spezzato"
"spezzarsi","vr. (rompersi) to break; essersi spezzato"
"spiegare","vt. (far capire) to explain; (tovaglia, cartina) to unfold; (ali, vele) to spread; MIL (truppe) to deploy; avere spiegato"
"spiegarsi","vr. (chiarirsi) to explain (oneself), (con un'altra persona) to sort things out; essersi spiegato"
"spingere","vt. <spingo> (spostare) to push; (premere) to press; (fare ressa) to push and shove; avere spinto"
"spingersi","vr. <spingo> (inoltrarsi) to go on; essersi spinto"
"spogliare","vt. (svestire) to undress; (derubare) to strip; avere spogliato"
"spogliarsi","vr. (svestirsi) to undress; essersi spogliato"
"sposare","vt. (gener) to marry; (dare in moglie o marito) to marry (off); (causa, lavoro) to be wedded to; avere sposato"
"sprecare","vt. (tempo, denaro) to waste; avere sprecato"
"sprecarsi","vr. to exert oneself; essersi sprecato"
"sprigionare","vt. (emettere) to give off; avere sprigionato"
"sprigionarsi","vr. (uscire: calore, fumo) to come out of; essersi sprigionato"
"sprofondare","vi. (pavimento, casa) to collapse; (affondare) to sink; essere sprofondato"
"sprofondarsi","vr. (lasciarsi andare) to collapse; (immergersi) to bury oneself; essersi sprofondato"
"squillare","vi. (trombe) to sound; (telefono, campanello) to ring; essere squillato"
"sradicare","vt. (pianta) to uproot; (vizio, male) to root out; avere sradicato"
"stabilire","vt. <stabilisco> (dimora, sede) to set up; (decidere) to establish; avere stabilito"
"stabilirsi","vr. <stabilisco> (prendere dimora) to set up home; essersi stabilito"
"staccare","vt. (francobollo, etichetta) to remove; (quadro) to take down, (bottone) to take off; RAIL (vagone) to detach; (assegno, ricevuta) to write; SPORTS to outdistance; (parole, sillabe) to articulate; vi. (finire di lavorare) to knock off; avere staccato"
"staccarsi","vr. (allontanarsi) to detach oneself; essersi staccato"
"stare","vi. <sto> (restare) to stay; (trovarsi) to be; (abitare) to live; (di salute) to be; (colore, indumento) to suit; (resistere) to take; (entrarci) to fit; essere stato"
"stentare","vi. (faticare) to have difficulty; avere stentato"
"stimare","vt. COMM to value; (persona) to esteem; avere stimato"
"stordire","vt. <stordisco> (provocare confusione) to daze; avere stordito"
"stramazzare","vi. (cadere) to collapse; essere stramazzato"
"strappare","vt. (ramo, fiore) to break off, (pagina) to tear out, (carta) to tear up; (cuore) to break, (promessa, confessione) to extract; avere strappato"
"strapparsi","vr. (lacerarsi) to break; essersi strappato"
"stregare","vt. to bewitch; avere stregato"
"stringere","vt. <stringo> (serrare) to squeeze (together); (vite) to tighten; (denti, pugni) to clench; (vestito) to take in; (riassumere) to condense; avere stretto"
"studiare","vt. (per imparare qc) to study; (esaminare, indagare) to examine; (parole, mosse) to weigh; avere studiato"
"studiarsi","vr. (osservarsi) to weigh each other up; essersi studiato"
"stupire","vt. <stupisco> (meravigliare) to amaze; essere stupito"
"stupirsi","vr. <stupisco> (meravigliarsi) to be amazed; essersi stupito"
"subire","vt. <subisco> (ingiuria, danni, conseguenze) to suffer; avere subito"
"succedere","vi. <succedo> (avvenire) to happen; essere successo"
"sudare","vi. to sweat; avere sudato"
"suggerire","vt. <suggerisco> THEAT to prompt; (consigliare) to suggest; avere suggerito"
"suonare","vt. MUS to play; (orologio) to strike, (campana, campanello) to ring; vi. (campana, telefono) to ring, (sveglia) to go off; MUS to play; (parole, frasi) to sound; essere suonato"
"supporre","vt. to suppose; avere"
"suscitare","vt. (reazione, odio, entusiasmo) to arouse; avere suscitato"
"svanire","vi. <svanisco> to disappear; essere svanito"
"svegliare","vt. (dal sonno) to wake (up); (animare: persone) to liven up; (suscitare: emozioni) to awaken; avere svegliato"
"svegliarsi","vr. to wake up; essersi svegliato"
"svelare","vt. (segreto, verità) to reveal; avere svelato"
"svenire","vi. to faint; essere svenuto"
"sviscerare","vt. (argomento, questione) to analyze in depth; avere sviscerato"
"svolgere","vt. (gomitolo) to unwind; (idea, tema) to set out, (programma, piano) to carry out; (lavoro) to do; avere svoluto"
"svolgersi","vr. (accadere) to happen; THEAT, LIT to be set; essersi svolguto"
"svuotare","vt. (vuotare) to empty; avere svuotato"