"stupirsi","vr. <stupisco> (meravigliarsi) to be amazed; essersi stupito"
"subire","vt. <subisco> (ingiuria, danni, conseguenze) to suffer; avere subito"
"succedere","vi. <succedo> (avvenire) to happen; essere successo"
"sudare","vi. to sweat; avere sudato"
"suggerire","vt. <suggerisco> THEAT to prompt; (consigliare) to suggest; avere suggerito"
"suonare","vt. MUS to play; (orologio) to strike, (campana, campanello) to ring; vi. (campana, telefono) to ring, (sveglia) to go off; MUS to play; (parole, frasi) to sound; essere suonato"
"supporre","vt. to suppose; avere"
"suscitare","vt. (reazione, odio, entusiasmo) to arouse; avere suscitato"
"svanire","vi. <svanisco> to disappear; essere svanito"
"svegliare","vt. (dal sonno) to wake (up); (animare: persone) to liven up; (suscitare: emozioni) to awaken; avere svegliato"
"svegliarsi","vr. to wake up; essersi svegliato"
"svelare","vt. (segreto, verità) to reveal; avere svelato"
"svenire","vi. to faint; essere svenuto"
"sviscerare","vt. (argomento, questione) to analyze in depth; avere sviscerato"
"svolgere","vt. (gomitolo) to unwind; (idea, tema) to set out, (programma, piano) to carry out; (lavoro) to do; avere svoluto"
"svolgersi","vr. (accadere) to happen; THEAT, LIT to be set; essersi svolguto"
"svuotare","vt. (vuotare) to empty; avere svuotato"
"tacere","vt. <taccio> (non rivelare) to say nothing about; vi. <taccio> (stare in silenzio) to be quiet, (non opporsi) to keep quiet; (non esprimersi, non riferire) to keep silent; avere taciuto"
"tagliare","vt. (gener) to cut, (albero) to cut down; (in parti) to cut up; (staccare con un taglio) to cut off; (vino) to blend; (attraversare) to cut across; avere tagliato"
"tenere","vt. <tengo> (in mano, in braccio) to hold, (non lasciar sfuggire) to hold onto; (mantenere) to keep; (contenere) to hold; (discorso, conferenza) to give, (riunione) to hold; (occupare) to take up, (dominare) to hold; avere tenuto"
"tenersi","vr. <tengo> (reggersi) to hold on; (mantenersi) to keep; (trattenersi) to keep o.s.; essersi tenuto"
"tentare","vt. (provare) to try; (allettare) to tempt; avere tentato"
"tirare","vt. (carro) to pull, (cassetto) to open, (tenda) to draw; (fune) to stretch; (dente) to take out; (linea) to trace; (lanciare) to throw; (sparare: colpo) to fire; (dare) to give; (stampare) to print; vi. to pull; (vento) to blow; (abito) to be tight; (camino) to draw; (sparare) to shoot; avere tirato"
"toccare","vt. (gener) to touch; (tasto) to touch; (giungere) to reach; (argomento) to touch on; (commuovere) to touch; (riguardare) to concern; essere toccato"
"togliere","vt. <tolgo> (rimuovere) to take away, (dente) to take out, (vestito, cappello) to take off; (privare di: diritto) to withdraw; (divieto) to remove; avere tolto"
"togliersi","vr. <tolgo> to remove o.s.; essersi tolto"
"tollerare","vt. (sopportare, ammettere) to tolerate; (reggere a: freddo, alcolici) to take; avere tollerato"
"tornare","vi. (venire di nuovo) to come back, (andare di nuovo) to go back; (ridiventare) to become again; essere tornato"
"traboccare","vi. (liquido) to overflow; (recipiente) to overflow; avere traboccato"
"tracciare","vt. (linea, quadrato) to draw; (strade, ferrovie) to mark out; (discorso, lettera) to draft; avere tracciato"
"tradire","vt. <tradisco> (gener) to betray; (coniuge) to cheat on; (promessa, patto) to break; avere tradito"
"tradirsi","vr. <tradisco> to give o.s. away; essersi tradito"
"tradurre","vt. <traduco> (testo) to translate; (sentimento) to put into words; (detenuti) to transfer; avere tradotto"
"trafiggere","vt. <trafiggo> to pierce; avere trafitto"
"tramandare","vt. to hand down; avere tramandato"
"tranquillizzare","vt. to reassure; avere tranquillizzato"
"trascinare","vt. (tirare) to drag; (oratore, entusiasmo) to enthuse; avere trascinato"
"trascinarsi","vr. (persona) to drag o.s.; (faccenda, questione) to drag on; essersi trascinato"
"trascorrere","vt. (vacanze, giornata) to spend; vi. (tempo) to pass; essere trascorso"
"trasferire","vt. <trasferisco> (gener) to transfer; (cosa) to transport; avere trasferito"
"trasferirsi","vr. <trasferisco> to move; essersi trasferito"
"trasmettere","vt. (diritto, malattia, notizia) to pass on, (eredità) to hand down; (ordine) to give, (lettera, dati) to send; RADIO, TV to broadcast; vi. to broadcast; avere trasmesso"
"trasmettersi","vr. (eredità) to be handed down; (malattia, virus) to be spread; essersi trasmesso"
"trattare","vt. (gener) to treat; (argomento, pratica) to deal with; (affare, compravendita) to negotiate; COMM (articoli) to sell; avere trattato"
"trattarsi","vr. to treat o.s.; essersi trattato"
"trattenere","vt. (far rimanere: in ospedale) to keep, (in questura) to detain; (non dare) to withhold; (detrarre: somma) to deduct; (riso, pianto) to keep back, (trattenere il fiato) to hold one&#39;s breath; avere trattenuto"
"trattenersi","vr. (astenersi) to help o.s.; (fermarsi) to stay; essersi trattenuto"
"travolgere","vt. (trascinare via) to sweep away, (con veicolo) to run over; (sentimento) to overwhelm; avere travolto"
"tremare","vi. (fiamma, terra) to shake; (persona, voce) to tremble; avere tremato"
"trovare","vt. (gener) to find; (pensare) to think; avere trovato"
"trovarsi","vr. (essere) to be; (incontrarsi) to meet; essersi trovato"
"turbare","vt. (cerimonia, svolgimento) to disrupt; (pace, rapporto) to disturb; (persona) to upset; avere turbato"
"turbarsi","vr. (agitarsi) to get upset; essersi turbato"
"ubbidire","vi. to obey; avere ubbidito"
"uccidere","vt. to kill; avere ucciso"
"uccidersi","vr. (suicidarsi) to kill o.s.; (vicendevolmente) to kill each other; (perdere la vita) to be killed; essersi ucciso"
"ultimare","vt. (finire: lavoro, opera, cottura) to complete; avere ultimato"
"umiliare","vt. (offendere) to humiliate; avere umiliato"
"umiliarsi","vr. (abbassarsi) to humiliate o.s.; essersi umiliato"
"unire","vt. <unisco> (collegare: fili, cavi, tessuti) to join; (aggiungere) to add; (allegare) to enclose; (persone) to unite; avere unito"
"unirsi","vr. <unisco> (legarsi) to be united; (associarsi) to join together; essersi unito"
"urlare","vt. (dire a voce alta) to shout; (cantare a voce alta) to belt out; vi. (persona, scimmia) to scream; (parlare forte) to shout; (vento) to howl; avere urlato"
"usare","vt. (adoperare, impiegare) to use; (vestiti) to wear; essere usato; vi. (essere di moda) to be fashionable; (impersonale) to be the custom; avere usato"
"uscire","vi. <esco> (gener) to come out, (andare fuori, per svago) to go out, (da veicolo, carcere, ospedale) to get out; (da situazione) to emerge; COMPUT to quit; essere uscito"
"vacillare","vi. (barcollare: persona) to stagger; (oscillare: cosa) to wobble, (fiamma) to flicker; (governo, impero) to totter; (persona, sentimento) to waver; avere vacillato"
"vagabondare","vi. (fare il vagabondo) to live as a vagrant; (girovagare) to wander; avere vagabondato"
"vagheggiare","vt. (successo, vittoria) to long for; avere vagheggiato"
"valere","vi. <valgo> (essere capace) to be good; (avere efficacia: legge) to be valid, (norma) to apply; (essere valido) to be valid; (costare) to be worth; (essere uguale a) to be the same as; essere valso"
"valere","vt. <valgo> (rendere) to earn; (procurare) to earn; essere valso"
"valutare","vt. COMM (stimare) to value; (calcolare) to estimate; (apprezzare: capacità, qualità, azione) to value; (esaminare: conseguenze) to evaluate; (a scuola, nei concorsi) to mark; avere valutato"
"varcare","vt. (oltrepassare: fiume, confine, soglia) to cross; (superare: limite) to overstep, (età) to pass; avere varcato"
"variare","vt. (modifica) (modificare: data, programma) to change; (diversificare: alimentazione) to vary; MUS to vary on; avere variato; vi. (subire cambiamenti) to vary; essere variato"
"vedere","vt. <vedo> (gener) to see; (visitare: museo, mostra) to visit; (esaminare: giornale, legge, questione) to look at; avere visto"
"vedersi","vr. <vedo> (vedere se stessi) to see o.s.; (incontrarsi, frequentarsi) to see (one another); (riconoscersi) to see o.s.; (trovarsi in una situazione) to be; essersi visto [o veduto]"
"vegliare","vt. (assistere: malato, morto) to keep vigil for; vi. (restare sveglio) to keep vigil; (stare attenti) to keep a watch; avere vegliato"
"vendere","vt. (smerciare) to sell; (tradire) to sell out; avere venduto"
"vendersi","vr. to sell o.s.; essersi venduto"
"venire","vi. <vengo> (gener) to come; (uscire: liquido) to come out; (cadere: pioggia, neve) to fall; (alla mente) to occur; (ricordare) to remember; (riuscire) to turn out (well); (risultare: numero) to come to, (nel lotto, nella tombola) to come up; (costare) to come to; (spettare) to come out; (nascere) to arrive; (crescere: pianta) to come up; (con participio passato) to be; essere venuto"
"vergognarsi","vr. (essere mortificato) to be ashamed; (imbarazzarsi) to be embarrassed; (essere timido) to be shy; essersi vergognato"
"verificare","vt. (provare: qualità, funzionamento) to test, (documento, firma, affermazione) to check, (bilancio, conto) to audit; (nella scienza: convalidare) to confirm; avere verificato"
"verificarsi","vr. (accadere: fatto) to happen; (avverarsi: ipotesi, previsione) to prove to be true; essersi verificato"
"versare","vt. (liquido, farina, zucchero) to pour; (spandere) to spill; (soldi) to deposit; avere versato"
"versarsi","vr. (spargersi, rovesciarsi addosso) to spill; (fiume) to flow; essersi versato"
"vestire","vt. (abbigliare) to dress; (fornire di vestiti) to clothe; (indossare: abito, uniforme, taglia) to wear; (cadere) to fit; vi. (abbigliarsi in un certo modo) to dress; avere vestito"
"vestirsi","vr. (abbigliarsi) to get dressed; (abbigliarsi in un certo modo) to dress; essersi vestito"
"viaggiare","vt. (percorrere) to travel; vi. (persona, treno, merce) to travel; (come professione) to be a traveling salesperson; (fantasticare) to travel; avere viaggiato"
"vietare","vt. (proibire) to prohibit; avere vietato"
"vincere","vt. <vinco> (superare: nemico, avversario) to beat; (guerra, concorso) to win; (ottenere: premio) to win, (posto, cattedra) to obtain; (superare: difficoltà, timidezza) to overcome; vi. <vinco> (prevalere) to win; avere vinto"
"vincersi","vr. <vinco> (dominarsi) to control o.s.; essersi vinto"
"visitare","vt. (medico) to examine; (luogo: città, museo) to visit; (andare a trovare: amici, parenti) to visit with; (ispezionare) to inspect; avere visitato"
"vivere","vt. <vivo> (condurre: vita) to lead; (passare) to live through; (sentire: dolore, gioia, fede) to live through; (parte, personaggio) to live; (godere) to enjoy; vi. <vivo> (gener) to live; (durare, sopravvivere) to live on; essere vissuto"
"volare","vi. (gener) to fly; (piuma, foglia, polvere) to fly around; (precipitare) to fall; (correre) to fly along; (diffondersi: notizia, diceria, calunnia) to travel fast; (tempo) to fly by; essere volato"
"volere","vt. <voglio> (intenzione, desiderio) to want; (decidere: potenza superiore) to will; (prescrivere: legge, regolamento) to demand; (richiedere) to require; LING (reggere) to take; avere voluto"
"volersi","vr. <voglio> ; essersi voluto"
"votare","vt. (sottoporre a voto: legge, delibera, emendamento) to vote on; (approvare: legge) to pass; (sostenere con voto: candidato, partito) to vote for; (consacrare, dedicare) to devote; vi. (partecipare al voto) to vote; avere votato"
"votarsi","vr. REL (offrirsi) to devote o.s.; (dedicarsi) to dedicate o.s.; essersi votato"
"zoppicare","vi. (persona) to limp; (periodo) to lose its rhythm, (ragionamento) to be full of holes; avere zoppicato"
"abbagliante, -i","adj. (luce) dazzling"
"abbastanza","adj. inv. (a sufficienza) enough"
"abituale, -i","adj. usual"
"accanito, -a","adj. (discussione) heated; (lavoratore) tireless; (sostenitore, lettore) keen; (giocatore) hardened"
"accolto, -a","adj. welcomed"
"affettuoso, -a","adj. (persona) affectionate; (parole) fond"
"affidabile, -i","adj. reliable"
"affranto, -a","adj. (prostrato dal dolore) overcome, (spossato, logorato) exhausted"
"agevole, -i","adj. (comodo: strada) smooth; (facile: lavoro, viaggio) easy"
"agghiacciante, -i","adj. (scena, film, racconto) chilling; (urlo, lamento) bloodcurdling"
"allegro, -a","adj. (carattere, persona, colore) cheerful"
"alto, -a","adj. (sviluppato in altezza: edificio, albero) tall, (montagna, muro) high; (statura) tall; (elevato: prezzo, stipendio) high; (allegro: morale) high; GEO (in luogo elevato) upper; (profondo: acqua, mare) deep; (tessuto) wide; (acuto: suono, voce) high; fig. (eminente: carica, ufficiale) high"
"altro, -a","adj. (distinto) different; (ulteriore) another; (passato) last; (prossimo) next"
"amareggiato, -a","adj. bitter, embittered"
"ambientato, -a","adj. (film, racconto) set"
"ambizioso, -a","adj. ambitious"
"amichevole, -i","adj. (trattamento, parita) friendly; (accordo) amicable"
"ammalato, -a","adj. sick"
"ammaliato, -a","adj. bewitched"
"amorevole, -i","adj. (padre, madre, sguardo, cure) loving"
"ampio, -a","adj. (spazioso: strada) wide; (abbondante: abito) loose; (esauriente: spiegazione) full; (esteso: garanzia) ample"
"analogo, -a","adj. (simile: compito, circostanza, caso) similar"
"angusto, -a","adj. (stretto: sentiero, passaggio, locale) narrow; fig. (meschino: logica, pensiero) narrow-minded"
"annoiato, -a","adj. bored"
"anonimo, -a","adj. (gener) anonymous; (insignificante: stile, cerimonia, colorazione) colorless"
"anteriore, -i","adj. (davanti: routa, sedile) front; (precedente: data) previous"
"antico, -a","adj. HIST (epoca, popolo, arte) ancient; (non recente: mobile, oggetto, quadro) antique"
"antipatico, -a","adj. <-ci, -che> (persona) not likeable, disagreeable; (problema, malessere) unpleasant"
"aperto, -a","adj. (gener) open"
"appartato, -a","adj. (luogo) secluded"
"appassionato, -a","adj. (giocatore, musicista) enthusiastic; (parole, appello, sguardo) passionate"
"appeso, -a","adj. hung (up)"
"approssimativo, -a","adj. (non preciso: calcolo, cifra, dati, misura) approximate; (vago: lettura, risposta) vague"
"arcaico, -a","adj. (civiltà, rito, valori) archaic"
"ardente, -i","adj. (sole) blazing; (clima) blazing hot; (passione, desiderio) burning"
"arrabbiato, -a","adj. (irato) angry"
"assente, -i","adj. (non presente: da scuola) absent, (per lavoro) away; (inesistente) non-existent; (distratto: aria, sguardo) distracted"
"assurdo, -a","adj. (comportamento, idea, storia) ridiculous"
"attento, -a","adj. (concentrato: interlocutore, ascolto) attentive; (diligente: scolaro) diligent; (accurato: analisi) careful"
"attrezzato, -a","adj. equipped"
"autorevole, -i","adj. (potente: scienziato) authoritative; (competente: giudizio, parere) definitive"
"avventato, -a","adj. (giudizio, atto) rash; (persona) reckless"
"avversario, -a","adj. rival"
"avvilito, -a","adj. (scoraggiato) discouraged"
"avvincente, -i","adj. (racconto, spettacolo) gripping"
"avvolto, -a","adj. wrapped"
"azzeccato, -a","adj. perfect; (risposta) correct"
"bagnato, -a","adj. (con liquido) wet; (umido) damp"
"basso, -a","adj. (di statura) short; (edificio, muro, tacco) low; (inferiore: ripiano, parte, livello) lower; (d'intensità: pressione, temperatura) low; (non profondo: acqua) shallow; (prezzi) cheap; (debole: voce) soft"
"bello, -a","adj. (carino: auto, casa, donna, bambino) beautiful, (uomo) handsome; (piacevole: camminato, viaggio) lovely; (buono: idea, libro, film, voto) good; (sereno: tempo) fine; (nobile: gesto) kind"
"bollente, -i","adj. (acqua, caffè) boiling (hot); fig. (temperamento, carattere) fiery"
"bravo, -a","adj. (abile: artigiano, dottore) capable; (per bene: ragazza) nice; (buono: marito, padre, bambino) good"
"breve, -i","adj. short, brief"
"brutto, -a","adj. (non bello: persona, quadro, spettacolo) ugly; (abitudine, momento) bad; (nuvoloso: tempo, giornata) horrible; (pesante: scherzo, tiro) nasty; (forte: raffreddore) heavy, (tosse) bad"
"buono, -a","adj. (albergo, libro, voto) good; (gentile: persona, animo) kind; (calmo: bambino, cane) good; (abile: medico, avvocato, artigiano) good; (utilizzabile: attrezzatura, auto) good; (propizio: momento) right; (giusto: ragione) valid; (gradevole: odore) nice; (delizioso: pranzo, vino) delicious; (valido: biglietto) valid, (bancanote) genuine; (temperato: clima) temperate; (sano, robusto) healthy"
"burrascoso, -a","adj. stormy"
"caldo, -a","adj. (clima, giornata, fronte) warm, hot; (acqua, cibo) hot; (che tiene caldo: cappotta, sciarpa) warm; (colore, voce) warm; (di conflitto: zona, città, anni) turbulent; (passionale) passionate"
"capace, -i","adj. (in grado di) capable; (abile) able; (spazioso: ambiente) spacious, (borsa, valigia) capacious"
"carico, -a","adj. <-chi, -che> (pieno) loaded; (persona) laden; (pistola) loaded, (batteria) charged, (orologio, sveglia) wound up"
"caro, -a","adj. (amato) dear; (gentile) kind; (pregiato) precious; (costoso: negozio, prodotto) expensive"
"cattivo, -a","adj. (gener) bad, wicked; (irrequieto: bambino) naughty;"
"celato, -a","adj. concealed, hidden"
"certo, -a","adj. (indubbio, sicuro) definite; (garantito, sicuro) certain; (convinto) sure; (qualche) certain; (non definito) certain; (di tale genere) such; (tale) certain"
"chiaro, -a","adj. (delicato: colore, legno, birra, occhi) light, (pelle, capelli) fair; (luminoso: giorno, luce) bright; (limpido: cielo, acqua) clear; (comprensibile: stile) clear; (netto, deciso: rifiuto) flat"
"chiuso, -a","adj. (finestra, libro, ombrello, occhi) closed; (acqua, gas) turned off; (strada, passaggio) closed; (non più attivo: fabbrica, negozio) closed down; (temporaneamente: scuola, museo) closed; (concluso: capitolo) closed; (riservato: persona) reserved"
"ciascuno, -a","adj. <sing> each"
"cieco, -a","adj. <-chi, -che> blind"
"circondato, -a","adj. surrounded"
"colmo, -a (di)","adj. fig. full (of)"
"combattuto, -a","adj. (confuso: persona) undecided, (decisione) difficult; (contrastato: partita) hard-fought"
"comico, -a","adj. (della commedia: attore) comic(al), (buffo: scena, film) funny"
"commosso, -a","adj. (di emozione: momento, storia, cerimonia) moved, touched"
"commovente, -i","adj. moving"
"comune, -i","adj. (di tutti) common; (di due o più persone: interessi) common, (amico) mutual; (diffuso: opinione, uso) common; (medio, normale) ordinary; (ordinario: sale) common; (non raffinato: gente) ordinary"
"consapevole, -i","adj. (persona) aware"
"contento, -a","adj. (soddisfatto) pleased; (lieto) happy"
"coperto, -a","adj. (struttura) covered, (luogo) indoor; FIN (assegno, rischio) covered; METEO (cielo, tempo) overcast"
"corpulento, -a","adj. stout, corpulent"
"corretto, -a","adj. (affermazione, risposta, persona, comportamento) correct; (compito, bozza) corrected"
"corto, -a","adj. short"
"costoso, -a","adj. (caro) expensive (costly)"
"cruento, -a","adj. (battaglia. film, immagine) bloody"
"cupo, -a","adj. (colore) dark; (notte, foresta) pitch-black; (voce) deep; (volto, sguardo) sullen"
"davanti","adj. <inv> front"
"debole, -i","adj. weak"
"dedito, -a","adj. dedicated"
"deluso, -a","adj. disappointed"
"demoralizzato, -a","adj. demoralized"
"diafano, -a","adj. (trasparente) diaphanous; (delicato: mani, pelle) transparent"
"difficile, -i","adj. (gener) difficult; (improbabile) unlikely; "
"diffidente, -i","adj. distrustful"
"diligente, -i","adj. (persona) diligent; (lavoro) careful"
"diritto, -a","adj. straight"
"discutibile, -i","adj. (soggetto a critique: opinione, scelta) dubious"
"disordinato, -a","adj. (stanza) untidy; (idea, racconto) incoherent; (vita, alimentazione) disorderly"
"distrutto, -a","adj. destroyed"
"diverso, -a","adj. (differente) different; pl. (vari) various"
"divertente, -i","adj. (buffo) entertaining; (piacevole) enjoyable"
"dolcificante, -i","adj. sweetening"
"durevole, -i","adj. durable"
"duro, -a","adj. (gener) hard; (ostinato) stubborn; (freddo) harsh"
"economico, -a","adj. <-ci, -che> (dell'economia: crisi, criterio, settore) economic; (poco costoso: albergo, vacanze, volo) cheap, inexpensive"
"emozionato, -a","adj. excited"
"ennesimo, -a","adj. fam. umpteenth; MATH nth"
"equivoco, -a","adj. <-ci, -che> (ambivalente: frase, risposta) ambiguous; (losco: persona, luogo) dubious"
"esigente, -i","adj. (persona, cliente, pubblico) demanding"
"estenuante, -i","adj.(attesa, lavoro, negoziati) lengthy"
"esterno, -a","adj. (fuori: lato) outer; (fuori casa: parete, porta, pavimentazione) outdoor, (da fuori: nemico, pericolo) external"
"estraneo, -a","adj. <-ei, -ee> (non conosciuto) unknown; (esterno) external; (non coinvolto) uninvolved"
"facile, -i","adj. (lavoro, esercizio, testo, guadagno) easy; (probabile) likely; (poco serio) easy"
"falso, -a","adj. (non vero: notizia, indizio) false; (errato: idea, sospetto) mistaken; (non sincero: sorriso, lacrime) fake; (falsificato: denaro) counterfeit, (quadro, gioielli) fake"
"familiare, -i","adj. (vita, nucleo) family; (consueto: viso, linguaggio) familiar; (affabile: modi, tono) familiar, (semplice: pensione, trattamento) friendly; LING informal"
"famoso, -a","adj. famous"
"fantastico, -a","adj. <-ci, -che> (irreale) imaginary; (straordinario) fantastic"
"felice, -i","adj. happy"
"fitto, -a","adj. (folto: bosco) dense, (pelo) thick; (compatto: pettine, rete) fine; (denso: pioggia) heavy, (buio) pitch, (nebbia) dense; (mistero) impenetrable"
"folgorante, -i","adj. (luce) dazzling; (ardente: amore, passione) intense; (brillante: idea) brilliant; (intenso: sguardo) withering"
"folle, -i","adj. (persona, idea, spesa) crazy; AUTO neutral"
"fondo, -a","adj. (profondo) deep"
"forbito, -a","adj. fig. (raffinato: linguaggio, stile) elegant"
"forestiero, -a","adj. foreign"
"forte, -i","adj. (robusto) strong; (determinato: persona, carattere) string; (elevato: somma) large; (acuto: dolore) intense; (intenso: colore) bright, (sapore, odore) strong"
"freddo, -a","adj. (acqua, vento, mani) cold; fig. (distaccato) cool"
"frizzante, -i","adj. (bibita) fizzy, (vino) sparkling; (aria) crisp"
"funzionale, -i","adj. functional"
"funzionante, -i","adj. (meccanismo, sistema, relazione) functioning"
"furibondo, -a","adj. (persona, lotte) furious"
"garbato, -a","adj. (gentile) kind, (educato) polite"
"gelato, -a","adj. (mani, piedi) frozen"
"geniale, -i","adj. (persona, idea, trovata, invenzione) brilliant"
"gentile, -i","adj. (persona) kind, (maniere) courteous; (sentimenti, animo) gentle"
"gigantesco, -a","adj. <-schi, -sche> gigantic"
"giusto, -a","adj. (equo: persona, causa, punizione) just; (vero: osservazione, informazioni) true; (adeguato: salario, prezzo, momento) right; (corretto: risposta, conto) correct"
"gracile, -i","adj. (esile) slender; (debole) frail"
"grande, -i","adj. (vasto) big, (largo) wide; (alto: persona) tall; (di età) big, (adulto) grown-up; fig. (bravo) brilliant; (intenso) great"
"grasso, -a","adj. (persona) fat; (pelle, capelli) greasy; (carne, formaggio, brodo) fatty; (cucina, cibo) rich; (fertile) fertile; fig. (ricco: guadagno) rich"
"grezzo, -a","adj. (materiali, prodotti) raw, (petrolio) crude, (diamante) uncut, (tessuto) unbleached; (grossolano) rough"
"guasto, -a","adj. (rotto) broken; (frutta, uova) rotten; (dente) decayed"
"ibrido, -a","adj. hybrid"
"ibrido, -a","adj. hybrid"
"imbranato, -a","adj. awkward"
"impagabile, -i","adj. (favore, servizio) incomparable; (persona) invaluable"
"imparentato, -a","adj. (famiglia, persona) related"
"impegnativo, -a","adj. (lavoro, compito) demanding; (cena, abito) formal; (firma, promessa) binding"
"imponente, -i","adj. impressive"
"imprecisato, -a","adj. unspecified"
"imprendibile, -i","adj. (palla, giocatore, corridore) uncatchable; (ladro, assassino) elusive"
"impressionante, -i","adj. (incidente, delitto, scena) shocking; (eccezionale) incredible"
"incalzante, -i","adj. (domande, richieste) urgent, (ritmo) insistent"
"incapace, -i","adj. (nella professione) incompetent"
"inchiodato, -a","adj. (persona) glued"
"incompiuto, -a","adj. (progetto, opera) unfinished"
"inconfondibile, -i","adj. (voce, stile) unmistakable"
"inconsapevole, -i","adj. (persona) unaware; (gesto) unconscious"
"indecifrabile, -i","adj. (scrittura, messaggio) indecipherable; (persona, sguardo) unreadable"
"indimenticabile, -i","adj. (fatto, persona) unforgettable"
"ineluttabile, -i","adj. (di destino, , evento) inevitable"
"inesistente, -i","adj. inexistent"
"infetto, -a","adj. (ferita, persona) infected; (acqua, aria) polluted"
"innamorato, -a","adj. in love"
"innegabile, -i","adj. (principio, verità) undeniable"
"inquietante, -i","adj. (silenzio, atmosfera) worrying; (film, libro, sogno) disturbing"
"inquieto, -a","adj. (agitato) restless; (preoccupato) worried"
"insofferente, -i","adj. (persona, carattere) impatient"
"insolito, -a","adj. unusual"
"insopportabile, -i","adj. (dolore, caldo, persona) unbearable; (affronto, prepotenza) intolerable"
"insulso, -a","adj. (discorso, comportamento, film) silly; (persona) dull"
"insuperabile, -i","adj. (montagna, distanza, difficoltà) insuperable; (persona) unequalled; (qualità, modello, prodotto) unbeatable"
"interiore, -i","adj. (parte, lato) internal; (spirituale) inner"
"intero, -a","adj. (completo) whole; (intatto) whole"
"intorno, -a","adj. <inv> surrounding"
"intrappolato, -a","adj. trapped"
"irrefrenabile, -i","adj. (impulso, slancio) uncontrollable"
"irreprensibile, -i","adj. (persona) irreproachable; (comportamento, vita) faultless"
"isolato, -a","adj. (luogo, caso, persona) isolated; PHYS, TECH (parete, stanza) insulated"
"laborioso, -a","adj. (operoso) hard-working; (difficile: operazione, procedura) laborious"
"lampo, -a","adj. <inv> (veloce) lightning"
"lancinante, -i","adj. (dolore) piercing"
"lattiginoso, -a","adj. (simile al latte) milky"
"lezioso, -a","adj. (stile) affected"
