"condurre a termine qc","fig. to complete sth"
"confondere","vt. to confuse; avere confuso"
"confondersi","vr. (mescolarsi) to mingle; (immagini, suoni, colori) to merge; (sbagliarsi) to get confused; (turbarsi) to get flustered; essersi confuso"
"confondersi tra la folla","to mingle with the crowd"
"confrontare","vt. (offerte, prezzi, tariffe) to compare; avere confrontato"
"conoscere","vt. <conosco> (persona, metodo, ristorante, lingua) to know; (incontrare) to meet; avere conosciuto"
"conosco i miei polli","hum. I know who I'm dealing with"
"conoscersi","vr. <conosco> (incontrarsi) to meet; (essere amici) to know each other; essersi conosciuto"
"conquistare","vt. (ottenere: diritto, potere, libertà) to gain; MIL to conquer; (persona) to win over, (amicizia, amore, simpatia) to win; avere conquistato"
"consegnare","vt. (recapitare: posta, merce) to deliver; (affidare) to hand over; avere consegnato"
"considerare","vt. (tenere conto, ritenere) to consider; (esaminare) to examine; avere considerato"
"consistere","vi. (essere composto di) to consist; essere consistito"
"consistere di qc","to consist of sth"
"consolare","vt. (bambino) to console, (confortare) to comfort; (rallegrare) to cheer up; avere consolato"
"consolarsi","vr. (trovare conforto) to console o.s., be comforted; (rallegrarsi) to cheer up; essersi consolato"
"consolarsi di qc","to console oneself with sth"
"constatare","vt. (notare) to notice, to note, observe; avere constatato"
"consumare","vt. (rovinare: scarpe, cinturino, gomme) to wear out; (mangiare: pasti, cibo) to consume; (matrimonio) to consummate, (delitto) to commit; avere consumato"
"consumarsi","vr. (logorarsi: scarpe, gomme) to wear out; essersi consumato"
"contagiare","vt. to infect; avere contagiato"
"contare","vt. (numerare, calcolare) to count; vi. (numeri) to count; (valere) to count; avere contato"
"contare i giorni/le ore/i minuti","fig. to count the days/the hours/the minutes"
"contare di fare qc","to count on doing sth"
"contare su qu/qc","to count on sb/sth"
"contenere","vt. (accogliere: persone, cose) to contain; (trattenere: lacrime) to hold back, (sdegno) to keep in check, (entusiasmo) to contain; avere contenuto"
"contenersi","vr. (moderarsi) to contain o.s.; essersi contenuto"
"continuare","vi. (durare) to continue; avere continuato"
"contraddire","vt. to contradict; avere contraddetto"
"contraddirsi","vr. to contradict o.s.; essersi contraddetto"
"contrarre","to contract (a disease), catch; avere contratto"
"controllare","vt. (documenti, biglietti, risposta) to check; (attività) to keep a watch on; (mercato, avversario, gesti, emozioni) to control; avere controllato"
"controllarsi","vr. to control o.s.; essersi controllato"
"convertire","vt. COMPUT, TELEC, FIN to convert; avere convertito"
"convertire qu a qc","to convert sb to sth"
"convertire qc in qc","to convert sth into sth"
"convertirsi","vr. to be converted; essersi convertito"
"convertirsi in qc","to be converted into sth"
"convertirsi a qc","to convert to sth"
"convincere","vt. to convince; avere convinto"
"convincere qu (di qc)","to convince sb (of sth)"
"convincersi","vr. to convince o.s. ; essersi convinto"
"convincersi (di qc)","to be convinced (of sth)"
"coprire","vt. <copro> (gener) to cover; (carica) to hold; avere coperto"
"coprirsi","vr. <copro> FIN to cover o.s.; (cielo) to become overcast; (con vestiti) to wrap up; essersi coperto"
"coprirsi di qc","to cover oneself with sth"
"correggere","vt. (compiti, difetto, errore) to correct; avere corretto"
"correggersi","vr. to correct o.s.; essersi corretto"
"correre","vt. <corro> SPORTS (distanza) to run, (gara) to race in; (rischio) to run; <corro> (persona) to run; (in auto, moto) to drive fast; SPORTS (gareggiare) to race; (strade) to run; (tempo) to fly; essere corso"
"correre dietro a qu","fig. to chase after sb"
"corrompere","vt. (con denaro) to bribe; (moralmente) to corrupt; (acqua, aria) to contaminate; avere corrotto"
"corrompersi","vr. (depravarsi) to be corrupted; essersi corrotto"
"costeggiare","vt. NAUT to sail along; (strada, sentiero) to run along the side of; avere costeggiato"
"costituire","vt. <costituisco> (fondare: società) to set up; (rappresentare) to constitute; (formare) to make up; avere costituito"
"costituirsi","vr. <costituisco> LAW (consegnarsi alla giustizia) to turn oneself in; (formarsi) to be formed; essersi costituito"
"costringere","vt. to force, compel; avere costretto"
"costringere qu a fare qc","to force sb to do sth"
"costruire","vt. <costruisco> arch (edificare: casa, muro) to build; TECH (assemblare: motore, macchinario) to construct; (società, vita) to build; avere costruito"
"covare","vt. ZOOL (uova) to sit on; (malattia) to go down with; fig. (odio, sospetto) to nurture; vi. ZOOL to sit on its eggs; fig. (stare celato) to smolder; avere covato"
"credere","vt. <credo> (ritenere vero) to believe; (ritenere) to think; (ritenere opportuno) to think; vi. <credo> to believe; avere creduto"
"credere in qu/qc","to believe in sb/sth"
"credere a qu","to believe sb"
"crescere","vt. <cresco> (allevare: figli) to raise; vi. <cresco> (svilupparsi: persona, pianta) to grow; (spuntare: denti) to come through; (aumentare) to increase; (diventare adulto) to grow up; essere cresciuto"
"crollare","vi. (costruzione) to collapse; (persona) to break down, (Stato) to fall; (prezzi, azioni) to fall, (borsa) to crash; essere crollato"
"cucinare","vt. (pasto) to cook; vi. to cook; avere cucinato"
"cucire","vt. (orlo, abito) to sew; (ferita) to sew up; avere cucito"
"cuocere","vt. <cuocio> to cook, (bollire) to boil, (in padella) to fry, (in umido) to stew, (in forno) to bake; (ceramiche, mattoni, calcina) to fire; vi. <cuocio> to cook; essere cotto"
"dare","vt. <do> (produrre: frutti) to produce; (fare: lezione) to give; (dire) to call; (pagare) to pay; vi. <do> to give; avere dato"
"dare qc a qu","to give sth to sb"
"dare una notizia a qn","to give sb some news"
"dare un consiglio a qn","to give sb some advice"
"dare un esame","to take an exam"
"dare una festa","to have a party"
"dare su qc","to overlook sth"
"dare peso a qc","to give weight to sth"
"dare qc da fare a qn","to give sb sth to do"
"dare da mangiare a qn","to give sb sth to eat"
"dare da bere a qn","to give sb sth to drink"
"darsi","vr. <do> (dedicarsi) to devote o.s. to; essersi dato"
"decidere","vt. <decido> (stabilire) to decide, (scegliere) to choose; vi. <decido> to decide; avere deciso"
"decidere di fare qc","to decide to do sth"
"decidere di qc","to decide about sth"
"decidersi","vr. <decido> to make up one's mind; essersi deciso"
"decidersi a fare qc","to make up one's mind to do sth"
"decifrare","vt. (scrittura) to decipher, (codice) to work out, (enigma) to find the key to; avere decifrato"
"depositare","vt. (gener) to deposit; (collocare) to put; (in custodia) to leave; avere depositato"
"depositarsi","vr. (materiale sedimento: sabbia, polvere) to settle; essersi depositato"
"deprimere","vt. <deprimo> (avvilire) to depress; avere depresso"
"deprimersi","vr. <deprimo> (avvilirsi) to get depressed; essersi depresso"
"descrivere","vt. to describe; avere descritto"
"desiderare","vt. to want, (sessualmente) to desire; avere desiderato"
"desiderare fare qc","to want to do sth"
"lasciare a desiderare","to leave a lot to be desired"
"destare","vt. (svegliare) to waken; (suscitare: curiosità, stupore) to cause, (sospetto) to arouse; avere destato"
"destarsi","vr. to awaken; essersi destato"
"determinare","vt. (stabilire) to establish; (causare) to cause; avere determinato"
"detestare","vt. to detest; avere detestato"
"difendere","vt. <difendo> (gener) to defend; (prendere le parti di) to take the part of; avere difeso"
"difendersi","vr. <difendo> (proteggersi) to defend o.s.; (cavarsela) to get by; essersi difeso"
"difendersi da qu/qc","to protect o.s. from sb/sth"
"difendersi contro qu/qc","to protect o.s. against sb/sth"
"diffondere","vt. to spread; avere diffuso"
"diffondersi","vr. (luce, profumo, notizia, moda) to spread; essersi diffuso"
"digerire","vt. <digerisco> MED (cibo) to digest; (accettare: sconfitta) to accept; (sopportare: modi, persona) to stomach; avere digerito"
"dimagrire","vi. <dimagrisco> (perdere peso) to lose weight; essere dimagrito"
"dimenticare","vt. (gener) to forget tempo; (lasciare) to leave; avere dimenticato"
"dimenticarsi","vr. ; essersi dimenticato"
"dimostrare","vt. (mostrare) to show; (provare) to prove; vi. (in corteo) to demonstrate; avere dimostrato"
"dimostrarsi","vr. to turn out to be; essersi dimostrato"
"dipendere","vi. <dipendo> to depend; essere dipeso"
"dipendere da qu/qc","to depend on sb/sth"
"dipingere","vt. <dipingo> (gener) to paint; (descrivere) to portray; avere dipinto"
"dipingere su qc","to paint on sth"
"dire","vt. <dico> (affermare, recitare) to say; (chiedere, raccontare) to tell; (chiamare) to call; avere detto"
"dire di sì/no","to say yes/no"
"dire bugie","to tell lies"
"dir male di qu","to speak ill of sb"
"avere da dire su qu","to have sth to say about sb"
"lasciar dire","to let sth go"
"voler dire","to mean"
"dirigere","vt. <dirigo> (essere a capo di: azienda) to manage, (lavori, scuola) to run, (orchestra) to conduct; (indirizzare) to direct; avere diretto"
"dirigere qu/qc a [o verso] qu/qc","to direct sb/sth to sb/sth"
"dirigersi","vr. <dirigo> to make one's way; essersi diretto"
"dirigersi verso qu","to make one's way toward sb"
"dirigersi verso [o a] qc","to make one's way toward sth"
"disattivare","vt. (bomba) to defuse; (macchina, impianto) to deactivate; avere disattivato"
"discutere","vt. <discuto> (dibattere) to discuss; (contestare) to doubt; vi. <discuto> (litigare) to argue; avere discusso"
"discutere di [o su] qc","to discuss sth"
"disegnare","vt. (immagine, piantina) to draw; (progettare: veicolo, edificio) to design; (descrivere) to outline; avere disegnato"
"disegnare di fare qc","to intend to do sth"
"disfare","vt. (scomporre: nodo) to undo, (letto) to strip, (cucitura, orlo) to unpick, (bagagli, valigie) to unpack; avere disfatto"
"disfarsi","vr. (nodo) to come undone, (cucitura, orlo) to come unstitched, (cibo) to disintegrate; (famiglia, società) to fall apart; essersi disfatto"
"disfarsi di qc/qu","to get rid of sth/sb"
"disgustare","vt. (infastidire) to disgust; avere disgustato"
"disgustarsi","vr. to be disgusted; essersi disgustato"
"disgustarsi di qc","to be disgusted by sth"
"disperare","vi. to despair, give up hope; avere disperato"
"disperare di qc","to no longer have hope of sth"
"disperare di fare qc","to no longer have hope of doing sth"
"disperarsi","vr. to despair; essersi disperato"
"dispiacere","vi. (causare dispiacere) to upset; essere dispiaciuto"
"distaccare","vt. (separare) to separate; (trasferire) to transfer; SPORTS (gruppo, concorrenti) to outstrip; avere distaccato"
"distaccarsi","vr. (allontanarsi) to detach oneself; (distinguersi) to stand out; essersi distaccato"
"distinguere","vt. <distinguo> (differenziare) to tell; (vedere, sentire) to make out; (rendere riconoscibile: bagagli) to identify, (person) to distinguish; avere distinto"
"distinguersi","vr. <distinguo> (essere riconoscibile) to be distinguished; (emergere) to stand out, be conspicuous, distinguish o.s.; essersi distinto"
"distrarre","vt. (deconcentrare) to distract; (divertire) to entertain; (somma) to subtract; avere distratto"
"distrarsi","vr. (deconcentrarsi) to get distracted; (divertirsi) to enjoy oneself; essersi distratto"
"distruggere","vt. to destroy; avere distrutto"
"diventare","vi. to become; essere diventato"
"divertire","vt. to entertain; avere divertito"
"divertirsi","vr. (svagarsi) to enjoy oneself, (ridere) to laugh; essersi divertito"
"divertirsi a fare qc","to enjoy doing sth"
"dividere","vt. <divido> (gener) to divide; (separare) to separate; (distribuire, condividere) to share; avere diviso"
"dividersi","vr. <divido> (in gruppi, categorie) to divide, (tra attività) to divide one's time; essersi diviso"
"divorare","vt. (preda, piatto, libro) to devour; avere divorato"
"domandare","vt. (per sapere) to ask; (per ottenere) to ask for; avere domandato"
"domandare qc a qu","to ask sb sth"
"domandare un consiglio a qu","to ask sb for advice"
"domandare notizie di qu","to ask sb for news"
"domandare il prezzo di qc","to ask the price of sth"
"domandare un favore a qu","to ask sb for a favor"
"domandarsi","vr. to wonder; essersi domandato"
"dormire","vi. (essere addormentato) to sleep; vt. to sleep; avere dormito"
"dormire in piedi","to be dead tired"
"dormire sonni tranquilli/agitati","to have a good/bad night's sleep, sleep well/badly"
"dovere","vi. <devo> (obbligo, necessità) to have to; avere dovuto"
"durare","vi. (continuare) to last; (mantenersi) to keep; essere durato"
"echeggiare","vi. to echo; essere echeggiato"
"eleggere","vt. to elect; avere eletto"
"elevare","vt. (edificio) to erect; (migliorare) to raise; (aumentare) to increase; avere elevato"
"elevarsi","vr. to rise; essersi elevato"
"eliminare","vt. (togliere: macchia, ostacolo, errore) to remove; (scartare: dubbio, ipotesi) to eliminate; (estromettere: avversario, squadra) to knock out; (uccidere) to rub out; (espellere: tossine) to eliminate; avere eliminato"
"eludere","vt. <eludo> (gen) to evade, elude; avere eluso"
"emergere","vi. <emergo> (venire a galla) to emerge; (risultare) to come out; (eccellere) to stand out; essere emerso"
"emettere","vt. (mandare fuori: luce, radiazione, calore) to emit, (grido, sibilo, suono) to let out; FIN (azioni, titoli, assegno) to issue; LAW (sentenza) to pass, (mandato) to issue; avere emesso"
"entrare dalla porta/finestra","to go in through the door/window"
"entrare in acqua","to get into the water"
"entrare in casa","to go indoors"
"entrare in contatto con qu","fig. to get in touch with sb"
"entrare","vi. (in un luogo) to enter, to go in; (in un gruppo) to join; (vestito) to fit; (trovare posto) to fit; (avere a che vedere) to be relevant; essere entrato"
"esagerare con qc","to go too far with sth"
"esagerare in qc","to overdo sth"
"esagerare","vt. to exaggerate; vi. to exaggerate; avere esagerato"
"esaminare","vt. (studenti) to test; (analizzare: situazione, cause) to study; MED to examine; LAW (testimone) to question; avere esaminato"
"esasperare","vt. (stressare: persona) to exasperate; (aggravare: pena, sofferenza) to aggravate; avere esasperato"
"esasperarsi","vr. (arrabbiarsi) to become exasperated; essersi esasperato"
"esaurire","vt. <esaurisco> (finire: merce) to sell off; avere esaurito"
"esaurirsi","vr. <esaurisco> (finire: sorgente, miniera) to be used up; MED (indebolirsi) to become exhausted; essersi esaurito"
"escludere","vt. <escludo> (eliminare: da gara, concorso) to eliminate, (da lista) to exclude; (dubitare) to rule out; (eccettuare) to exclude; avere escluso"
"esemplificare","vt. (processo, metodo) to exemplify; avere esemplificato"
"esibire","vt. <esibisco> (passaporto, documento) to produce, present; (bravura) to demonstrate, exhibit; (nudità) to display; avere esibito"
"esibirsi","vr. <esibisco> (attore, musicista) to perform; (mettersi in mostra) to show off; essersi esibito"
"esistere","vi. <esisto> (essere) to exist; (esserci) to exist; essere esistito"
"esprimere","vt. <esprimo> (approvazione, giudizio, pensiero) to express; avere espresso"
"esprimersi","vr. <esprimo> (parlare, manifestarsi) to express oneself; essersi espresso"
"essere","vi. <sono> (gener) to be; (trovarsi) to be; (costare) to cost; (provenire) to be; essere stato"
"essere amareggiato da qc","to be bitter about sth"
"essere appassionato di qc","to love sth"
"evitare","vt. (scansare: pericolo, ostacolo) to avoid; avere evitato"
"facilitare","vt. (lavoro, compito) to make easier; COMM (pagamento) to make easy; avere facilitato"
"fallire","vt. <fallisco> (mancare: colpo, bersaglio) to miss; vi. <fallisco> (azienda) to go bankrupt; essere fallito"
"falsificare","vt. (firma, banconota, quadro) to forge; (notizia) to distort; avere falsificato"
"fare","vt. <faccio> (compiere azioni) to do; (creare: quadro) to paint, (poesia) to write; (ideare: progetto, programma) to make; (esercitare: mestiere) to do, (professione) to follow; (ammontare) to be; FOOD (preparare: minestra, frittata) to make; vi. <faccio> (agire) to act; (essere adatto) to do; avere fatto"
"fare il bagno","to take a bath"
"fare colazione","to have breakfast"
"fare un sonnellino","to have a nap"
"fare un favore a qu","to do sb a favor"
"far sapere qc a qu","to inform sb of sth"
"far vedere","to show"
"fare colazione","to have breakfast"
"fare fatica","to struggle"
"fare fatica a fare qc","to have a hard time doing sth"
"fare in modo","to make sure"
"fare la spesa","to do the shopping (groceries"
"fare la vittima","to play the victim"
"fare le pulizie","to do the cleaning"
"fare le valige","to pack"
"fare palestra","to work out"
"fare schifo","to be gross; to suck"
"fare shopping","to do the shopping (general"
"fare sport","to play sports"
"fare un corso","to take a course"
"fare un giro in bicicletta","to take a bike ride"
"fare un giro in macchina","to take a ride by car"
"fare un sogno","to have a dream"
"fare un viaggio","to take a trip"
"fare una bella figura","to make a good impression"
"fare una brutta/cattiva figura","to make a bad impression"
"fare una passeggiata","to take a walk"
"fare una pausa","to take a break"
"fare una brutta fine","fig. to come to a bad end"
"far aspettare qn","to keep sb waiting"
"far cadere qc","to knock down, drop sth"
"far conoscere qn/qc","to make sb/sth known"
"far dire qc a qn","to make sb say sth"
"far divertire qn","to amuse sb"
"far entrare qc","to show, let in sth"
"far fare qc a qn","to have, make, get sb to do sth"
"far fare qc","to have, make, get sth done"
"far pulire qc","to have sth cleaned"
"far ridere qn","to make sb laugh"
"far trovare qc a qn","to help sb find sth"
"far funzionare qc","to make sth work"
"fasciare","vt. (ferita) to bandage; (neonato) to put a diaper on; (aderire: abito) to cling to; avere fasciato"
"faticare","vi. (affaticarsi) to work hard; (incontrare difficoltà) to have trouble; avere faticato"
"ferire","vt. <ferisco> to injure; (offendere) to hurt; avere ferito"
"festeggiare","vt. (anniversario) to celebrate; (persona) to hold a celebration for; avere festeggiato"
"ficcare","vt. (conficcare) to knock; (mettere) to put; avere ficcato"
"ficcare il naso in qc","fig. to stick one's nose into sth"
"ficcarsi","vr. (cacciarsi) to get to; essersi ficcato"
"ficcarsi qc in testa","fig. to get sth into one's head"
"ficcarsi a letto","to get into bed"
"ficcarsi le mani in tasca","to stick one's hands in one's pockets"
"ficcarsi le dita nel naso","to pick one's nose"
"ficcarsi nei guai","fig. to get into trouble"
"fidarsi","vr. to trust; essersi fidato"
"fidarsi di qu/qc","to trust sb/sth"
"finalizzare","vt. to finalize; (indirizzare) to direct, aim; avere finalizzato"
"finalizzare qc a qc","to aim sth at sth"
"fingere","vt. <fingo> form. (gioia, dolore) to feign; vi. <fingo> to pretend; avere finto"
"fingere di fare qc","to pretend to do sth"
"finire","vt. <finisco> (portare a compimento: libro, lavoro) to finish; (smettere) to stop; (esaurire: scorte, soldi) to get through; vi. <finisco> (concludersi) to finish; (terminare) to end; (cacciarsi: persona, cosa) to get to; (capitare) to end up; essere finito"
"finire bene","to end well"
"finire di fare qc","to finish doing sth"
"finire male","to end badly"
"finire in carcere","to end up in prison"
"finire sui giornali","to end up in the papers"
"firmare","vt. to sign; avere firmato"
"focalizzare","vt. (obiettivo) to focus, (immagine) to get into focus; (inquadrare: situazione) to get into perspective; (concentrare: attenzione) to focus; avere focalizzato"
"formare","vt. (modellare: statua) to make; (corteo, cerchio, famiglia, partito) to form; (addestrare: ufficiali, tecnici, atleti) to train; (carattere) to mold; TELEC (numero) to dial; avere formato"
"formarsi","vr. (prodursi) to form; (svilupparsi) to develop; essersi formato"
"fornire","vt. <fornisco> (provvedere) to supply; (informazioni, prova) to provide; avere fornito"
"fornire qu di qc","to supply sb with sth"
"fornire qc a qu","to supply sth to sb"
"fornirsi","vr. <fornisco> to provide o.s.; essersi fornito"
"fornirsi di qc","to provide o.s. with sth"
"friggere","vt. <friggo> to fry; vi. <friggo> (crepitare) to sizzle; (fremere) to tremble; avere fritto"
"fuggire","vi. (scappare) to escape; (passare) fly; vt. to avoid; essere fuggito"
"fuggire via","to get away"
"funzionare","vi. (meccanismo, sistema, relazione) to work; avere funzionato"
"galleggiare","vi. to float; avere galleggiato"
"garantire","vt. <garantisco> (assicurare) to ensure; COMM, LAW to guarantee; avere garantito"
"garantire qc a qu","to guarantee sb sth"
"garantirsi","vr. <garantisco> to insure o.s.; essersi garantito"
"garantirsi contro qc","to insure oneself against sth"
"generare","vt. (figlio) to give birth to; (produrre, causare) to generate; avere generato"
"gestire","vt. <gestisco> (amministrare: albergo, azienda, negozio) to run, (fondi) to manage, (tempo) to organize; avere gestito"
"gettare","vt. (lanciare) to throw; NAUT (ancora) to drop, (reti) to cast; arch (fondamenta) to lay; vi. to sprout; avere gettato"
"gettare via qc","to throw sth away"
"gettarsi","vr. (fiume) to flow into; essersi gettato"
"gettarsi a terra","to throw oneself down on the ground"
"gettarsi ai piedi di qu","to throw oneself at sb's feet"
"gettarsi contro qu","to attack sb"
"gettarsi dalla finestra","to throw oneself out of the window"
"giocare","vt. (partita, carta) to play; (scommettere: somma) to bet; (ingannare) to fool; vi. a. SPORTS (divertirsi, trastullarsi) to play; (scommettere) to bet; FIN to speculate; avere giocato"
"giocare a carte","to play cards"
"giocare a palla","to play ball"
"giocare a flipper","to play pinball"
"giocare ai videogiochi","to play video games"
"giocare con il fuoco","to play with fire"
"giostrarsi","vr. to hold one's own; essersi giostrato"
"girare","vt. (chiave, testa, occhi) to turn; (domanda, lettera) to pass on; (film) to shoot; (assegno) to endorse; (città, isola) to go around; (mescolare: sugo) to stir; (ruotare) to revolve; (camminare) to go around; (voltare) to turn; (notizie, dicerie) to circulate; avere girato"
"girarsi","vr. (voltarsi) to turn; essersi girato"
"gironzolare","vi. to wander about; avere  gironzolato"
"giudicare","vt. a. LAW (persona) to judge; (ritenere) to consider; avere giudicato"
"giurare","vt. to swear; avere giurato"
"giustificare","vt. to justify; avere giustificato"
"giustificarsi","vr. (scusarsi) to justify oneself; essersi giustificato"
"godere","vt. <godo> to enjoy; vi. <godo> (provare piacere) to enjoy; (sessualmente) to come; avere goduto"
"godere nel fare qc","to enjoy doing sth"
"godere di qc","to benefit from sth"
"governare","vt. (amministrare: Paese, Stato, comune, regione) to govern; (guidare: famiglia, azienda) to run; (regolare: organizzazione, rapporti) to regulate; (nave, veicolo) to handle; avere governato"
"governarsi","vr. to govern oneself; essersi governato"
"gradire","vt. <gradisco> (apprezzare) to appreciate; (desiderare) to like; avere gradito"
"grattare","vt. (pelle) to scratch; (grattugiare: formaggio) to grate; (raschiare) to scrape; (rubare) to nick; vi. (produrre rumore metallico) to screech; to grind avere grattato"
"grattarsi","vr. to scratch oneself; essersi grattato"
"gridare","vt. (dire ad alta voce) to shout; vi. (urlare) to shout, (strillare) to scream; avere gridato"
"guadagnare","vt. (denaro) to earn; to gain; (raggiungere: cima, vetta) to reach; vi. (ricevere uno stipendio) to earn; (risaltare) to look better; avere guadagnato"
"guadagnare tempo","a. fig. to gain time"
"guadagnare terreno","a. fig. to gain ground"
"guardare","vt. (vedere) to look at; (cercare: parola) to look up; (vigilare su: bambino, condannato) to look after; avere guardato"
"guardare qc di buon occhio","to view sth favorably"
"guardare qc di mal occhio","to view sth unfavorably"
"guardare qu/qc con la coda dell'occhio","to look at sb/sth out of the corner of one's eye"
"guardare qu dall'alto in basso","to look sb up and down"
"guardarsi","vr. (osservarsi) to look at oneself, (reciproco) to look at each other; essersi guardato"
"guarire","vt. <guarisco> (ferita) to heal, (malattia) to cure; (persona, animale) to cure; vi. <guarisco> (ferita) to heal, (malattia) to disappear; (persona, animale) to recover; essere guarito"
"guarire qu da qc","a. fig. to cure sb of sth"
"guarire da qc","to recover from sth, be cured of sth"
"guidare","vt. (veicolo) to drive; (indirizzare) to guide; SPORTS (classifica) to head; (capeggiare: gruppo, rivolta) to lead; avere guidato"
"gustare","vt. FOOD (provare) to taste; (assaporare) to enjoy; avere gustato"
"gustarsi","vr. to enjoy; essersi gustato"
"illudere","vt. <illudo> to deceive, delude; avere illuso"
"illudere qu (con qc)","to deceive sb (with sth)"
"illudersi","vr. <illudo> to deceive o.s., delude o.s.; essersi illuso"
"illudersi su qc","to be mistaken about sth"
"illudersi di …","to kid oneself that …"
"illudersi che …","to mistakenly believe that …"
"imballare","vt. (merce, mobile) to pack; avere imballato"
"imbattersi (in)","vr. to run (into); essersi imbattuto"
"imbattersi in qu","to run into sb"
"imbattersi in qc","fig. to run up against sth"
"imbrunire","vi. <imbrunisco> (farsi sera) to get dark; essere imbrunito"
"immergere","vt. <immergo> (gener) to immerse, plunge; avere immerso"
"immergere qc in qc","to dip sth in sth"
