"immergersi","vr. <immergo> (in liquido, vasca) to plunge; (in profondità) to dive; (in pensieri, attività) to immerse o.s.; essersi immerso"
"impadronirsi (di)","vr. <m'impadronisco> (città, ricchezze) to seize, take possession (of); fig. (imparare: lingua) to master; essersi impadronito"
"impadronirsi di qc","to take possession of sth; fig. to become proficient in sth"
"imparare","vt. (con studio) to learn; (con esperienza) to learn; avere imparato"
"imparare a fare qc","to learn to do sth"
"impazzire","vi. <impazzisco> (ammattire) to go crazy; essere impazzito"
"impazzire di qc","fig. to be mad with sth"
"impazzire per qc/qu","fig. to be crazy about sth/sb"
"fare impazzire qu","to drive sb crazy"
"impersonare","vt. (concetto, caratteristica) to personify; (personaggio) to play; avere impersonato"
"impiegare","vt. (strumento, oggetto) to use, (capacità, energie) to employ; (tempo) to take; (denaro) to spend; (esperto, specialista) to employ; avere impiegato"
"implicare","vt. to implicate; (sottintendere) to imply; avere implicato"
"imporre","vt. <impongo> (obbligo, ordine, legge) to impose, (condizione) to set, (tassa, tributo) to levy; (sacrifici, impegno) to demand; avere imposto"
"imporsi","vr. <impongo> (persona) to assert o.s; (moda, prodotto) to become popular; (essere necessario) to be required; essersi imposto"
"inchinarsi","vr. (per riverenza) to bow; essersi inchinato"
"inchinarsi davanti a qc/qu","to bow down before sb/sth"
"inciampare","vi. (col piede) to trip; essere inciampato"
"inciampare in qc","to trip over sth"
"incitare","vt. to urge; avere incitato"
"includere","vt. <includo> (comprendere) to include; (in busta, lettera) to enclose; avere incluso"
"incontrare","vt. (per appuntamento) to meet, (per caso) to bump into; (difficoltà, problema) to come up against, (favore) to win over; SPORTS (avversario, squadra) to meet; avere incontrato"
"incontrare qn per caso","to bump into sb"
"incontrarsi","vr. (per appuntamento) to meet each other, (per caso) to bump into each other; SPORTS to meet each other; (strade, fiumi) to meet up; essersi incontrato"
"indagare","vi. to investigate; avere indagato"
"indebolire","vt. <indebolisco> (persona) to weaken, (vista, udito) to worsen; (autorità, capacità) to weaken; essere indebolito"
"indebolirsi","vr. <indebolisco> (persona, autorità, capacità) to grow weak, (vista, udito) to worsen; essersi indebolito"
"indicare","vt. (con parole) to show, (con gesto) to point out; (strumento, segnale) to indicate, (orologio) to say, (etichetta, istruzioni) to explain; (consigliare) to recommend; (rivelare) to indicate, (vocabolo) to indicate; avere indicato"
"individuare","vt. (colpevole) to identify, (obiettivo) to locate; (causa, guasto) to identify; avere individuato"
"indovinare","vt. (intuire) to guess, (risultato, gusti) to predict, (soluzione, risposta) to get right; (scegliere bene) to choose well; avere indovinato"
"infastidire","vt. <infastidisco> to bother; avere infastidito"
"infastidirsi","vr. <infastidisco> to get annoyed, irritated; essersi infastidito"
"infastidirsi per qc","to get annoyed with sth"
"infilare","vt. (ago, perle) to thread; (indumento) to put on; avere infilato"
"infilare qc in qc","to put sth in sth"
"infilarsi","vr. (indumento) to put on, slip on; essersi infilato"
"infilarsi in qc","to get into sth"
"influenzare","vt. to influence; avere influenzato"
"infondere","vt. <infondo> (coraggio, fiducia) to give; avere infuso"
"informare","vt. (con notizie) to tell; avere informato"
"informare qu (di [o su] qc)","to tell sb (about sth)"
"informarsi","vr. to keep o.s. up-to-date; essersi informato"
"informarsi su di qc","to inquire about sth"
"inghiottire","vt. <inghiottisco [o inghiotto]> to swallow; avere inghiottito"
"inginocchiarsi","vr. (piegarsi) to kneel down; essersi inginocchiato"
"ingrassare","vt. (animale) to fatten; (persona) to make fat; (ingranaggio, motore) to grease; vi. (diventare grasso) to put on weight; essere ingrassato"
"ingrassarsi","vr. (diventare grasso) to put on weight; essersi ingrassato"
"innalzare","vt. (calice, bandiera) to raise; (antenna, palo) to erect; (livello, temperatura) to raise; avere innalzato"
"innalzarsi","vr. to rise; essersi innalzato"
"inquinare","vt. eco to pollute; avere inquinato"
"insistere","vi. <insisto> to insist; avere insistito"
"insistere su qc","to insist on sth"
"insistere in qc","to persist in sth"
"intendere","vt. <intendo> (capire) to understand; (udire) to hear; (accettare) to listen to; (volere) to wish; (voler dire) to mean; avere inteso"
"intendersi","vr. <intendo> (andare d'accordo) to get along; (accordarsi, capirsi) to understand each other; essersi inteso"
"interagire","vi. <interagisco> to interact; avere interagito"
"interferire","vi. <interferisco> PHYS (elementi, fattori) to interfere; (persona) to interfere; avere interferito"
"interrompere","vt. <interrompo> (lavoro, trattativa, persona) to interrupt; (strada, passaggio, linea, corrente) to cut off; avere interrotto"
"interrompersi","vr. <interrompo> (in attività) to break off, (nel parlare) to stop talking; (trattativa) to be interrupted; (linea, corrente, strada) to be cut off; essersi interrotto"
"intervenire","vi. <intervengo> (intromettersi) to intervene; (parlare) to intervene; MED to operate; essere intervenuto"
"intervenire in qc","to intervene in sth"
"introdurre","vt. <introduco> (chiave, moneta, scheda) to put; (prodotto, moda, uso) to introduce, (legge, riforma) to bring in; (discorso, tema) to start; (persona) to show; LING to introduce; avere introdotto"
"introdurre qu in qc","to introduce sb into sth"
"introdurre qu a qc","to introduce sb to sth"
"introdursi","vr. <introduco> (penetrare) to enter, get in; (furtivamente) to sneak in, slip in; essersi introdotto"
"introdursi in qc","to enter sth"
"invadere","vt. <invado> (territorio, paese) to invade; (folla) to invade, (animali, piante) to take over, (acque) to flood; (malattia) to infect, (prodotto, moda) to flood; avere invaso"
"invidiare","vt. (persona) to envy; (cosa) to envy; avere invidiato"
"invitare","vt. (a cena, festa) to invite; (esortare) to ask; (invogliare) to tempt; avere invitato"
"lagnarsi","vr. (lamentarsi) to complain, to grumble, to moan; essersi lagnato"
"lanciare","vt. (gettare: oggetti) to throw, (bombe) to drop; (far andare a gran velocità: auto) to drive at full speed, (cavallo) to ride at a gallop; COMPUT (programma, software) to launch; (razzo, capsula spaziale) to launch; COMM (prodotto) to launch; (emettere: grido) to let out; avere lanciato"
"lanciarsi","vr. (buttarsi) to throw oneself; essersi lanciato"
"lasciar entrare i cani","to let the dogs in"
"lasciar fare qc a qn","to let, allow, permit sb to do sth"
"lasciar fare qc","to let, allow, permit sth to be done"
"lasciar uscire i cani","to let the dogs out"
"lasciare i libri a casa","to leave the books at home"
"lasciare il negozio","to leave the store"
"lasciare il ristorante","to leave the restaurant"
"lasciare qc a qn","to leave sth to sb"
"lasciare qn fare qc","to let sb do sth"
"lasciare stare qn/qc","to leave sb/sth alone"
"lasciare","vt. (gener) to leave; (mollare la presa) to let; (consentire) to allow; (non chiudere) to leave; avere lasciato"
"lasciarsi","vr. (coppia) to split up, (non curarsi) to neglect oneself; essersi lasciato"
"lavare qc","to wash sth"
"lavare","vt. (biancheria, stoviglie) to wash, (pavimento, denti, vetri) to clean; avere lavato"
"lavarsi i mani","to wash one's hands"
"lavarsi","vr. to wash; essersi lavato"
"lavorare a qc","to work on sth"
"lavorare","vt. (ferro, pasta, terreno) to work; vi. (gener) to work; (negozio) to do business; avere lavorato"
"legare","vt. (collegare) to bind, (con spago, funi) to tie up; (unire) to bind together; vi. (andare d'accordo) to get on; avere legato"
"legarsi","vr. (attaccarsi) to tie oneself; CHEM to bind; essersi legato"
"leggere di qc","to read about sth"
"leggere di storia","to read about history"
"leggere nel pensiero a qn","to read sb's mind"
"leggere qc in un libro","to read sth in a book"
"leggere qc sul giornale","to read sth in the newspaper"
"leggere","vt. <leggo> (libro, testo) to read; vi. <leggo> to read; avere letto"
"liberare","vt. (prigioniero, ostaggio) to release; (da invasione, assedio) to liberate; (sgombrare: tavolo, strada) to clear; (camera, casa) to vacate; avere liberato"
"liberarsi","vr. (posto, casa) to become free; essersi liberato"
"licenziare","vt. (impiegato) to dismiss, (per riduzione del personale) to lay off; avere licenziato"
"licenziarsi","vr. (da un impiego) to resign; essersi licenziato"
"limare","vt. (sbarra, superficie, unghia) to file; (scritto, stile) to polish; avere limato"
"limitare","vt. (ridurre: costi, libertà) to restrict; (delimitare: zona) to delimit; avere limitato"
"limitarsi","vr. to restrict, limit o.s.; essersi limitato"
"liquidare","vt. (calcolare: conto, somma, pensione) to settle; (pagare: creditori) to pay, (debito) to settle; (svendere: merce) to sell off; (chiudere: azienda) to liquidate; (criticare) to write off; (uccidere: avversario) to dispose of; (sbrigare: pratica) to deal with; (mandar via: persona) to get rid of; avere liquidato"
"lodare","vt. (elogiare, celebrare) to praise; avere lodato"
"lottare","vi. (combattere) to fight; SPORTS (fare alla lotta) to wrestle; (opporsi a: sonno, accuse) to fight; avere lottato"
"macchiare","vt. (sporcare) to stain; (caffè, tè) to add milk to, (latte) to add coffee to; (onore, nome) to sully; avere macchiato"
"macchiarsi","vr. (sporcarsi) to get dirty; essersi macchiato"
"maledire","vt. to curse; avere maledetto"
"mancare","vt. (bersaglio, colpo, palla) to miss; (occasione, opportunità) to miss; vi. (non esserci, non bastare) to be lacking, (acqua, corrente, luce) to go off; (essere assente) to not be there, (provocare nostalgia) to miss; (distare) to be; (morire) to die; (svenire) to faint; (sbagliare) to make a mistake; essere mancato"
"mandare","vt. (persona) to send, (a sede, ufficio) to post; (lettera, pacco, fiori) to send; (luce, fumo, odore) to give off, (grido, verso) to let out; avere mandato"
"mangiare di tutto","to eat anything/everything"
"mangiare fuori","to eat out"
"mangiare qc","to eat sth"
"mangiare","vt. (ingerire) to eat; (rosicchiare, corrodere) to eat away at; (denaro) to get through; (nei giochi) to take; avere mangiato"
"mangiarsi","vr. to eat; essersi mangiato"
"mantenere","vt. (disciplina, calma, ordine) to keep; (in vita, funzione) to keep; (impegno, promessa, segreto) to keep; (figli, famiglia) to support, (casa, auto) to maintain; avere mantenuto"
"mantenersi","vr. (conservarsi) to keep; (sostentarsi) to support o.s.; essersi mantenuto"
"mascherare","vt. (viso) to mask, (persona) to dress up; (sentimento) to mask; avere mascherato"
"mascherarsi (da)","vr. to disguise o.s. (as), dress o.s. up (as); essersi mascherato"
"medicare","vt. (persona) to treat; (ferita) to dress; avere medicato"
"medicarsi","vr. to treat o.s.; essersi medicato"
"mentire","vi. (dire il falso) to lie; avere mentito"
"meritare","vt. (premio, punizione) to deserve; (prezzo) to be worth; (valere la pena) to be worth; avere meritato"
"meritarsi","vr. to deserve; essersi meritato"
"metterci molta cura","to take a lot of care"
"metterci molto tempo","to take a lot of time"
"mettere a posto qc","to put in place, fix sth"
"mettere giù la birra","to set the beer down"
"mettere in dubbio qc","to doubt sth"
"mettere in ordine qc","to put in order, tidy up sth"
"mettere insieme qc","to put sth together"
"mettere la pizza sul tavolo","to put the pizza on the table"
"mettere via qc","to put sth away"
"mettere","vt. <metto> (collocare: in luogo) to put, (in posizione) to place; (francobollo) to stick, (ingrediente) to add, (liquido) to pour, (chiave, chiodo) to put, (quadro, tende) to hang; (persona) to put; (indumento) to put on; (telefono, ascensore) to install; (abbaglianti) to switch on, (marcia) to go into; (denaro, annuncio, firma, visto) to put; (sentimento, stato d'animo) to make; (energia, forza) to put; avere messo"
"mettersi","vr. <metto> (in posizione) to put o.s.; (in condizione) to make o.s.; (indossare) to put on; (infilarsi) to put; (evolversi: situazione) to turn out; essersi messo"
"migliorare","vt. (rendere migliore) to improve; vi. (diventare migliore) to improve; (stare meglio) to get better; essere migliorato"
"migliorarsi","vr. to improve o.s.; essersi migliorato"
"migrare","vi. (uccelli) to migrate; essere migrato"
"minacciare","vt. to threaten; avere minacciato"
"mirare","vi. to aim; avere mirato"
"misurare","vt. (calcolare) to measure; (indossare) to try on; (moderare) to measure; (stimare) to weigh up; vi. to measure; avere misurato"
"misurarsi","vr. (cimentarsi) to measure o.s.; (limitarsi) to control; essersi misurato"
"moderare","vt. (spese, velocità) to curb, (tono, collera) to moderate; (dibattito) to chair; avere moderato"
"moderarsi","vr. to keep o.s. in check; essersi moderato"
"modificare","vt. (cambiare) to alter; (migliorare) to improve; avere modificato"
"modificarsi","vr. to change; essersi modificato"
"mordere","vt. <mordo> (mela, panino) to bite into, (cane, vipera) to bite; (insetto) to sting; vi. <mordo> (freddo) to bite, (sapore) to be sharp; avere morso"
"mordersi","vr. <mordo> (lingua, labbro, unghie) to bite; essersi morso"
"morire dalla voglia di fare qc","to be dying to do sth"
"morire di fame","to die of hunger"
"morire di noia","to die of boredom"
"morire di paura","to die of fright"
"morire di qc","to die from sth"
"morire di sete","to die of thirst"
"morire","vi. <muoio> (persona, animale, pianta) to die; (istituzione, tradizione) to die; (conversazione, discorso) to die off, (progetto, questione) to die; (fuoco, luce) to die out, (passione, speranza) to die off; essere morto"
"mostrare","vt. (far vedere) to show; (additare) to point out; (spiegare, dimostrare) to explain; (palesare) to show; (fingere) to pretend; avere mostrato"
"mostrarsi","vr. (farsi vedere) to appear; (dimostrarsi) to appear; essersi mostrato"
"nascere a Roma","to be born in Rome"
"nascere in Italia","to be born in Italy"
"nascere","vi. <nasco> (persone, animali) to be born; (pianta) to come up, (fiore) to come out; (fiumi) to rise; (sole) to rise, (giorno) to break; (avere origine: tradizione, iniziativa) to come from; (formarsi: associazione) to be created; (amore) to be born; essere nato"
"nascondere","vt. <nascondo> (oggetto) to hide; (sentimento, verità) to conceal; avere nascosto"
"nascondersi","vr. <nascondo> to hide; essersi nascosto"
"navigare","vi. NAUT to sail; COMPUT to surf the Internet; avere navigato"
"negare","vt. (contestare) to deny; (rifiutare) to deny; avere negato"
"negoziare","vt. (contratto, pace) to negotiate; FIN (titoli, cambiali) to negotiate; avere negoziato"
"nevicare","vi. to snow; essere nevicato"
"noleggiare","vt. (dare a nolo) to rent (out); (prendere a nolo) to rent, (navi, aerei) to charter; avere noleggiato"
"nominare","vt. (citare) to mention; (eleggere) to nominate, (commissione, avvocato) to appoint; (chiamare: via, pianta, astro) to name; avere nominato"
"notare","vt. (rilevare) to notice; (prender nota) to note; (considerare) to note; avere notato"
"nuotare","vi. to swim; avere nuotato"
"obbligare","vt. (costringere) to force; LAW (vincolare) to compel; avere obbligato"
"obbligarsi","vr. LAW (vincolarsi) to be bound; (impegnarsi) to force o.s.; essersi obbligato"
"occultare","vt. (nascondere) to hide; to conceal; ASTRO to occult; avere occultato"
"occupare","vt. (casa, fabbrica, scuola) to occupy; MIL (città paese) to occupy; (abitare: appartamento) to occupy; (riempire: spazio) to take up; (ricoprire: carica) to hold; avere occupato"
"occuparsi (di)","vr. (interessarsi) to be interested (in), take an interest (in); (prendersi cura) to take care (of), look after; (impicciarsi) to interfere (in), meddle in; essersi occupato"
"odiare","vt. (nemico, persona, materia, cibo) to hate; avere odiato"
"offendere","vt. <offendo> (persona) to offend; (danneggiare) to damage; avere offeso"
"offendersi","vr. <offendo> (risentirsi) to take offense; (insultarsi) to insult each other; essersi offeso"
"offrire","vt. <offro> (gener) to offer; (fornire: pretesto, appiglio, scusa) to provide; (regalare) to give; (pagare) to pay; avere offerto"
"offrirsi","vr. <offro> to offer o.s.; essersi offerto"
"oltrepassare","vt. (superare) to cross; (limite, soglia) to exceed; avere oltrepassato"
"opprimere","vt. <opprimo> (vessare: tiranno, governo) to oppress; (affliggere: persona, angoscia) to oppress; avere oppresso"
"ordinare","vt. (gener) to order; (mettere in ordine: carte, idee, elementi) to organize; REL to ordain; avere ordinato"
"ordinarsi","vr. to arrange o.s.; essersi ordinato"
"organizzare","vt. (lavoro, conferenza, viaggio) to organize; avere organizzato"
"organizzarsi","vr. to organize o.s.; essersi organizzato"
"osare","vt. to dare; avere osato"
"oscurare","vt. (rendere oscuro: cielo) to darken; (rete televisiva) to block out; avere oscurato"
"oscurarsi","vr. (diventare oscuro) to darken; (vista) to cloud over; essersi oscurato"
"ospitare","vt. (dare ospitalità a) to accommodate; SPORTS to host; (accogliere: convegno) to host; (contenere: persone, barche) to hold; (custodire: quadro, statua) to house; avere ospitato"
"osservare","vt. (guardare attentamente) to observe; (rispettare: norme, regole, silenzio) to observe; (rilevare) to notice; avere osservato"
"ostacolare","vt. (movimenti) to obstruct, (decisioni) to block, (ingresso, sviluppo, ricerca) to hinder; avere ostacolato"
"ostinarsi","vr. to persist, insist; essersi ostinato"
"ottenere","vt. (conseguire: risultato, totale, vittoria) to obtain; (ricevere: ricompensa, premio) to gain; (ricavare: prodotto) to obtain; avere ottenuto"
"offrire di fare qc","to offer to do sth"
"offrire qc a qn","to offer sth to sb"
"pagare con carta (di credito)","to pay by (credit) card"
"pagare in contanti","to pay cash"
"pagare","vt. (persona) to pay, (acquisto, servizio) to pay for; (offrire) to buy; (ricompensare) to repay; avere pagato"
"paragonare","vt. (confrontare) to compare; avere paragonato"
"paragonarsi","vr. to compare o.s.; essersi paragonato"
"parere","vi. <paio> (apparire) to seem; essere parso"
"parlare a/con qn di qc","to talk to/with sb about sth"
"parlare bene di qn/qc","to speak well of sb/sth"
"parlare di fare qc","to talk about doing sth"
"parlare di qc","to talk about sth"
"parlare male di qn/qc","to speak poorly of sb/sth"
"parlare","vt. to speak; vi. (esprimersi) to speak; (conversare) to talk; avere parlato"
"parlarsi","vr. to speak (to each other); essersi parlato"
"partecipare","vt. (rendere noto) to announce; avere partecipato"
"partire da casa","to leave from home"
"partire dall'Italia","to leave from Italy"
"partire in aereo","to leave (go) by plan"
"partire in macchina","to leave (go) by macchina"
"partire in treno","to leave (go) by train"
"partire per casa","to leave for home"
"partire per l'Italia","to leave for Italy"
"partire","vi. (andare via) to leave, depart; essere partito"
"partire","vi. (andare via) to leave; (colpo) to go off; (macchina) to start, SPORTS to start; (avere inizio) to start; (rompersi) to break, (staccarsi) to come off; essere partito"
"passare a trovare qn","to drop in on sb"
"passare il tempo","to spend (pass) time"
"passare qc a qn","to pass sth to sb"
"passare un brutto periodo","to go through a bad time"
"passare","vt. (attraversare: confine) to cross; (oltrepassare: semaforo, strada) to go past; (trafiggere) to go through; (superare) to pass; (trascorrere) to spend; (dare) to pass; (notizia) to tell; (patire) to undergo; (perdonare) to forgive; (legge) to pass; (superare: esame, controllo) to pass; (patate, verdura) to purée; (spugna, mano di vernice) to apply; vi. (transitare) to pass; (strada, canale) to run; (andare) to call in; (attraversare un'apertura) to get in, (penetrare) to come in; (trasferirsi) to go; (da una persona all'altra) to pass; (trascorrere) to go by; (cambiare argomento) to move on; (sparire) to pass; (essere accettabile) to do; (a livello superiore) to change; (agli esami) to pass, (legge) to be passed; SPORTS to pass; essere passato"
"passeggiare","vi. (andare a spasso) to walk; (andare su e giù) to pace up and down; avere passeggiato"
"penetrare","vi. (in un materiale) ; essere penetrato"
"penetrare","vt. (significato, concetto) to understand; (sessualmente) to penetrate; essere penetrato"
"pensare a qc","to think of sth"
"pensare bene di qn","to think well of sb"
"pensare di fare qc","to think of doing sth"
"pensare di no","to not think so"
"pensare di sì","to think so"
"pensare male di qn","to think poorly of sb"
"pensare","vt. (gener) to think; (escogitare) to think of; vi. (riflettere) to think; avere pensato"
"perdere di vista qn/qc","to lose sight of sb/sth"
"perdere tempo","to waste time"
"perdere","vt. <perdo> (gener) to lose; (treno, film, evento, occasione) to miss; (sprecare) to waste; (acqua, gas) to leak, (sangue) to lose; avere perso [o perduto]"
"perdersi","vr. <perdo> (smarrirsi) to get lost; (svanire) to disappear; (rovinarsi) to be ruined; essersi perso [o perduto]"
"perfezionare","vt. (opera) to improve, (metodo, macchina) to perfect; (contratto) to draw up; avere perfezionato"
"perfezionarsi","vr. (tecnica, scienza) to improve; essersi perfezionato"
"permettere","vt. (dare il permesso per) to allow; (dare la possibilità) to permit; (concedersi) to afford; avere permesso"
"permettersi","vr. to take the liberty; essersi permesso"
"persuadere","vt. <persuado> (convincere) to persuade; (suscitare consenso) to convince; avere persuaso"
"persuadersi","vr. <persuado> (convincersi) to convince o.s.; essersi persuaso"
"pervadere","vt. <pervado> (occupare) to pervade; avere pervaso"
"pesare","vt. (persona, merce) to weigh; (valutare) to weigh up; vi. (avere un peso) to weigh, (essere pesante) to be heavy; avere pesato"
"pesarsi","vr. to weigh o.s.; essersi pesato"
"pettinare","vt. to comb; avere pettinato"
"pettinarsi","vr. (ravviarsi i capelli) to comb one's hair, (acconciarsi) to do one&#39;s hair; essersi pettinato"
"piangere","vt. <piango> (lacrime) to cry; (lamentare) to mourn; vi. <piango> to cry; avere pianto"
"piegare","vt. (sbarra, fil di ferro, braccia, gambe, testa, corpo) to bend, (foglio, vestiti) to fold; (dominare) to subdue; vi. (voltare) to turn; avere piegato"
"piegarsi","vr. (incurvarsi) to bend schiena; (arrendersi) to submit; essersi piegato"
"piovere","vi. <piove> METEO to rain; to rain down; (arrivare in grande quantità) to come thick and fast <strong class=tilde"">piovere</strong> gli insulti; essere piovuto"""
"piovigginare","vi. to drizzle; essere piovigginato"
"poggiare","vt. (posare) to place; avere poggiato"
"portare qc a qn","to take, bring sth to sb"
"portare qc","to carry sth"
"portare qn a fare qc","to lead sb to do sth"
"portare qn a qc","to lead sb to sth"
"portare via","to take away"
"portare","vt. (trasportare, trascinare) to carry; (trasferire, accompagnare, prendere con sé) to take; (dare, causare) to bring; (indossare) to wear; (condurre) to lead, (veicoli) to go; (taglia) to take; (proporre, presentare) to provide; (reggere) to support; avere portato"
"possedere","vt. <possiedo> (beni) to have, (dote) to possess; avere posseduto"
"potenziare","vt. (rafforzare) to strengthen; avere potenziato"
"potere fare qc","to be able to do sth"
"potere","vi. <posso> (gener) to be able to; (avere il permesso di) may; avere potuto"
"predire","vt. to predict; avere predetto"
"preferire fare qc","to prefer doing sth"
"preferire","vt. <preferisco> to prefer; avere preferito"
"pregare","vt. REL to pray to; (chiedere) to beg; avere pregato"
"premere","vt. (spingere su) to press; (incalzare) to pursue; vi. (stare a cuore) to be important; avere premuto"
"prendere nota di qc","to take note of sth"
"prendere","vt. <prendo> (gener) to take; (procurarsi, ricevere, derivare) to get; (malattia) to catch; (al bar, al ristorante) to have; (catturare, sorprendere) to catch; (ritirare) to pick up; (misurare) to measure; (far pagare) to charge; (assumere) to take on; (spazio) to take up; vi. <prendo> (piante) to take; (fuoco) to catch; (colla, cemento) to set; (avviarsi) to go; avere preso"
"prendersi","vr. <prendo> (assumersi) to take on; essersi preso"
"prenotare","vt. (posto, tavolo, camera) to reserve; avere prenotato"
"preparare","vt. (letto, pranzo, lista) to make, (stanza) to get ready; (piano, sorpresa, persona) to prepare; avere preparato"
"prepararsi a fare qc","to prepare o.s. to do sth"
"prepararsi a qc","to prepare o.s. for sth"
"prepararsi","vr. (vestirsi) to get ready; essersi preparato"
"prescindere (da)","vi. to leave aside, leave outside of consideration; avere prescisso"
"presentare","vt. (mostrare: documento, passaporto) to show, (sottoporre: domanda, proposta) to submit; (comportare) to offer; (prodotto) to present; (saluti) to give; (programma televisivo) to host; avere presentato"
"presentarsi","vr. (andare) to go; (apparire) to appear; (farsi conoscere) to introduce o.s.; (occasione) to present itself, (difficoltà) to come up; essersi presentato"
"prestare","vt. (dare in prestito) to lend; (dare) to give; avere prestato"
"prestarsi","vr. (offrirsi) to offer, (acconsentire) to agree; essersi prestato"
"presupporre","vt. (immaginare) to suppose; (implicare) to presuppose; avere"
"pretendere","vt. (esigere) to demand; (presumere) to presume; (affermare) to claim; avere preteso"
"prevalere","vi. (predominare) to prevail; essere prevalso"
"prevedere","vt. (anticipare) to foresee, (programmare) to plan; (prescrivere) to provide for; avere preveduto"
