"oggetto","n. m. (cosa) object; (scopo) object; (argomento) subject; LAW matter; PHILOS object; LING object, (complemento oggetto) direct object; ADMIN (nelle lettere) re:"
"omaggio","n. m. <-ggi> (offerta) gift; (segno di rispetto) tribute; pl. (ossequi) regards"
"ombra","n. f. (zona non illuminata) shade; (oscurità) darkness; (sagoma) shadow"
"onda","n. f. (del mare) wave; PHYS wave"
"opera","n. f. (attività) work; (prodotto) work; LIT, arte work; MUS opera; (teatro) play"
"origine","n. f. origin"
"ospite","n. mf. (persona che ospita) host; (persona ospitata) guest"
"ossatura","n. f. ANAT (insieme delle ossa) skeleton; ANAT (struttura ossea) bone structure; (struttura portante: di edificio, economia) framework"
"ostacolo","n. m. (impedimento) obstacle; (intralcio) hindrance"
