ibrido, -a: "animale ibrido","hybrid animal"
pelle: "lasciarci [o rimetterci] la pelle","fig. to lose one's life"
pelle: "salvare la pelle","fig. to save one's skin"
penetrare: "penetrare in qc","to penetrate sth"
penetrare: "penetrare in qc","to get into sth"
pensare: "cosa stai pensando?","what are you thinking?"
pensare: "penso che …","I think that …"
pensare: "la penso anch'io così","I think so too"
pensare: "una ne fa e cento ne pensa","he's always up to something"
pensare: "pensare di fare qc","to think of doing sth"
pensare: "pensare a qc","to think of sth"
pensare: "dar da pensare","to give food for thought"
pensare: "pensarci su","to think about it"
pensare: "pensare a qu/qc","to think about sb/sth"
pensare: "pensare a qc/fare qc","to think about sth/doing sth"
pensare: "pensare a qc/fare qc","to take care of sth/doing sth"
pensare: "pensa ai fatti tuoi!","mind your own business!"
pensare: "pensare bene/male di qu","to think well/badly of sb"
pera: "farsi una pera","to give oneself a fix"
pera: "a pera","illogical"
perdere: "perdere la vita","to lose one's life"
perdere: "perdere (il) colore","to fade"
perdere: "perdere le staffe","fig. to lose one's temper"
perdere: "perdere la testa","fig. to lose one's head"
perdere: "perdere ogni speranza","to lose all hope"
perdere: "non ti sei perso niente","you haven't missed anything"
perdere: "lasciar perdere qu/qc","to forget sb/sth"
perdere: "lasciamo perdere","let's forget it"
perdere: "perdere qu di vista","to let sb out of your sight"
perdere: "fare qc a tempo perso","to do sth in one's spare time"
perdere: "perdere di qc","to lose sth"
perdersi: "perdersi d'animo","to get discouraged"
perdersi: "perdersi in chiacchiere","to waste time chatting"
perdersi: "perdersi in un bicchiere d'acqua","fig. to be easily discouraged"
perdersi: "perdersi dietro a qu","to fall head over heels for sb"
perdono: "chiedere perdono a qu","to apologize to sb"
perdono: "perdono giudiziale","pardon"
perfezionarsi: "perfezionarsi in inglese","to perfect one's English"
permettere: "permettere a qu di fare qc","to allow sb to do sth"
permettersi: "come si permette!","how dare you!"
persuadere: "persuadere qu di qc","to persuade sb of sth"
persuadere: "persuadere qu di fare qc","to persuade sb to do sth"
persuadersi: "persuadersi di qc","to understand sth"
pesante, -i: "artiglieria pesante","heavy artillery"
pesante, -i: "industria pesante","heavy industry pesante"
pesante, -i: "avere il sonno pesante","to be a heavy sleeper"
pesante, -i: "sentirsi la testa pesante","to have a headache"
pesare: "pesare le parole","fig. to weigh one's words"
pesare: "pesare a qu","to be difficult for sb"
pesare: "pesare sulla coscienza","to weigh on one's conscience"
pesare: "pesare sullo stomaco","to lie heavily on one's stomach"
pesare: "pesare su qc","to influence sth"
pesare: "far pesare qc a qu","to remind sb of sth"
pesare: "pesare su qu/qc","fig. to hang over sb/sth"
peso: "peso lordo/netto","gross/net weight"
peso: "eccedenza di peso","excess weight"
peso: "dar peso a qu/qc","fig. to pay attention to sb/sth"
peso: "lancio del peso","shot put"
peso: " peso massimo/medio","heavyweight/middleweight"
peso: "sollevamento -i","weightlifting"
peso: "togliersi un peso (dalla coscienza)","fig. to clear one's conscience"
pettinare: " pettinare qu","to do sb's hair"
petto: "do di petto","high C"
petto: "prendere qc di petto","to tackle sth head on"
petto: "a doppio petto","double-breasted"
petto: "tenersi qc in petto","fig. to keep sth bottled up"
piacere: "mi piace nuotare","I like swimming"
piacere: "mi piace molto la pasta","I like pasta a lot"
piacere: "quello rosso mi piace di più di quello verde","I like the red one more than the green one"
piacere: "il libro che mi piace di più","the book I like best"
piacere: "mi piacerebbe rivederti","I'd like to see you again"
piacere: "mi piacerebbe che tu mi accompagnassi","I'd like you to come with me"
piacere: "che ti piaccia o no","whether you like it or not"
piacere: "provare piacere a fare qc","to take pleasure in doing sth"
piacere: "viaggio di piacere","pleasure trip"
piacere: "piacere!","it's a pleasure!"
piacere: "è un piacere conoscerla","pleased to meet you"
piacere: "con (molto) piacere!","with (great) pleasure!"
piacere: "fare un piacere a qu","to do sb a favor"
piacere: "fammi il (santo) piacere di …","please …"
piacere: "ma mi faccia il piacere!","for goodness sake piacere!"
piacere: "per piacere","please"
piacere: "a piacere","as much as one likes"
piangere: "piangere di gioia/dolore/rabbia","to cry with joy/in pain/with rage"
piangere: "piangere sul latte versato","fig. to cry over spilled milk"
piangere: "mi piange il cuore","it breaks my heart"
piano: "mettere sullo stesso piano","fig. to put on the same level"
piano: "sul piano politico/economico","politically/economically"
piano: "piano di cottura","stovetop"
piano: "abitare al primo piano","to live on the second floor"
piano: "piano regolatore","ADMIN city-planning project"
piano: "primo piano","close-up"
piano: "in primo/secondo piano","in the foreground/the background si vedono i soldati"
piano: "di primo piano","fig. prominent"
piano: "passare in secondo piano","fig. to become less important"
pianta: "in pianta stabile","on a permanent basis"
pianta: "in pianta stabile","fig. permanently"
pianta: "inventare qc di sana pianta","to make sth up completely"
pietra: "pietra preziosa","precious stone"
pietra: "pietra dura","semiprecious stone"
pietra: "età della pietra","Stone Age"
pietra: "porre la prima pietra","fig. to lay the foundations sistema sanitario"
pietra: "mettere una pietra sopra qc","fig. to say no more about sth"
pioggia: "pioggia acida","acid rain"
pioggia: "pioggia fine/fitta/scrosciante","light/heavy/pouring rain"
pioggia: "la stagione delle -gge","the rainy season"
piovere: "piovere a catinelle","to pour (down)"
piovere: "su questo non ci piove","fig. there's no doubt about it"
piovere: "piove sul bagnato","some people have all the luck sul bagnato!"
piovere: "piove sul bagnato","it never rains but it pours"
piovere: "piovere dal cielo","cadere come pioggia. fig. to fall into one's lap"
piovere: "piovere addosso a qu","to assail sb"
polemica: "fare delle -che","to be argumentative"
polvere: "togliere la polvere","to do the dusting"
polvere: "ridurre qu in polvere","fig. to pulverize sb"
polvere: "polvere di carbone/d'oro","coal/gold dust"
polvere: "in polvere","powdered"
polvere: "caffè in polvere","instant coffee"
polvere: "polvere da sparo","gunpowder"
portare: "portare qc in tavola","to serve sth"
portare: "portare su/giù","to take up/down"
portare: "portare dentro/fuori","to take in/out"
portare: "portare fuori qu","to take sb out"
portare: "portare a spasso qu","to take sb for a walk"
portare: "portare via","to take away"
portare: "portare via","to steal"
portare: "portare qc in dote","to bring a dowry of sth"
portare: "portare qc in regalo","to give sth as a present"
portare: "portare bene [o fortuna] a qu","to bring sb good luck"
portare: "portare male [o sfortuna] a qu","to bring sb bad luck"
portare: "porto la 44/il 39","I wear a size 44/39"
portare: "portare qu a qc/a fare qc","to lead sb to sth/to do sth"
portare: "portare un esempio","to provide an example"
portare: "portare bene/male gli anni","not to look/to look one's age"
portare: "portare rancore a qu","to bear sb a grudge"
portare: "portare rispetto a qu","to show respect for sb"
portare: "portare pazienza","to have patience"
possesso: "entrare in possesso di qc","to come into possession of sth"
possesso: "essere nel pieno possesso delle proprie facoltà mentali","to be in full possession of one's faculties"
posta: "spedire [o mandare] qc per posta","to mail sth"
posta: "fermo posta","general delivery"
posta: "posta aerea","airmail"
posta: "posta elettronica","inform electronic mail"
posta: "posta prioritaria","first class mail"
posta: "posta del cuore","advice column"
posta: "piccola posta","letters to the editor"
posta: "la posta in gioco","fig. the stakes pl alta"
potere: "posso fare un tentativo","I can have a try"
potere: "non potevo saperlo","I couldn't have known"
potere: "verrò se potrò","I'll see if I can"
potere: "non ne posso più","I can't take any more"
potere: "può darsi [o essere] che …","perhaps …"
potere: "permesso, si può?","excuse me, may I?"
potere: "farò tutto quello che è in mio potere","I'll do everything in my power"
potere: "potere temporale","temporal power"
potere: "essere al potere","to be in power"
potere: "pieni -i","full powers"
potere: "potere legislativo/esecutivo/giudiziario","legislative/executive/judicial power"
potere: "potere d'acquisto","purchasing power"
potere: "potere nutritivo","nutritive value"
preavviso: "preavviso di pagamento","payment notice"
preferire: "preferire il nuoto allo sci","I prefer swimming to skiing"
pregare: "ti prego di farmi un favore","please do me a favor"
pregare: "farsi pregare","to play hard to get"
pregare: "si prega di non fumare","please do not smoke"
pregare: "entri, La prego","please come in"
premere: "premere il freno/l'acceleratore","to put one's foot on the brake/the gas"
premere: "premere su qc","to press on sth"
premere: "premere su qu","fig. to put pressure on sb"
premere: "premere su qu","fig. to weigh on sb"
prendere: "prendere qn per mano","to take sb by the hand"
prendere: "prendi la prima a destra dopo il semaforo","take the first right after the traffic lights"
prendere: "prendere la parola","to speak"
prendere: "se esci, prenditi le chiavi","if you go out, take your keys"
prendere: "per andare a lavorare, prendo l'autobus","I take the bus to work"
prendere: "qualcuno mi ha preso la penna","someone's taken my pen"
prendere: "prendersi un giorno di ferie","to take a day off"
prendere: "prendersi una vacanza","to take a vacation"
prendere: "devo uscire a prendere il pane","I have to go out and get the bread"
prendere: "prendere in affitto","to rent"
prendere: "cosa prendi?","what would you like?"
prendere: "prendo solo un caffè","I'll just have a coffee"
prendere: "prendere qu alla sprovvista","to catch sb unawares"
prendere: "prendere le misure","to measure"
prendere: "prendersi cura di qu","to take care of sb"
prendere: "questa traduzione mi ha preso tutto il pomeriggio","this translation took me all afternoon"
prendere: "prendere qu per qu","to take sb for sb"
prendere: "prendere appunti","to take notes"
prendere: "prendere aria","to get some fresh air"
prendere: "prendere qu con le buone","to be nice to sb"
prendere: "prendere una decisione","to make a decision"
prendere: "prendere forma","to take shape"
prendere: "prendere fuoco","to catch fire"
prendere: "prendere in giro qn","to make fun of sb"
prendere: "prendere piede","to catch on"
prendere: "prendere posizione","to take sides"
prendere: "prendere il sole","to sunbathe"
prendere: "prendere sonno","to go to sleep"
prendere: "prendere qu sul serio","to take sb seriously"
prendere: "prendere tempo","to play for time"
prendere: "prendere qu in braccio","to take sb in one's arms"
prendere: "prender(se)le","to get a licking"
prendere: "prendersela","to get upset"
prendere: "prendersela con qu","to get angry with sb"
prendere: "prendersela comoda","to take it easy"
prendere: "prendere per qc","to go across sth"
prendere: "prendere a fare qc","to start to do sth"
prendere: "ma cosa ti prende?","what got into you?"
prendersi: "prendersi a pugni/calci","to punch/kick each other"
prendersi: "prendersi a qu/qc","to grab hold of sb/sth"
prenotarsi: "prenotarsi per qc","to put one's name down for sth"
preparare: "preparare la tavola","to set the table"
preparare: "preparare le valigie","to pack one's bags"
preparare: "preparare il terreno","fig. to prepare the ground"
prepararsi: "prepararsi a qc","to prepare oneself for sth"
prepararsi: "prepararsi a fare qc","to get ready to do sth"
prescindere: "prescindere da qc","to leave sth aside"
prescindere: "a prescindere da","regardless of"
presentare: "presentare qu a qu","to introduce sb to sb"
presentarsi: "presentarsi bene/male","to make a good/bad impression"
presidio: "-i ospedalieri","hospital facilities"
presidio: "-i medici e chirurgici","medical and surgical supplies"
pressione: "pressione atmosferica","atmospheric pressure"
pressione: "pentola a pressione","pressure cooker"
pressione: "pressione tributaria","tax burden"
pressione: "far pressione su qu","to put pressure on sb"
pressione: "essere sotto pressione","to be under pressure"
pressione: "pressione (sanguigna)","blood pressure"
pressione: "avere la pressione alta/bassa","to have high/low blood pressure"
prestare: "prestare attenzione (a qc)","fig. to pay attention (to sth)"
prestare: "prestare fede a qc","fig. to believe sth"
prestare: "prestare giuramento","fig. to take an oath"
prestare: "prestare orecchio a qc","fig. to listen to sth"
prestarsi: "prestarsi a per qc","to be appropriate for sth"
prestito: "dare in [o a] prestito qc","to lend sth"
prestito: "prendere in [o a] prestito qc","to borrow sth"
prete: "scherzo da prete","dirty trick"
prevalere: "prevalere su qu","to prevail over sb"
principio: "da [o in] [o al] principio","at first"
principio: "(sin) dal principio","(right) from the start"
principio: "una questione di principio","a matter of principle"
principio: "per principio","on principle"
principio: "in linea di principio","in principle"
proibire: "proibire a qu di fare qc","to forbid sb to do sth"
promettere: "promettere di fare qc","to promise to do sth"
promettere: "promettere bene/male","to be/not to be promising"
proporre: "proporsi qc","to set sth for oneself"
proporre: "proporsi una meta","to set oneself a goal"
proposta: "proposta di matrimonio","marriage proposal"
proposta: "proposta di legge","bill"
provare: "provare a fare qc","to try to do sth"
provare: "provarci","to try"
provarsi: "provarsi a fare qc","to dare to do sth"
provarsi: "provarsi in qc","to try sth"
provvedimento: "prendere -i","to take steps"
pulire: "pulirsi le orecchie","to clean out one's ears"
pulire: "pulirsi la bocca","to wipe one's mouth"
puntare: "puntare i piedi","fig. to dig one's heels in"
puntare: "puntare il dito verso qu","to point the finger at sb"
puntare: "puntare qc su qc","to bet sth on sth"
puntare: "puntare su qc","to head for sth"
puntare: "puntare a qc","fig. to be after sth"
puntare: "puntare su qu/qc","to count on sb/sth"
quaderno: "quaderno a quadretti/a righe","notebook with squared/lined pages"
qualsiasi: "vieni un giorno qualsiasi","come any day"
qualsiasi: "a qualsiasi prezzo","at any cost"
quanto, -a: "quanto tempo ci vuole?","how long does it take?"
quanto, -a: "-i anni hai?","how old are you?"
quanto, -a: "-i ne abbiamo oggi?","what's the date today?"
quanto, -a: "-e storie!","what a fuss!"
quanto, -a: "-a fretta!","you're in a hurry!"
quanto, -a: "compra -e cartoline vuoi","buy as many cards as you like"
quanto, -a: "tutti -i","everyone"
quanto, -a: "da quanto ho capito","as I understand it"
quanto: "teoria dei -i","quantum theory"
rabbia: "sfogare la propria rabbia su qu","to take one's anger out on sb"
rabbia: "essere divorato dalla rabbia","to be consumed with anger"
rabbia: "fare rabbia a qu","to make sb cross"
rabbia: "che rabbia!","how annoying!"
rabbia: "con rabbia","fig. furiously"
raccomandare: "raccomandare a qu di fare qc","to advise sb to do sth"
raccomandarsi: "raccomandarsi a qc","to beg for sth"
raccomandarsi: "mi raccomando!","don't forget!"
raccontare: "raccontare qc a qu","to tell sb sth"
raccontare: "raccontare qc per filo e per segno","to go into every detail about sth"
raccontare: "raccontamela giusta!","be honest!"
radere: "radere al suolo","to raze to the ground"
radice: "mettere -i","fig. to put down roots"
ragionare: "ragionare di qc","to discuss sth"
ragione: "perdere l'uso [o il lume] della ragione","to go out of one's mind"
ragione: "farsi una ragione di qc","to come to terms with sth"
ragione: "ridurre qu alla ragione","to bring sb back to his/her senses"
ragione: "non sentir ragione","to refuse to listen to reason"
ragione: "per -i di famiglia","for family reasons"
ragione: "per -i di forza maggiore","due to circumstances beyond one's control"
ragione: "a maggior ragione","all the more reason why"
ragione: "avere ragione","to be right"
ragione: "dare ragione a qu","to admit that sb's right"
ragione: "in ragione di","at the rate of"
ragione: "picchiare qu di santa ragione","to give sb a good hiding"
ragione: "a ragion veduta","after due consideration"
rallentare: "rallentare il passo","to slow down"
reato: "corpo del reato","material evidence"
reato: "il fatto non costituisce reato","it was not a criminal offense"
reato: "-i contro l'ambiente","crimes against the environment"
recitare: "recitare una parte","to play a part"
resistente, -i: "resistente al calore","heat-resistant"
resistente, -i: "resistente all'acqua","waterproof"
resistere: "resistere a qu/qc","to resist sb/sth"
resistere: "resistere a qc","to put up with sth"
resistere: "resisti!","hang on in there!"
respirare: "respirare con la bocca","to breathe through one's mouth"
respirare: "respirare col naso","to breathe through one's nose"
respirare: "respirare a pieni polmoni","to take deep breaths"
restare: "restare in piedi/seduto","to remain standing/seated"
restare: "restare indietro","a. fig. to get behind"
restare: "restare deluso","to be disappointed"
restare: "restare d'accordo","to agree"
restare: "non gli rimane altro che accettare","he has no choice but to accept"
rete: "rete di distribuzione","distribution network"
rete: "rete stradale","road network"
rete: "rete locale","local network"
rete: "essere in Rete","to be on the Internet"
rete: "accesso alla rete","Internet access"
retro: "sul retro","on the back"
ribrezzo: "fare ribrezzo","to disgust"
ricerca: "andare alla ricerca di qc/qu","to go looking for sth/sb"
ricerca: "motore di ricerca","COMPUT search engine"
ricerca: "centro di -che","research center"
ricerca: "dottorato di ricerca","PhD"
ricerca: "ricerca di mercato","market research"
ricevuta: "ricevuta fiscale","receipt for tax purposes"
ricevuta: "raccomandata con ricevuta di ritorno","certified letter with return receipt"
riconoscere: "riconoscere qu dalla voce","to recognize sb by his [or her] voice"
riconoscersi: "riconoscersi in qc/qu","to identify with sth/sb"
ricorrere: "ricorrere a qu","to turn to sb"
ricorrere: "ricorrere a qc","to use sth"
ricorrere: "ricorrere alle vie legali","to take legal action"
ridere: "ridere fino alle lacrime","to laugh until one cries"
ridere: "fare per ridere","to joke"
ridere: "farsi ridere dietro","to make a fool of oneself"
ridere: "far ridere i polli","to make everybody laugh"
ridere: "ma non farmi ridere!","don't make me laugh!"
ridere: "ride bene chi ride ultimo","prov. he who laughs last laughs longest prov"
ridersi: "ridersi di qc","to laugh at sth"
ridurre: "ridurre al silenzio","to silence"
ridurre: "ridurre all'obbedienza","to bring to heel"
ridurre: "ridurre alla disperazione","to drive to despair"
ridurre: "ridurre in cenere","a. fig. to reduce to ashes"
ridurre: "ridurre in polvere","a. fig. to crush"
ridurre: "ridurre uno straccio","to leave like a wet rag"
ridurre: "essere ridotto a fare qc","to be reduced to doing sth"
riempire: "riempire qu di gioia","to fill sb with joy"
riempirsi: "riempirsi di qc","to stuff oneself with sth"
riempirsi: "riempirsi lo stomaco di qc","to eat sth"
riempirsi: "riempirsi di qc","to fill with sth"
riempirsi: "riempirsi la bocca di promesse belle parole ","to spout promises [or fine words]"
rientrare: "rientrare in qc","to be part of sth"
rifare: "rifare la strada","to retrace one's steps"
rifarsi: "rifarsi di qc","to get one's revenge for sth"
rifarsi: "rifare una vita","to rebuild one's life"
rifarsi: "rifare gli occhi","to be a sight for sore eyes"
rifarsi: "rifare la bocca [o il seno] ","to have one's mouth [or breasts] redone"
riferimento: "fare riferimento a","to refer to"
riferimento: "punto di riferimento","a. fig. reference point"
riferire: "riferire qc a qc","to relate sth to sth"
riferire: "riferire su qc","to report on sth"
riferirsi: "riferirsi a qc","to refer to sth"
rifiutare: "rifiutare qc a qu","to refuse sb sth"
rifiutarsi: "rifiutarsi di fare qc","to refuse to do sth"
rifiuto: "-i organici (compostabili)","organic waste"
rifiuto: "-i nucleari [o radioattivi] ","nuclear [or radioactive] waste"
rifiuto: "-i tossici","toxic waste"
rifiuto: "essere un rifiuto della società","to be the dregs of society"
riflettere: "riflettere su qc","to think about sth"
riflettersi: "riflettersi su qc","fig. to influence sth"
riga: "carta/quaderno a -ghe","lined paper/excercise book"
riga: "leggere fra le -ghe","fig. to read between the lines"
riga: "mettersi in riga","to get in line"
riga: "riga di comando","command line"
riga: "riga di commento","comment line"
riguardare: "per quanto riguarda …","as far as … is concerned"
riguardarsi: "riguardarsi da qc","to steer clear of sth"
rimanere: "rimanere male/confuso","to be offended/confused"
rimanere: "rimanere a bocca aperta","to be amazed"
rimanere: "non gli rimane altro che accettare","he can only accept"
rimproverarsi: "rimproverarsi (di) qc","to reproach oneself for sth"
ringraziare: "ringraziare qu","to thank sb"
rinunciare: "rinunciare a qc","to give up sth"
rinunciare: "ci rinuncio volentieri","iron. it's no skin off my nose"
rinunciare: "rinunciare a fare qc","to decide not to do sth"
ripagare: "ripagare qc","to pay for sth again"
ripagare: "ripagare con la stessa moneta","fig. to give as good as one gets"
ripagare: "ripagare qu di qc","to repay sb for sth"
ripagare: "ripagare qc","to pay for sth"
riparare: "riparare a qc","to put sth right"
riparo: "mettersi al riparo","to take shelter"
riparo: "porre [o mettere] riparo a qc","to do sth about sth"
riportarsi: "riportarsi a qc","to refer to sth"
riposare: "riposare in pace","to rest in peace"
riposare: "riposare in pace","to rest in peace"
riprendere: "riprendere posto","to go back to one's seat"
riprendere: "riprendere quota/velocità","to regain height/speed"
riprendere: "riprendere le forze","fig. to regain one's strength"
riprendere: "riprendere i sensi","to come around"
risaltare: "risaltare da","fig. to be obvious from"
riscaldare: "riscaldare gli animi","to get people worked up"
rischiare: "rischiare di fare qc","to risk doing sth"
risiedere: "risiedere in qc","fig. to lie in sth"
risolversi: "risolversi a fare qc","to decide to do sth"
risolversi: "risolversi in qc","fig. to turn into sth"
rispondere: "rispondere ad una domanda/lettera","to reply to a question/letter"
rispondere: "rispondere al telefono","to answer the phone"
rispondere: "rispondere di qc","to answer for sth"
rispondere: "rispondere a qc","to meet sth"
ritornare: "ritornare a casa","to go [or come] home"
ritornare: "ritornare in sé","to return to normal"
riuscire: "riuscire a fare qc","to manage to do sth"
riuscire: "riuscire difficile a qu","to be difficult for sb"
rivolgere: "rivolgere l'attenzione a qu/qc","to turn one's attention to sb/sth"
rivolgere: "rivolgere la parola a qu","to speak to sb"
rivolgersi: "rivolgersi a qu","to turn to sb"
rompere: "rompere i timpani a qu","to deafen sb"
rompere: "rompere la faccia a qu","to smash sb's face in"
rompere: "rompere le scatole [o palle] a qu","to annoy sb"
rompere: "rompere con qu","to break up with sb"
rompersi: "rompersi la testa","fig. to rack one's brains"
rompersi: "rompersi un braccio/una gamba","to break one's arm/leg"
rumore: "fare rumore","fig. fig. to cause a fuss"
ruolo: "insegnanti di ruolo","tenured teachers"
sabbia: "costruire sulla sabbia","fig. to build on sand"
sabbia: "(di) color sabbia","sand-colored"
salita: "in salita","uphill"
saltare: "saltare dalla finestra","to jump out of the window"
saltare: "saltare dal ponte","to jump off the bridge"
saltare: "saltare dalla gioia","to jump for joy"
saltare: "saltare al collo di qu","to throw one's arms around sb"
saltare: "saltare al collo di qu","to jump on sb"
saltare: "saltare fuori","to turn up"
saltare: "saltare fuori","to come out with"
saltare: "saltare agli occhi (a qu)","to jump out (at sb)"
saltare: "saltare in mente","to think of"
saltare: "ma cosa ti è saltato in mente?","what got into you?"
saltare: "saltare di palo in frasca","to jump from one subject to another"
saltare: "saltare in aria","fig. to blow up"
saltare: "saltare la corda","to jump rope"
saltare: "saltare il pasto","fig. to skip a meal"
salto: "salto in alto","fig. high jump"
salto: "salto in lungo","fig. long jump"
salto: "salto con l'asta","fig. pole vault"
salto: "salto mortale","fig. somersault"
salto: "fare i -i mortali","fig. fig. to bust a gut"
salto: "fare quattro -i","fig. to dance"
salto: "fare un salto in centro","to pop into town"
salto: "fare un salto da qu","to drop in on sb"
salto: "in un salto vado e torno","I'll take just a second"
salutare: "salutami tua moglie","say hello to your wife for me"
salutare: "andare a salutare qu","to go and see sb"
salvare: "salvare la vita a qu","to save sb's life"
salvarsi: "si salvi chi può!","it's every man for himself!"
sapere: "sa il fatto suo","he [or she] knows his [or her] stuff"
sapere: "saperla lunga","to know a thing or two"
sapere: "lo so","I know"
sapere: "non saprei","I don't know"
sapere: "non si sa mai","you never know"
sapere: "buono a sapersi","that's good to know"
sapere: "averlo saputo!","I wish I'd known!"
sapere: "saper fare qc","to know how to do sth"
sapere: "so nuotare","I can swim"
sapere: "sa giocare bene a basket","he's [or she's] good at basketball"
sapere: "come hai fatto a saperlo?","how did you find out (about it)?"
sapere: "sapere di qc","to taste of sth"
sapere: "non sa di niente","it has no flavor"
sapere: "sapere di qc","to smell of sth"
sapere: "mi sa che oggi non viene","fig. I don't think he'll [or she'll] come today"
sapere: "mi sa che racconta un sacco di bugie","fig. I think he's [or she's] telling a pack of lies"
