ibrido, -a: "animale ibrido","hybrid animal"
sapere: "il saper vivere","the art of living"
sapere: "il saper fare","practical ability"
sasso: "duro come un sasso","a. fig. (as) hard as a rock"
sasso: "restare di sasso","fig. to be astounded"
sbarazzarsi: "sbarazzarsi di qu/qc","to get rid of sb/sth"
scambiare: "scambiare qu per qu","to mistake sb for sb"
scambiare: "scambiare qc per qc","fig. to mistake sth for sth"
scambiare: "scambiare qc con qc","to exchange sth for sth"
scambiare: "scambiare due chiacchiere","to have a chat"
scambiarsi: "scambiarsi di posto","to change places"
scambio: "scambio culturale","cultural exchange"
scambio: "-i commerciali","trade"
scambio: "libero scambio","free trade"
scampare: "scamparla","to have a lucky escape"
scappare: "gli è scappato di mente","fig. he [or she] has forgotten it"
scappare: "mi scappa la pazienza","fig. I've run out of patience"
scappare: "mi scappa la pipì!","I'm bursting"
scappare: "mi scappa da ridere","I can't help laughing"
scatola: "cibo in scatola","canned food"
scatola: "rompere [o far girare] le -e a qc","to get on sb's nerves"
scatola: "levarsi dalle -e","to get out"
scatola: "scatola cranica","cranium"
scatola: " scatola nera","AVIAT black box"
scatola: " scatola dello sterzo","AUTO steering box"
scendere: "scendere a valle","to go back down the mountain/hill"
scendere: "scendere a patti con qu","fig. to come to an agreement with sb"
scendere: "scendere in piazza","to take to the streets"
scendere: "scendere in campo","a. fig. to take the field"
schiavitù: "ridurre in schiavitù","to enslave"
sciocchezza: "è stata una sciocchezza","it was a stupid thing to do"
sciocchezza: "è una sciocchezza","fig. it's nothing"
sciolto, -a: "avere la lingua -a","to have the gift of the gab"
scivolare: "scivolare di mano a qu","to slip out of sb's hand"
scoprire: "scoprire l'acqua calda","to reinvent the wheel"
scoprirsi: "si è scoperta troppo","she was wearing too few clothes"
scorrevole, -i: "porta scorrevole","sliding door"
scrittura: "programma di scrittura","COMPUT word processing program"
scrivere: "scrivere a mano","to write by hand"
scrivere: "scrivere alla lavagna","to write on the board"
scrivere: "come si scrive?","how do you spell?"
scrosciare: "scrosciavano gli applausi","fig. there was thunderous applause"
scrosciare: "scrosciano le risate","fig. there are gales of laughter"
scuotere: "scuotere le spalle","to shrug"
scuotere: "scuotere la testa","to shake one's head"
scusare: "scusi, che ore sono?","excuse me, do you have the time?"
scusare: "mi scusi!","I beg your pardon"
scusarsi: "scusarsi con qu di/per qc","to apologize to sb for sth"
sdoppiamento: "sdoppiamento della personalità","split personality"
seccarsi: "seccarsi di fare qc","to grow tired of doing sth"
sedere: "è seduto sulla panca","he is sitting on the bench"
sedere: "mettersi a sedere","to sit down"
sedere: "sedere a tavola","to sit (down) at the table"
sedersi: "sedersi a tavola","to sit (down) at the table"
sedere: "mi stai prendendo per il sedere?","are you pulling my leg?"
seduta: "seduta stante","during the meeting"
seduta: "seduta stante","fig. immediately"
seguire: "seguire qu/qc","to follow sb/sth"
seguire: "seguire la moda","to follow fashion"
seguire: "seguire il consiglio di qu","to follow sb's advice"
seguire: "ne segue che …","it follows that …"
sentire: "farsi sentire","to make one's voice heard"
sentire: "stare a sentire (qu)","to listen (to sb)"
sentire: "sentire stanchezza","to feel tired"
sentire: "sentire fame","to feel hungry"
sentire: "sentire sonno","to feel sleepy"
sentire: "sentire caldo/freddo","to feel hot/cold"
sentire: "ho sentito che …","I heard that …"
sentirsi: "mi sento bene","I feel well"
sentirsi: "mi sento male","I feel ill"
sentirsi: "sentirsi svenire","to feel faint"
sentirsi: "non me la sento","I don't feel like it"
sentirsi: "non me la sento di venire con voi","I don't feel like coming with you"
servire: "servire qu","to serve sb"
servire: "servire la patria","to serve one's country"
servire: "non servire a niente","to be useless"
servire: "non servire a niente","to need"
servire: "mi serve una sedia","I need a chair"
servirsi: "servirsi di qc","to use sth"
servirsi: "servitevi pure","help yourselves"
setaccio: "passare al setaccio","fig. to comb"
sfidare: "sfidare qu a poker","to challenge sb to a game of poker"
sfidare: "sfidare qu a fare qc","to challenge sb to do sth"
sfidare: "sfido io!","of course!"
sfondo: "sullo sfondo","in the background"
sforzo: "senza sforzo non si ottiene nulla","you won't get anywhere if you don't try"
sforzo: "fare uno sforzo","to make an effort"
sforzo: "non fare -i!","don't tire yourself out!"
sfuggire: "sfuggire a","to escape"
sfuggire: "sfuggire a","to avoid"
sfuggire: "sfuggire alla morte","to escape death"
sfuggire: "mi è sfuggita la penna di mano","the pen slipped out of my hand"
sfuggire: "mi sfugge il titolo del film","I can't remember the name of the movie"
sfuggire: "mi è sfuggito che …","I forgot (that) …"
sfuggire: "mi sono sfuggiti molti errori","I missed a lot of mistakes"
sfuggire: "mi è sfuggito di bocca che …","I let it slip that …"
sicurezza: "sicurezza stradale","road safety"
sicurezza: "cintura di sicurezza","seat belt"
sicurezza: "uscita di sicurezza","emergency exit"
silenzio: "fare silenzio","to be quiet"
silenzio: "passare qc sotto silenzio","to hush sth up"
silenzio: "silenzio stampa","press silence"
sindrome: "sindrome di Down","Down syndrome"
sindrome: "sindrome da immunodeficienza acquisita","acquired immune deficiency syndrome"
sindrome: "sindrome da iperattività","hyperactivity syndrome"
sistemare: "abbiamo sistemato i tuoi amici nella stanza degli ospiti","we've put your friends in the guest room"
sistemarsi: "per una notte mi sono sistemato sul divano letto","for one night I slept on the sofa bed"
slancio: "in uno slancio di entusiasmo","fig. in a burst of enthusiasm"
sleale, -i: "una persona sleale","a cheat"
smania: "perché hai tutta questa smania?","why are you so agitated?"
smania: "smania di qc","fig. thirst for sth"
smettere: "smettila!","stop it!"
smettere: "smettere di fare qc","to stop doing sth"
smettere: "ha smesso di piovere","it's stopped raining"
sodo: "venire al sodo","to come to the point"
sodo, -a: "uova -e","hard-boiled eggs"
sodo, -a: "prenderle -e","to get a beating"
soffiare: "soffiarsi il naso","to blow one's nose"
soffiare: "mi ha soffiato la ragazza!","fig. he stole my girlfriend!"
soffrire: "soffrire il caldo/freddo","to suffer from the heat/cold"
soffrire: "soffrire la fame","to suffer from hunger"
soffrire: "soffrire di qc","to suffer from sth"
soffrire: "soffrire di mal di testa","he [or she] suffers from headaches"
soglia: "soglia della porta","doorstep"
soglia: "soglia del dolore","pain threshold"
soglia: "è alla soglia dei 40","he's [or she's] pushing 40"
soglia: "la primavera è alle -e","spring is nearly here"
sognare: "ho sognato che …","I dreamed (that) …"
sognare: "ho sognato il nonno","I dreamed about (my) granddad"
sognare: "sogno una casa al mare","fig. I dream of (having) a house on the coast"
sognare: "te la puoi sognare!","fig. in your dreams!"
sognare: "te lo sogni che venga!","fig. in your dreams he's [or she's] coming!"
sognare: "non mi sarei mai sognata di finire in questa città","fig. I never dreamed I'd end up living here"
somigliare: "somigliare a qu","to look like sb"
somigliare: "tua sorella ti somiglia tantissimo","your sister looks a lot like you"
sopportare: "non sopporta il dolore fisico","he [or she] cannot bear physical pain"
sopportare: "sopportare una perdita","to sustain a loss"
sopravvivere: "sopravvivere a qu","to outlive sb"
sopravvivere: "sopravvivere a qc","to survive sth"
sordo, -a: "essere sordo da un orecchio","a. fig. to be deaf in one ear"
sordo, -a: "sordo come una campana","a. fig. (as) deaf as a post"
sordo: "fare il sordo","to play deaf"
sordo: "parlare [o cantare] ai -i","fig. to waste one's breath"
sorgere: "mi sorge un dubbio","fig. I'm starting to wonder"
sorprendere: "la sua reazione mi ha sorpreso","his reaction surprised me"
sorprendere: "mi ha sorpreso molto sapere che …","I was very surprised to learn that …"
sorprendere: "sorprendere qu","to take sb by surprise"
sorprendere: "sorprendere qu","fig. to catch sb in the act"
sorprendersi: "sorprendersi di qc","to be surprised about sth"
sorprendersi: "non mi soprendo più di nulla","nothing surprises me any more"
sorridere: "sorridere a qu","to smile at sb"
sorridere: "sorridere a qu","fig. to appeal to sb"
sorridere: "la vita mi sorride","fig. life is good"
sospendere: "sospendere qu da una carica","to suspend sb from office"
sospeso, -a: "ponte sospeso","suspension bridge"
sospeso, -a: "col fiato sospeso","with bated breath"
sospeso, -a: "in sospeso","fig. pending"
sospeso, -a: "tenere qu in sospeso","fig. to keep sb in suspense"
sospeso, -a: "stare con il cuore sospeso","fig. to have one's heart in one's mouth"
sostenere: "sostiene la tesi che …","fig. he maintains that …"
sostenere: "sostiene di essere figlio di un attore famoso","he maintains that he is the son of a famous actor"
sostenuto, -a: "fare il sostenuto con qu","to be standoffish with sb"
sottile: "non andare per il sottile","to not get sidetracked"
sparire: "dove sei sparito?","where did you disappear to?"
sparso, -a: "in ordine sparso","in open order"
spavento: "fare uno spavento a qu","to frighten sb"
spendere: "spendere molto in vestiti","he [or she] spends a lot on clothes"
spendere: "spendere e spandere","to spend money like water"
sperare: "sperare di fare qc","to hope to do sth"
sperare: "sperare in qc","to hope for sth"
sperare: "sperare che","to hope that"
sperare: "spero di sì","I hope so"
sperare: "spero di no","I hope not"
sperare: "speriamo (bene)!","let's hope so"
sperare: "sperare in qu/qc","to have great hopes of sb/sth"
sperimentale, -i: "centro sperimentale","research center"
spesso, -a: "-e volte","often"
spezzare: "spezzare qc in qc","fig. to break sth into sth"
spezzato, -a: "cuore spezzato","broken heart"
spezzato, -a: "cuore spezzato","broken heart"
spiegarsi: "cerca di spiegarti","try to explain"
spiegarsi: "mi spiego?, mi sono spiegato?","do you understand?"
spiegazione: "avere una spiegazione con qu","to sort things out with sb"
spina: "spina dorsale","spine"
spina: "spina multipla","adapter"
spina: "birra alla spina","draft beer"
spina: "stare [o essere] sulle -e","to be on tenterhooks"
spina: "staccare la spina","to wind down"
spingere: "spingere qu a qc","fig. to drive sb to sth"
spingersi: "non pensavo che potesse spingersi fino a tal punto","fig. I didn't think he [or she] would go that far"
spogliarsi: "spogliarsi di qc","fig. to strip oneself of sth"
sposarsi: "sposarsi con qu","to marry sb"
sposarsi: "sposarsi in chiesa/in comune","to get married in church/in city hall"
sprecarsi: "sprecarsi in qc","to waste one's energy on sth"
sprofondare: "sentirsi sprofondare dalla vergogna","fig. to die of embarrassment"
staccarsi: "staccarsi da qc","to come off sth"
stare: "stare fermo","to stay still"
stare: "stare seduto","to sit"
stare: "stai pure seduto","don't get up"
stare: "stare in piedi","to stand"
stare: "Luca è quel ragazzo che sta accanto al pianoforte","Luca is that boy (standing) next to the piano"
stare: "stare dai genitori","he [or she] lives with his [or her] parents"
stare: "Gianna sta a Roma","Gianna's lives in Rome"
stare: "come stai?","how are you?"
stare: "sto bene/male/così così","I'm fine/not well/OK"
stare: "stare a qu fare qc","to be up to sb to do sth"
stare: "sta a te decidere","it's up to you to decide"
stare: "stare a qc","to be to sth"
stare: "3 sta a 9 come 6 sta a 18","3 is to 9 as 6 is to 18"
stare: "stare a qc","to stick to sth"
stare: "questi pantaloni ti stanno bene/male","these pants suit you/don't suit you"
stare: "stare allo scherzo","to take a joke"
stare: "non ci sta","it doesn't fit in here"
stare: "sto leggendo","I'm reading"
stare: "stavo guardando la TV","I was watching TV"
stare: "stiamo a vedere cosa succede","let's wait and see what happens"
stare: "stare a sentire","to wait and find out"
stare: "stare per fare qc","to be about to do sth"
stare: "stare a cuore a qu","to be close to sb's heart"
stare: "stare a dieta","to be on a diet"
stare: "lasciar stare qc","to let sth drop"
stare: "ti sta bene!","that'll teach you!"
stare: "starci","fig. to agree"
stare: "va bene, ci sto","OK, I agree"
stare: "le cose stanno così","this is how things stand"
stare: "sta tranquillo","don't worry"
stecchito, -a: "morto stecchito","stone dead"
stecchito, -a: "lasciare qualcuno stecchito","to leave sb dumbstruck"
stentare: "stentare a leggere/scrivere/parlare","to have difficulty reading/writing/speaking"
stonato, -a: "è stonato","he sings out of tune"
straccio: "straccio per i pavimenti","floor cloth"
straccio: "sentirsi uno straccio","fig. to be exhausted"
straccio: "non avere uno straccio di vestito","pej. to not have a thing to wear"
straccio, -a: "carta -a","waste paper"
stringere: "stringere la mano a qu","to shake sb's hand"
stringere: "stringere qu fra le braccia","to hug sb"
stringere: "stringi, stringi","fig. when it comes down to it"
stringere: "stringere alleanza","to make an alliance"
stringere: "stringere amicizia","to make friends"
stringersi: "stringersi attorno a qu","to gather around sb"
stringersi: "stringersi nelle spalle","to shrug"
studiare: "studiare al liceo/all'università","to be a high school/university student"
stufo, -a: "essere stufo di qu/qc","to be fed up with sb/sth"
subire: "subire un'operazione","to have an operation"
succedere: "succedere a qu","to succeed sb"
succedere: "succedere a qc","to follow sth"
succedere: "cosa ti succede?","what's the matter?"
succedere: "sono cose che succedono","these things happen"
sudare: "sudare sangue","to sweat blood"
suggerire: "suggerire la risposta a qn","to tell sb the answer"
suggerire: "suggerire a qu di fare qc","to suggest that sb does sth"
suonare: "suonare il clacson","to sound the horn"
suonare: "suonarle a qu","to give sb a good beating"
suonare: "sta suonando il campanello","the doorbell is ringing"
suscitare: "suscitare la pietà di qu","to arouse sb's pity"
svantaggio: "essere in svantaggio rispetto a qu","to be at a disadvantage compared to sb"
svantaggio: "essere in svantaggio","to be behind"
sviluppo: "paese in via di sviluppo","developing country"
sviluppo: "sviluppo sostenibile","sustainable development"
svolgere: "svolge la professione dell'avvocato","he's [or she's] a lawyer"
svolta: "divieto di svolta a destra/sinistra","no right/left turn"
svuotare: "svuotare qc di senso","fig. to deprive sth of meaning"
tacere: "tacere la verità","to hide the truth"
tacere: "mettere a tacere qc","to hush sth up"
tacere: "chi tace acconsente","prov. silence is [or equals] consent"
tacere: "tacere su qc","to remain silent about sth"
taglia: "taglia unica","one size"
tagliare: "tagliarsi un dito","to cut one's finger"
tagliare: "tagliare in due","to cut in half"
tagliare: "tagliare in quattro","to cut into four"
tagliare: "tagliare le carte","to cut the cards"
tagliare: "tagliarsi i capelli/le unghie","to cut one's hair/nails"
tagliare: "tagliare i tempi","to shorten the time allowed"
tagliare: "tagliare il traguardo","SPORTS to cross the finishing line"
tagliare: "tagliare la corda","fig. to get away"
tagliare: "tagliare i ponti con qu","fig. to break off relations with sb"
tagliare: "tagliare la testa al toro","fig. to settle sth once and for all"
tagliare: "tagliar corto","to cut to the chase"
tappa: "bruciare le -e","fig. to get somewhere fast"
tascabile, -i: "computer tascabile","palmtop"
tenere: "ecco il resto: tenga!","here's your change"
tenere: "tenere la finestra aperta","to keep the window open"
tenere: "tenere il posto a qu","to keep sb's seat"
tenere: "tenere la lingua a freno","to hold one's tongue"
tenere: "tenere a mente qc","to bear sth in mind"
tenere: "tenere le distanze","fig. to keep one's distance"
tenere: "tenere una promessa","to keep a promise"
tenere: "tenersi buono qu","to keep sb sweet"
tenere: "tenere qc da conto","to take care of sth"
tenere: "tenere la destra/sinistra","to keep to the right/left"
tenere: "la riunione si terrà domani mattina","the meeting will take place tomorrow morning"
tenere: "tenere banco","fig. fig. to hold the stage"
tenere: "tenere conto di qc","to bear sth in mind"
tenere: "tenere compagnia a qu","to keep sb company"
tenere: "tenere d'occhio qu","to keep an eye on sb"
tenere: "l'auto tiene bene la strada","the car handles the road well"
tenere: "tenere duro","to hang on"
tenere: "tenere a qc","to care about sth"
tenere: "tengo a …","I would like to …"
tenere: "tenere per qu","to be on sb's side"
tenere: "tenere per una squadra","to support a team"
tenersi: "tenersi a distanza da qc","to keep one's distance from sth"
tenersi: "tenersi aggiornato","to keep up to date"
tenersi: "tenere pronto","to be ready"
tenersi: "tenersi in piedi","to stand up"
tenersi: "tenersi dal ridere","to keep oneself from laughing"
tenersi: "tenersi a qc","to stick to sth"
tenerezza: "un bambino che fa tenerezza","a sweet baby"
tenero: "tra quei due c'è del tenero","those two have feelings for each other"
tenero, -a: "che tenero!","how sweet!"
tenero, -a: "in -a età","at a tender age"
tensione: "alta/bassa tensione","high/low tension"
tensione: "in casa mia c'è un po' di tensione","things are a bit tense at home"
tentare: "tentare di fare qc","to try to do sth"
tentare: "tentare di fare qc","to try to do sth"
tentare: "tentare di fare qc","to try to do sth"
tessera: "tessera magnetica","swipe card"
tessera: "tessera sanitaria","card entitling its bearer to health care"
tetto: "tetto scorrevole","sunroof"
tetto: "rimanere senza tetto","to be homeless"
tifare: "tifare per qu","to support sb"
tirare: "tirare qu per i capelli","to pull sb's hair"
tirare: "tirare su qc","to pick sth up"
tirare: "tirare su le maniche","to roll up one's sleeves"
tirare: "tirare su i figli","to bring up one's children"
tirare: "tirarsi su","fig. to cheer up"
tirare: "tirarsi indietro","fig. to back out"
tirare: "una parola tira l'altra","one thing you say leads to another"
tirare: "tirare qc per le lunghe","to let sth run on"
tirare: "tirare (in porta)","to score"
tirare: "tirare (il gruppo)","to be the pacemaker"
tirare: "tirare un sberla a qu","to give sb a slap"
tirare: "tirare calci","to kick"
tirare: "tirare pugni","to punch"
tirare: "tirare il fiato","fig. to breathe a sigh of relief"
tirare: "tirare a lucido","to polish"
tirare: "tirare le somme","fig. to take stock"
tirare: "tirare a sorte","to draw out of a hat"
tirare: "con l'aria che tira","fig. the way things are (today)"
tirare: "tirare sul prezzo","to bargain"
tirare: "tirare avanti","fig. to get by"
tirare: "tirare diritto","to keep right on going"
tirare: "tirare a campare","The expression tirare a campare (to get by) expresses a certain philosophy of life that involves avoiding getting worked up or worrying about things, especially in difficult situations. The art of getting through difficulties without getting too caught up in them is found also in the political and administrative arenas."
tizio: "un tizio qualunque","an ordinary guy"
tizio: "Tizio, Caio e Sempronio","Tom, Dick, and Harry"
toccare: "toccare con mano","fig. to see for oneself"
toccare: "non toccare cibo","fig. to not touch a thing"
toccare: "toccare (il fondo)","to touch the bottom"
toccare: "toccare un tasto dolente","a. fig. to touch a sore point"
toccare: "toccare terra","to reach land"
toccare: "toccare la sessantina","to turn sixty"
toccare: "la cosa mi tocca da vicino","this is something that concerns me closely"
toccare: "toccare a qu","to happen to sb"
toccare: "guarda un po' cosa mi tocca fare!","see what I have to do!"
toccare: "mi è toccato andarmene","I had to leave"
toccare: "tocca a te dirglielo","it's your job to tell him"
toccare: "ti tocca una parte dei soldi","part of the money's for you"
toccare: "a chi tocca tocca","that's life"
togliere: "togliere di mezzo qu","to get sb out of the way"
togliere: "togliersi la vita","to kill oneself"
togliere: "ciò non toglie che …","that doesn't alter the fact that …"
togliere: "togliere il saluto a qn","fig. to ignore sb"
togliere: "togliere la parola a qn","fig. to interrupt sb"
togliere: "togliere qu dai guai","fig. to rescue sb"
togliere: "togliere qu dall'imbarazzo","fig. to save sb from embarrassment"
togliersi: "togliersi dai piedi","to get out"
tornare: "tornare in mente a qu","to come back to sb"
tornare: "tornare a fare qc","to be able to do sth again"
tornare: "tornare in sé","fig. to be back to one's old self"
tornare: "tornare sull'argomento","to come back to a subject"
tornare: "tornare su una decisione","to change one's mind"
tornare: "tornare utile","to become useful again"
tornare: "tornare di moda","to become fashionable again"
tornare: "il conto torna","the calculation is correct"
tornare: "c'è qualcosa che non mi torna","there's something not quite right here"
traccia: "essere sulle -cce di qu","to be on sb's trail"
traccia: "non lasciar traccia di sé","to vanish without a trace"
traccia: "far perdere le proprie -cce","to cover one's tracks"
tradimento: "alto tradimento","high treason"
tradimento: "attacco a tradimento","surprise attack"
tradire: "se la memoria non mi tradisce","if my memory doesn't deceive me"
tradurre: "tradurre dall'italiano in inglese","to translate from Italian into English"
tradurre: "tradurre in parole povere","fig. to explain in simple terms"
traduzione: "traduzione consecutiva","consecutive translation"
traduzione: "traduzione simultanea","simultaneous translation"
traguardo: "tagliare il traguardo","to cross the finishing line"
tramite: "per il tramite di","by means of"
trattare: "trattare di qc","to be about sth"
trattare: "trattare con qu","to deal with sb"
trattare: "dimmi pure di cosa si tratta","tell me what's the matter"
trattare: "deve trattarsi di un errore","there must be some mistake"
trattare: "trattare di qc","to be about sth"
trattare: "trattare con qu","to deal with sb"
trattare: "dimmi pure di cosa si tratta","tell me what's the matter"
trattare: "deve trattarsi di un errore","there must be some mistake"
trattenere: "non ti voglio trattenere","I don't want to keep you"
trattenere: "siamo stati trattenuti in ufficio","we were delayed at the office"
trattenere: "trattenere qu in caserma","to confine sb to barracks"
trattenere: "trattenere qu (dal fare qc)","to prevent sb (from doing sth)"
tregua: "senza tregua","nonstop"
tremare: "tremare di freddo/per la rabbia","to tremble with cold/rage"
tremare: "tremare per qu","fig. to fear for sb"
trovare: "andare a trovare qu","to visit sb"
trovare: "ti trovo bene","you look well"
trovare: "trovare da ridire","to find sth to criticize"
trovare: "trovare qu simpatico","to like sb"
trovarsi: "trovarsi bene con qu","to get on well with sb"
trovarsi: "trovarsi d'accordo","to agree"
ubbidire: "ubbidire a qu/qc","to obey sb/sth"
unire: "unire in matrimonio","to join in matrimony"
unirsi: "unirsi in matrimonio","to be joined in matrimony"
unirsi: "unirsi a qu","to join sb"
unire: "unire in matrimonio","to join in matrimony"
unirsi: "unirsi in matrimonio","to be joined in matrimony"
unirsi: "unirsi a qu","to join sb"
urto: "resistente agli -i","shockproof"
urto: "forza d'urto","strike force"
urto: "terapia d'urto","massive-dose therapy"
usare: "usare attenzione","to be careful"
usare: "usare fare qc","to be in the habit of doing sth"
uscire: "uscire a dire qc","fig. to come out with sth"
uscire: "uscirsene con una battuta","fig. to come out with a witty remark"
uscire: "uscire un da partito","fig. to leave a party"
uscire: "uscire indenne da un incidente","fig. to escape unhurt from an accident"
uscire: "(comando) esci","escape"
uscire: "mi è uscito di mente","it slipped my mind"
uscire: "uscire di strada","to go off the road"
uscire: "uscire dagli occhi a qn","fig. to be coming out someone's ears"
uscire: "uscire dai gangheri","fig. to lose one's temper"
uscire: "uscire di bocca a qn","to come out of sb's mouth"
valanga: "la valanga azzurra","the Italian ski team"
valere: "non valere nulla","to count for nothing"
valere: "valere molto","to be worth a lot"
valere: "valere poco","not to be very good"
valere: "valere per tre [o dieci] ","to be worth ten"
valere: "farsi valere","to show what one's worth"
valere: "non vale!","that doesn't count!"
valere: "valere un tesoro [o un occhio della testa] ","to be priceless"
valere: "non valere un fico (secco) [o una lira] [o una cicca] ","not to be worth a fig"
valere: "uno vale l'altro","they're both the same"
valere: "tanto vale [o varrebbe] ","it's all the same"
valere: "tanto vale che …","I [or you] [or he] etc. might as well …"
valere: "(non) valere la pena","(not) to be worth the effort"
valere: "vale a dire","that is"
valere: "hai detto che arrivi tardi, vale a dire?","you said you'll be arriving late, but how late exactly?"
valere: "il gioco non vale la candela","prov. it's more trouble than it's worth"
valere: "a Carnevale ogni scherzo vale","prov. at Carnival time, anything goes"
valersi: "valersi di qc","to make use of sth"
valigia: "fare [o preparare] la valigia","to pack (one's suitcase)"
valigia: "disfare la valigia","to unpack (one's suitcase)"
valigia: "valigia ventiquattr'ore","overnight bag"
valigia: "fare le -gie","fig. to pack one's bags"
valore: "aumentare di valore","to gain value"
valore: "diminuire di valore","to lose value"
valore: "valore aggiunto","added value"
valore: "imposta sul valore aggiunto","value-added tax"
valore: "-i umani","human values"
valore: "scala di -i","value scale"
valore: "avere valore legale","to be legally valid"
valore: "borsa -i","stock exchange"
valore: "-i mobiliari","stocks and shares"
valutare: "la casa è valutata 350.000 euro","the house has been valued at 350, 000 euros"
