source,target,source example,target example,source language,target language,source segment,url,comment
"farfalone","sleeping around","La sua storia da farfallone rendeva le potenziali partner esitanti a coinvolgersi.","His sleeping around history made potential partners hesitant to get involved.","it","en","","","butterfly, tomcat"
"serratura","lock","Afferrò l'ariete e lo puntò contro la serratura ostinata.","She grabbed the ram and aimed it at the stubborn lock.","it","en","","","keyhole, latch"
"agghiacciante","chilling","Il film ha rappresentato una scena agghiacciante di vendetta eseguita a sangue freddo.","The movie depicted a chilling scene of revenge carried out in cold blood.","it","en","","","spine-chilling, appalling"
"rimettere","put","Hanno dimenticato di rimettere la cassa nel cassetto dopo la chiusura.","They forgot to put the cash box back in the drawer after closing.","it","en","","","put back, replace"
"legame","bond","I gemelli hanno riso e pianto nello stesso istante, mostrando il loro forte legame.","The twins laughed and cried in the same breath, showcasing their strong bond.","it","en","","","link, connection"
"ravvivare","revive","Dopo anni di separazione, decisero di collaborare per ravvivare la loro amicizia.","After years apart, they decided to truck together to revive their friendship.","it","en","","","brighten up, brighten"
"imponente","imposing","La torre casa si ergeva alta e imponente contro il paesaggio medievale.","The tower house stood tall and imposing against the medieval landscape.","it","en","","","impressive, massive"
"lucido","polished","La fine limatura ricoprì la superficie, dandole un aspetto lucido.","The fine filing layered the surface, making it look polished.","it","en","","","glossy, shiny"
"bancone","counter","Sarah ha trascorso il suo lavoro estivo dietro il bancone della gelateria locale.","Sarah spent her summer job behind the counter at the local ice cream shop.","it","en","","","bar, desk"
"arredato","furnished","Angolo cottura arredato e ben attrezzato conapertura verso la sala da pranzo.","Kitchenette furnished and well equipped with opening to the dining room.","it","en","","","decorated, equipped"
"farsi","get","Rispondere male al tuo capo è un modo veloce per farsi licenziare.","Talking back to your boss is a quick way to get fired.","it","en","","","have, become"
"di colpo","suddenly","Ho sentito lo stridio delle gomme quando ha dovuto frenare di colpo.","I could hear the tires screech as he had to brake suddenly.","it","en","","","short, abruptly"
"tendere","tend","Il giardiniere viene a tendere la piscina e piantagioni due volte a settimana.","The gardener comes to tend the pool and plantings twice a week.","it","en","","","strive, stretch"
"melmoso","muddy","È una baracca di ferro su un fiume melmoso.","It's a tin shack on a muddy creek.","it","en","","","oozy, slimy"
"gelido","cold","Ha risposto con uno sguardo gelido che ha zittito la stanza.","He responded with a cold stare that silenced the room.","it","en","","","icy, frosty"
"tuffarsi","dive","Le piaceva guardare le oche tuffarsi sott'acqua in cerca di cibo.","She enjoyed watching the goose dive underwater searching for food.","it","en","","","plunge, dip"
"indugiare","linger","Il delizioso aroma mi ha fatto indugiare in cucina un po' più a lungo.","The delicious aroma made me linger in the kitchen a little longer.","it","en","","","delay, dwell"
"sipario","curtain","Mentre il sipario calava, l'intero cast si prese gli applausi insieme.","As the curtain fell, the entire cast took a bow together.","it","en","","","theatre curtain, theater curtain"
"prima di tutto","first of all","Ok, prima di tutto, le meduse non sono neanche pesci.","Okay, first of all, jellyfish aren't real fish.","it","en","","",""
"lungo il tempo","along the years","E ciò che avevano chiesto lungo il tempo, soprattutto dopo il 1867, ed è ciò che speravano anche in quel momento.","They had demanded that along the years, especially after 1867, and were still hoping for that at that moment.","it","en","","","over time"
"siccità","drought","La siccità si è fatta sentire sui raccolti in tutta la regione.","The drought has taken its toll on crop yields across the entire region.","it","en","","",""
"attraente","attractive","La recinzione in pino intorno al cortile era sia economica che attraente.","The deal fence around the yard was both economical and attractive.","it","en","","","appealing, handsome"
"tenerezza","tenderness","Dovresti pulire il calamaro prima di grigliarlo per garantire la tenerezza.","You should gut the squid before grilling it to ensure tenderness.","it","en","","","affection, kindness"
"accavallare","cross","Non accavallare le gambe, il dottore ha detto di non farlo.","Please don't cross your legs, the doctor said not to.","it","en","","","subvention"
"scoparsela","fuck her","Qualcuno dovrebbe... scoparsela per insegnarle la lezione.","Someone should just fuck her to teach her a lesson.","it","en","","","bang her"
"basito","thrilled","Quando ci ha portato alla nostra camera Sono rimasto basito.","When he brought us to our room I was thrilled.","it","en","","","stunned, astonished"
"reputare","consider","Se qualcuno riesce comunque a reputare questo materiale come offensivo penso che sia palesemente fuori strada!","If someone consider this material as offensive I think that he's clearly wrong!","it","en","","","deem, think"
"comparire","appear","Ogni cittadino ha il diritto di comparire davanti al tribunale se necessario.","Every citizen has the right to appear before the law court if needed.","it","en","","","occur, show up"
"annuire","nod","Durante la presentazione, rimase zitto e poté solo annuire in segno di approvazione.","During the presentation, he remained mute and could only nod in agreement.","it","en","","","niddle-noddle, nid-nod"
"tracciare","track","Il ricercatore ha creato una base di conoscenze per tracciare dati storici e tendenze.","The researcher built a knowledge base to track historical data and trends.","it","en","","","trace, draw"
"procedere","proceed","Fino a dove mi riguarda, possiamo procedere con il piano originale.","As far as I'm concerned, we can proceed with the original plan.","it","en","","","carry out, move"
"di buon passo","at a good pace","Sono due ore di cammino di buon passo.","That is two hours walking at a good pace.","it","en","","","briskly"
"molo","pier","Poteva sentire il flusso della marea che lambiva il molo di legno.","She could hear the tide as it lapped against the wooden pier.","it","en","","","dock, jetty"
"incuiosito","intrigued","Ha ricevuto una lettera da un mittente misterioso che lo ha incuriosito.","He received a letter from an unknown sender that intrigued him.","it","en","","","curious, interested"
"mettersi a","get","È abbastanza difficile a prima di mettersi a proprio agio in tacchi alti.","It is quite difficult at first to get comfortable in high heels.","it","en","","","get to, set to"
"inchinare","bow","Non avrei mai pensato di vederti inchinare ai piedi di tuo padre.","I never thought I'd see you bow at your father's foot.","it","en","","",""
"affondato","sunk","Decise di limitare le perdite nonostante il costo affondato del suo investimento.","She decided to cut her losses despite the sunk cost of her investment.","it","en","","","sunken, sink"
"in riva al fiume","by the river","","","it","en","","",""
"in riva al mare","by the sea","","","it","en","","",""
"mi sa che","I think","E mi sa che hai preso tutti i criminali della città.","And I think you got all the criminals in town.","it","en","","",""
"impugnatura","handle","Ma io ho trovato tracce dove la lama si infila nell'impugnatura.","But I found trace evidence where the blade goes into the handle.","it","en","","","grip, handgrip"
"pulsante","button","Con la pressione di un pulsante, l'intero parco divertimenti prese vita.","With a push of a button, the entire amusement park sprang to life.","it","en","","","switch, push-button"
"casalingo","home","Il supporto locale crea un'atmosfera vibrante e potenzia il vantaggio casalingo.","Local support creates a vibrant atmosphere and boosts the home advantage.","it","en","","",""
"avvenire","take place","Con i cuori pronti, hanno abbracciato il cambiamento che stava per avvenire.","With readied hearts, they embraced the change that was about to take place.","it","en","","",""
"sfornare","churn out","Continuano a sfornare nuovi contenuti per mantenere il loro pubblico coinvolto.","They continuously churn out new content to keep their audience engaged.","it","en","","","bake, crank out"
"in discesa","downhill","Costruirono una piccola rampa per lanciarsi in discesa con i loro skateboard.","They built a small ramp to launch themselves downhill on their skateboards.","it","en","","",""
"in salita","uphill","Spingere il passeggino in salita era una sfida per i genitori stanchi.","The pushing of the stroller uphill was challenging for the tired parents.","it","en","","",""
"brufolo","pimple","Il brufolo finalmente è maturato ed è uscito da solo.","The pimple finally reached a head and pushed out on its own.","it","en","","","zit, spot"
"sfizioso","delicious","Consente di proporre ogni giorno un menù vario e sfizioso.","Allows us to offer a varied menu every day and delicious.","it","en","","","tasty, extravagant"
"tosta","tough","Nonostante la sua statura, è una tipa tosta con uno spirito combattivo incredibile.","Despite her size, she's a tough girl with an incredible fighting spirit.","it","en","","","badass, hard"
"sgradevole","unpleasant","Tutti si fermarono al rumore sgradevole di qualcuno che schiacciava un insetto.","Everyone paused at the unpleasant crunch of someone stepping on a bug.","it","en","","","uncomfortable, nasty"
"unto","anointed","Durante la cerimonia, ogni cresimando è stato unto con olio santo.","In the ceremony, each confirmand was anointed with holy oil.","it","en","","","greasy, greased"
"truccare","rig","I due politici erano d'accordo per truccare le elezioni a loro favore.","The two politicians were in cahoots to rig the election in their favor.","it","en","","","fix, make up"
"per carità","for pity's sake","Robert, dobbiamo fare qualcosa, per carità.","Robert, we have to do something, for pity's sake.","it","en","","","for pity's sake, for goodness sake"
"azzeccato","right","Tutti gli altri avevano dubbi, ma onestamente, ci hai azzeccato sull'approccio migliore.","Everyone else had doubts, but honestly, you're right about the best approach.","it","en","","","apt, guessed"
"perlomeno","at least","La camera d'albergo era piccola, ma perlomeno aveva una bella vista.","The hotel room was small, but at least it had a nice view.","it","en","","","anyway, at the very least"
"che fa sì","that makes","Lui sa scatenarsi in un modo che fa sì che tutti si uniscano a lui.","He can break it down in a way that makes everyone join in with him.","it","en","","","which causes, that causes"
"briciola","crumb","Era determinata a mangiare fino all'ultima briciola della deliziosa torta.","She was determined to eat every last crumb of the delicious cake.","it","en","","","breadcrumb, bit"
"fucile","rifle","Per garantire la precisione, doveva regolare il mirino del fucile.","To ensure accuracy, she needed to sight in the rifle scope.","it","en","","","gun, shotgun"
"giretto","ride","Davvero un bel gruzzolo per un semplice giretto in barca.","That is some quality scratch from just a little boat ride.","it","en","e poi un altro giretto in centro.","https://www.reverso.net/reader/en/a732e00a-155f-4655-9f9e-40c0635f2e8b","stroll, walk"
"spazzola","brush","Ha notato un ciuffo di peli sulla spazzola dopo aver pettinato il cane.","She noticed a mat of hair on the brush after grooming her dog.","it","en","trovarmi una spazzola rotativa,","https://www.reverso.net/reader/en/a732e00a-155f-4655-9f9e-40c0635f2e8b","hairbrush, wiper"
"pinacoteca","art gallery","Il comune ospita la pinacoteca e il museo della ceramica.","The town hall hosts the art gallery and the ceramics museum.","it","en","c'è la pinacoteca,","https://www.reverso.net/reader/en/a732e00a-155f-4655-9f9e-40c0635f2e8b","picture gallery, picture-gallery"
"infine","finally","Abbiamo scalato montagne, attraversato fiumi, e infine raggiunto la nostra destinazione.","We climbed mountains, crossed rivers, and finally reached our destination.","it","en","","",""
"razza","race","Le discussioni sulla razza possono rivelare pregiudizi razziali che devono essere affrontati.","Discussions about race can reveal racist assumptions that need to be addressed.","it","en","","","breed, kind"
"impostazione","setting","Ha trovato l'impostazione attivata che consente l'accesso remoto ai suoi file.","She found the enabled setting that allows remote access to her files.","it","en","","","approach, setup"
"mi preme sottolineare","I would like to stress","In aggiunta a ciò mi preme sottolineare tre concetti.","In addition to this, I would like to stress three points.","it","en","","","I would like to emphasise, I would like to underline"
"traguardo","finish line","Il corridore ha fatto un'ampia curva prima di tagliare il traguardo.","The runner took a long sweep before crossing the finish line.","it","en","","",""
"agganciare","hook","Può agganciare la borsa allo zaino per avere più spazio.","She can hook the bag to her backpack for extra space.","it","en","","","attach, clip"
"agganciato","hooked","Con una robusta canna da pesca, ha agganciato una grossa preda.","With a sturdy fishing rod, she hooked a big catch.","it","en","","",""
"ribadire","reiterate","Devo ribadire quanto sia cruciale essere puntuali per i nostri appuntamenti.","I must reiterate how crucial it is to be punctual for our appointments.","it","en","","","repeat, reaffirm"
"addosso","all over","Potrei avere mani di ragazzi a caso, addosso a me.","I might have random guys' hands all over me.","it","en","","","on, wearing"
"rialzo","rise","I trader spesso vendono in copertura dopo un significativo rialzo del mercato.","Traders often sell against the box after a significant market rise.","it","en","","",""
"lavandino","sink","Ha le tasche piene del suo coinquilino che lascia i piatti sporchi nel lavandino.","He's sick and tired of his roommate leaving dirty dishes in the sink.","it","en","","","washbasin, basin"
"abbonamento","subscription","Durante il periodo di grazia, puoi cancellare l'abbonamento senza alcuna penalità.","During the grace period, you can cancel your subscription without any penalties.","it","en","","","membership, pass"
"cassetta","box","La gallina deporrà le sue uova nella cassetta di nidificazione ogni mattina.","The hen will lay her eggs in the nesting box each morning.","it","en","","",""
"gambero","shrimp","I due iniziarono a combattere, e il gambero fu sconfitto.","The two began a fight, and the shrimp was beaten up.","it","en","","",""
"pudore","modesty","Le forme che il pudore assume variano da una cultura all'altra.","The forms taken by modesty vary from one culture to another.","it","en","","",""
"occuparsi","deal with","Hanno chiamato un disinfestatore per occuparsi dell'infestazione di termiti.","They called an exterminator to deal with the white ant infestation.","it","en","","","take care, cope with"
"etichetta","label","Ha staccato l'etichetta dalla bottiglia con un paio di forbici.","She nicked the label off the bottle with a pair of scissors.","it","en","","","tag, etiquette"
"scheda","card","Una scheda perforata fu inserita nella macchina per avviare il processo.","A punch card was inserted into the machine to start the process.","it","en","","","tab, board"
"consegnare","deliver","I camionisti sono partiti all'alba per consegnare le merci in orario.","The truckers hit the road at dawn to deliver their goods on schedule.","it","en","","","hand over, submit"
"sempre di più","more and more","Ogni tentativo di imbucare il bersaglio in rapido movimento lo eccitava sempre di più.","Every attempt to pot the fast-moving target excited him more and more.","it","en","","",""
"in termini di tempo","time-consuming","Ha trovato il processo impegnativo frustrante e dispendioso in termini di tempo.","He found the trying on process to be frustrating and time-consuming.","it","en","","",""
"scettiche","skeptical","Molte persone erano scettiche riguardo alla sua previsione sull'aumento del mercato.","Many people were skeptical of his prediction concerning the market's rise.","it","en","","",""
"permettersi","afford","La piccola azienda era al verde e non poteva permettersi di assumere nuovi dipendenti.","The small business was badly off and couldn't afford to hire new employees.","it","en","","","allow oneself, indulge"
"gonfio","swollen","Il pettirosso cinguettava felice, col gozzo gonfio di vermi abbondanti.","The robin chirped happily, its crop swollen from the abundant worms.","it","en","","",""
"arrendersi","surrender","Il generale sapeva che era ora di alzare bandiera bianca e arrendersi.","The general knew it was time to throw in the towel and surrender.","it","en","","","give up, give in"
"peccato","sin","Mentire è spesso considerato un peccato capitale in molte culture e religioni.","Lying is often considered a cardinal sin in many cultures and religions.","it","en","","","shame, pity"
"scorrevole","sliding","Il suo touchscreen scorrevole rende facile navigare tra le app.","Her sliding touchscreen makes it easy to navigate through apps.","it","en","","","slide, smooth"
"rincorrere","chase","Hanno iniziato a rincorrere il ladro mentre scappava nel vicolo.","They began to chase the thief as he ran down the alley.","it","en","","","run after, pursue"
"impolverato","dusty","Ha inciso il suo nome con un dito sul vetro impolverato.","She etched her name with a finger on the dusty windowpane.","it","en","","",""
"tagliare","cut","Gli sforzi del governo per tagliare la burocrazia hanno migliorato notevolmente l'efficienza.","The government's efforts to cut red tape have improved efficiency significantly.","it","en","","",""
"fianco","side","Il cane rimase vicino e fedele al fianco del suo padrone.","The dog stayed closely and tightly by its owner's side.","it","en","","",""
"fare un esempio","give an example","Ok, ora devi fare un esempio usandola in una frase.","Okay, now you have to give an example of it in a sentence.","it","en","","","to give an example"
"sparire","disappear","Il mago ha fatto sparire l'elefante davvero, non era solo un'illusione.","The magician made the elephant disappear for real, not just an illusion.","it","en","","","go away, vanish"
"precipitevolissimevolmente","precipitably","","","it","en","","",""
"bruscolino","smidge","bruscolino","smidge","it","en","","",""
"letamaio","dunghill","letamaio","dunghill","it","en","",""," cesspool,  midden"
"macello","slaughterhouse","macello","slaughterhouse","it","en","",""," slaughter,  mess"
"spaccare","split","spaccare","split","it","en","",""," break,  smash"
"scarlattina","scarlet fever","scarlattina","scarlet fever","it","en","","",""
"mazza","bat","mazza","bat","it","en","",""," club,  poker"
"mascalzone","rascal","mascalzone","rascal","it","en","",""," scoundrel,  villain"
"verme","worm","verme","worm","it","en","",""," creep,  maggot"
"patto","pact","Il patto profano fu sigillato col sangue, legando i loro destini insieme.","The unholy pact was sealed with blood, binding their fates together.","it","en","","","covenant, deal"
"contrattempo","setback","Credeva in se stessa e sapeva di poter superare il contrattempo.","She believed in herself and knew she could pull through the setback.","it","en","","","mishap, hiccup"
"andare a ruba","flying off the shelves","Il sangue in questo posto ha il vizio di andare a ruba.","The blood in this place has a habit of flying off the shelves.","it","en","","","sell like hotcakes, sell like hot cakes"
"apparecchiare","set","Se avesse bisogno di me per apparecchiare i tavoli, lo farei...","If he needed me to set tables that night, I would...","it","en","","","lay, set the table"
"macellare","slaughter","È importante imparare le tecniche corrette per macellare gli animali in modo appropriato.","It is important to learn the proper techniques to slaughter animals correctly.","it","en","","","butcher, knacker"
"rotella","wheel","Devi regolare la rotella di tensione prima di modificare le impostazioni.","You must wind the tension wheel before adjusting the settings.","it","en","","","thumbwheel, castor"
"mito","myth","Ha sempre pensato che il colpo di fulmine fosse un mito finché non gli è successo.","He always thought love at first sight was a myth until it happened to him.","it","en","","","legend, mythology"
"vivo e vegeto","alive and well","Lo spirito comunitario qui è vivo e vegeto, favorendo le connessioni tra vicini.","The community spirit here is alive and well, fostering connections among neighbors.","it","en","","","alive and kicking, hale and hearty"
"scattolina","box","Winston non ha badato a spese, per questa scatolina di legno.","Winston didn't spare any pennies with this box of wood.","it","en","","","case, bitty box"
"tappa","stage","Già vi avevamo segnalato l'evento in occasione della prima tappa.","We already signalled the event on the occasion of its first stage.","it","en","","","stop, step"
"mossa","move","La loro mossa aziendale audace ha fatto scalpore nei mercati finanziari.","Their bold business move made a splash in the financial markets.","it","en","","","play, step"
"feccia","scums","Per risolvere la tua feccia, la spazzatura è più che sufficiente.","To fix you scums, trash is more than enough.","it","en","","","dreg, trash"
"ricettacolo","receptacle","Il ricettacolo del girasole è abbastanza robusto da sostenere numerosi piccoli fiori.","The sunflower's receptacle is sturdy enough to support numerous tiny florets.","it","en","","","vessel, repository"
"raffigurare","depict","Ha scelto il verde vescica per raffigurare le foglie ricche e scure nella sua arte.","He selected sap green to depict the rich, dark leaves in his art.","it","en","","","represent, portray"
"grezzo","raw","Il girato grezzo sarà montato prima dell'uscita del film finale.","The raw footage will be edited before the final movie release.","it","en","","","rough, crude"
"faccenda","thing","Johnny, digli quell'altra faccenda che mi sta a cuore.","Johnny, you explain the other thing I wanted to talk about.","it","en","","","matter, business"
"redditizio","profitable","Tutto ciò in cui investe diventa redditizio; ha davvero il tocco d'oro.","Everything she invests in turns profitable; she truly has the golden touch.","it","en","","","lucrative, cost effective"
"affidare","entrust","Si preferisce affidare la gestione ad un profilo con esperienza nel settore.","It prefers to entrust the management to a profile with industry experience.","it","en","","","trust, rely"
"campione","sample","Il campione conteneva un minerale unico che ha incuriosito i ricercatori.","The sample contained a unique mineral that intrigued the researchers.","it","en","","","champion, specimen"
"sorgente","source","Il suo telefono funge da sorgente luminosa portatile durante i blackout.","Her phone acts as a portable light source during power outages.","it","en","","","spring, fountain"
"lascia perdere","never mind","Io direi una vacanza di sei mesi... lascia perdere la libertà vigilata.","I call it a six-month vacation, never mind probation.","it","en","","","forget about it, leave it alone"
"avere le carte in regola","have the right cards","","","it","en","","",""
"tracce","tracks","La musica pirata era popolare tra i fan che cercavano tracce esclusive.","The bootleg music was popular among fans who wanted exclusive tracks.","it","en","","","traces, trail"
"rilevare","detect","Il telescopio può rilevare oggetti nell'ordine di anni luce di distanza.","The telescope can detect objects in the order of light-years away.","it","en","","","note, point out"
"trattenere","hold","I passeggeri potevano solo trattenere il fiato durante la picchiata dell'aereo.","Passengers could only hold their breath during the aircraft's nosedive.","it","en","","","retain, keep"
"caminetto","fireplace","Spesso mi rilasso davanti al caminetto durante le fredde notti invernali.","I often lounge in front of the fireplace during cold winter nights.","it","en","","","mantelpiece, chimney"
"cammino","path","Il cammino davanti era indistinto, oscurato da una fitta nebbia e ombre.","The path ahead looked unclear, obscured by thick fog and shadows.","it","en","","","journey, way"
"fiammifero","match","Bastò un solo fiammifero per dar fuoco all'intera catasta di legna.","They needed just one match to kindle the whole stack of firewood.","it","en","","","matchstick, light"
"accendino","lighter","Il falò fu acceso con un semplice accendino preso dallo zaino.","The campfire was started with a simple lighter from the backpack.","it","en","","","cigarette lighter, light"
"candela","candle","La fiamma della candela è uscita a causa del forte vento fuori.","The candle flame has gone out due to the strong wind outside.","it","en","","","candlelight, candela"
"assumersi","take","La sua audacia nell'assumersi rischi spesso porta sia ricompense che sfide.","His daringness to take risks often yields both rewards and challenges.","it","en","","","assume, accept"
"fuori di sé","out of his mind","Quando ha sentito la notizia, è andato completamente fuori di sé dalla gioia.","When he heard the news, he went completely out of his mind with joy.","it","en","","","over the edge, wild"
"saltare in aria","blow up","Stasera noi due soli, faremo saltare in aria un'altra fabbrica.","Tonight, the two of us alone will blow up another factory.","it","en","","","explode, blown off"
"casalinga","housewife","Come casalinga, è diventata un'esperta nella gestione del tempo.","As a housewife, she has become an expert at time management.","it","en","","","home, homemaker"
