source,target,source example,target example,source language,target language,source segment,url,comment
"inedito","new","Non è certo un fenomeno inedito, ma c'è una novità.","It is not a new phenomenon, but something has changed.","it","en","","",""
"angoscia","anguish","Ha cercato aiuto per affrontare l'angoscia mentale causata da problemi finanziari.","He sought help to address the mental anguish caused by financial troubles.","it","en","","",""
"spopolare","depopulate","Un copricapo che segnò un'epoca e che continua a spopolare nel mondo.","A headdress that marked an era and continues to depopulate the world.","it","en","","",""
"sopportare","bear","Trovava difficile sopportare il freddo pungente durante la sua vacanza.","She found the nasty cold weather hard to bear during her vacation.","it","en","","",""
"sebbene","although","La ricetta, sebbene semplice, era scarsa di sapore e originalità.","The recipe, although simple, was lacking flavor and excitement.","it","en","","",""
"far scendere","bring down","Solo allora inizieremo a far scendere i coloni.","Only then will we begin to bring down the settlers.","it","en","","",""
"far attraccare","to dock","Dobbiamo fermare la spinta per far attraccare altra nave, ok?","Must cut thrust for other ship to dock, okay?","it","en","","",""
"qualsiasi","any","Alle guardie di sicurezza fu ordinato di fermare qualsiasi intruso a vista.","The security guards were instructed to detain any intruders on sight.","it","en","","",""
"così come","as well as","I cefali si possono trovare nei fiumi così come negli oceani.","Mullet can be found in rivers as well as oceans.","it","en","","",""
"contraddistinto","marked","Un mandato è spesso contraddistinto da eventi politici significativi o crisi.","A term of office is often marked by significant political events or crises.","it","en","","",""
"all'interno di","within","È essenziale inserire attività di svago all'interno di un programma intenso.","It's essential to space leisure activities within a busy schedule.","it","en","","","inside, inside of"
"riprese","footage","Il documentario ha preso corpo man mano che venivano condotte più interviste e raccolte riprese.","The documentary film took shape as more interviews were conducted and footage collected.","it","en","","","shooting, filming"
"prendersela","take it","E devono prendersela per forza con me dopo lo show...","And they need to take it up with me after the show...","it","en","","",""
"gommone","dinghy","Ogni volta che piove, il gommone tende a imbarcare acqua attraverso le giunture.","Every time it rains, the dinghy tends to ship water through the seams.","it","en","","","raft, rubber boat"
"incolumità","safety","Le misure di sicurezza rafforzate garantirono l'incolumità di tutti all'evento.","The tightened security measures ensured everyone's safety at the event.","it","en","","","security, integrity"
"fuorvianti","misleading","Le sue dichiarazioni fuorvianti servivano solo a confondere le acque durante l'indagine.","His misleading statements only served to muddy the waters during the investigation.","it","en","","","misguided, mislead"
"raffigurare","depict","Se continui a esercitarti, puoi in seguito raffigurare soldati reali.","If you still practice this, you can later depict real soldiers.","it","en","","",""
"presunta","alleged","Il suo romanzo fu bandito per la presunta offesa alle religioni stabilite.","Her novel was banned for its alleged blasphemy towards established religions.","it","en","","",""
"indissolubile","indissoluble","Questo disegno può ben rappresentare l'unione indissolubile tra i vari elementi.","This design can well represent the indissoluble union between all elements.","it","en","","",""
"indiscusso","undisputed","Nel suo campo, è l'esperto indiscusso sull'argomento.","In his field, he is the undisputed expert on the subject.","it","en","","",""
"dunque","therefore","Una frazione, dunque, e per giunta tutt'altro che popolosa.","A fraction, therefore, and in addition anything but populous.","it","en","","",""
"denunciare","denounce","La comunità si è unita per denunciare l'estrema immoralità riflessa nelle notizie locali.","The community rallied together to denounce the gross indecency reflected in the local news.","it","en","","","report, expose"
"al di fuori","outside","Molti integralisti trovano difficile socializzare al di fuori dei loro gruppi consolidati.","Many sectarians find it difficult to socialize outside their established groups.","it","en","","","out, beyond"
"promuovere","promote","Hanno organizzato un evento comunitario per promuovere l'esercizio fisico per tutti.","They organized a community event to promote physical fitness for everyone.","it","en","","","foster, encourage"
"risonanza","resonance","Il radicale fenilico può stabilizzarsi grazie alla risonanza con i suoi elettroni.","The phenyl radical can stabilize itself due to resonance with its electrons.","it","en","","",""
"suscitato","sparked","La smentita del politico sembrava insincera e ha solo suscitato più domande.","The politician's denial seemed insincere and only sparked more questions.","it","en","","","aroused, raised"
"concorso","competition","È passata dalle stalle alle stelle vincendo il concorso canoro nazionale.","She went from zero to hero by winning the national singing competition.","it","en","","","contest, pageant"
"lacuna","gap","Questa nuova politica aiuterà a colmare una lacuna nel nostro sistema sanitario.","This new policy will help fill a gap in our healthcare system.","it","en","","","shortcoming, lacuna"
"affiancato","flanked","Il soldato era affiancato dai suoi compagni, garantendo sicurezza nella situazione tesa.","The soldier was flanked by his comrades, ensuring safety in the tense situation.","it","en","","","joined, supported"
"mirino","viewfinder","Il mirino inclinato rivelava un panorama che l'obiettivo diritto non poteva catturare.","The biased viewfinder revealed a panorama that the straight lens could not capture.","it","en","","","sight, crosshair"
"rimpiazzare","replace","Nessun mondo virtuale può o deve rimpiazzare ciò che la famiglia offre.","No virtual world can or should replace what family can offer.","it","en","","","substitute, displace"
"sfilare","parade","Durante l'evento comunitario, tutti sono invitati a sfilare nel parco fieristico.","During the community event, everyone is invited to parade around the fairgrounds.","it","en","","","march, model"
"targa","plate","Sandro, nel suo angolo, incide una nuova targa di marmo.","Sandro, in his corner, engraves a new marble plate.","it","en","","",""
"spago","twine","Il pacco era assicurato con lo spago per tenere tutto al sicuro.","The package was tied with twine to keep everything secure.","it","en","","","string, cord"
"saccheggiata","sacked","Dopo il passaggio dell'esercito, la città giaceva saccheggiata e desolata.","After the army marched through, the town lay sacked and desolate.","it","en","","",""
"sottosuolo","underground","Il luogo dove le tecnologie e le ingegnerie per il sottosuolo sono protagoniste.","The place where underground technologies and engineering take centre stage.","it","en","","","subsoil, ground"
"colpo","shot","Un fade può essere un colpo utile per navigare fairway insidiosi.","A fade can be a useful shot for navigating tricky fairways.","it","en","","","blow, coup"
"intreccio","weave","Studiava diversi tipi di intreccio per il suo corso di design tessile.","He studied different types of weave for his textile design class.","it","en","","","weave, intertwining"
"smosso","stirred","Quell'articolo sul giornale di oggi, ha veramente smosso le acque.","That article in the paper today has really stirred the pot.","it","en","","","loose, shaken"
"in superficie","on the surface","Sembrava calma in superficie, ma i suoi sentimenti andavano oltre il valore apparente.","She appeared calm on the surface, but her feelings were beyond face value.","it","en","","","to the surface, above ground"
"sfruttano","exploit","Possano marcire all'inferno tutti coloro che sfruttano gli innocenti, pensò.","May all those who exploit the innocent rot in hell, he thought.","it","en","","","use, take advantage"
"fognario","sewage","La puzza dell'impianto fognario era da far vomitare; era insopportabile.","The stink from the sewage plant could gag a maggot; it was unbearable.","it","en","","",""
"indagare","investigate","Il detective decise di fare di testa propria e indagare sul caso da solo.","The detective decided to go rogue and investigate the case on his own.","it","en","","","look into, dig"
"cullare","lull","Infine ci si può cullare sulle nostre amache nel silenzio della natura.","Finally we can lull on our hammocks in the silence of nature.","it","en","","","rock, cradle"
"stordire","stun","Ha cercato di stordire l'intruso con un rapido colpo alla gola.","She tried to stun the intruder with a quick jab to his throat.","it","en","","","deafen, knock out"
"complessivamente","overall","Imparando a sfumare, migliorò notevolmente le sue abilità di disegno complessivamente.","By learning to shade, he improved his overall drawing skills significantly.","it","en","","",""
"picchiare","hit","Qualunque sia il motivo, è sbagliato picchiare la gente.","Whatever the reason was, it's wrong to hit people.","it","en","","",""
"succoso","succulent","Una regolare routine di irrorazione ha mantenuto l'arrosto succoso per tutta la durata della cottura.","A regular basting routine kept the roast succulent throughout the cooking time.","it","en","","",""
"smentire","deny","Ogni esperimento preciso mira a confermare o smentire una proposta legge fisica.","Every precise experiment aims to confirm or deny a proposed physical law.","it","en","","",""
"apposta","on purpose","Penso che abbia rotto il vaso apposta per attirare l'attenzione dei genitori.","I think he broke the vase on purpose to get attention from his parents.","it","en","","","especially, specifically"
"travisare","misrepresent","Non travisare le tue capacità; l'onestà è fondamentale per costruire fiducia.","Do not misrepresent your abilities; honesty is crucial in building trust.","it","en","","","twist, misstate"
"affidare","entrust","Potresti affidare a noi la gestione mensile dei tuoi social network.","You could entrust the monthly management of your social networks to us.","it","en","","",""
"sottoporre","submit","Perché l'uomo deve sottoporre tutto ciò che fa alla sua verità.","Because man must submit everything he does to his truth.","it","en","","","subject, refer"
"pizzicare","pinch","È possibile pizzicare la macchina per le bambole in un yuan.","It is possible to pinch out the doll machine in one yuan.","it","en","","","pluck, strum"
"svolta","turn","Fai una svolta a sinistra al prossimo incrocio per raggiungere il museo.","Take a left turn at the next intersection to reach the museum.","it","en","","","turning point, breakthrough"
"rimpasto","reshuffle","Dopo il rimpasto, è diventato il sottosegretario responsabile degli affari sociali.","After the reshuffle, he became the junior minister responsible for social affairs.","it","en","","","reshuffling, shakeup"
"indugio","delay","Al calar della notte, decisero di irrompere nella base nemica senza ulteriore indugio.","As night fell, they decided to storm the enemy base without further delay.","it","en","","","ado, hesitation"
"odierno","modern","La variante con i pinoli è molto simile all'odierno pesto.","The variant with pine nuts is very similar to modern pesto.","it","en","","","modern, present"
"largo","wide","Un ponte a pedaggio collega le due città attraverso il largo fiume.","A toll bridge connects the two towns across the wide river.","it","en","","","large, wider"
"reciso","severed","La verità è che un nervo reciso può anche non guarire più .","The truth is, a severed nerve may never fully reconnect.","it","en","","","cut, cut off"
"aborrire","abhor","Avere tutte le virtù ed aborrire tutti i mali.","I want to have all virtues and abhor all wickedness.","it","en","","","hate, detest"
"scudiero","squire","Il mio scudiero gli mostrerà la via, o bellissima dama.","My squire will show him the way, O fairest lady.","it","en","","","equerry, armor-bearer"
"gettare le basi","lay the foundations","Lui si propone di gettare le basi per una comunità più sostenibile.","He aims to lay the foundations for a more sustainable community.","it","en","","","lay the foundation, lay the groundwork"
"scoiattolo","squirrel","Lo scoiattolo si affanna a mettere da parte noci per i mesi invernali.","The squirrel busily stores away nuts for the coming winter months.","it","en","","","chipmunk, sciurine"
"affamato","hungry","Il leone affamato era a caccia, alla ricerca del suo prossimo pasto.","The hungry lion was on the prowl, searching for its next meal.","it","en","","","starving, starved"
"ovattato","muffled","La neve cadde sul tetto, creando un suono soffice e ovattato.","Snow thudded onto the roof, creating a soft, muffled noise.","it","en","","","hushed, padded"
"perquisizione","search","Ha presentato un reclamo per la perquisizione illegale del suo veicolo.","She filed a complaint about the warrantless search of her vehicle.","it","en","","","raid, frisking"
"mandato","sent","Non ha potuto essere presente alla cerimonia, ma ha mandato dei fiori.","He couldn't be there for the ceremony, but he sent flowers.","it","en","","","sending, screwed"
"trono","throne","Queste sedie sono comode come un trono, offrendo il massimo comfort.","These chairs are sweet as a throne, providing utmost comfort.","it","en","","","seat, porcelain goddess"
"inerte","inert","La reazione procede meglio quando R è un gruppo alifatico e inerte.","The reaction is most successful when R is aliphatic and inert.","it","en","","","inactive, lifeless"
"aletta","fin","Sull'interno la borsa caratterizza una tasca extra dell'aletta.","On the inside the bag features an extra fin pocket.","it","en","","","flap, wing"
"asta","auction","Ha comprato la vecchia auto all'asta per poco o niente.","He bought the old car for next to nothing at the auction.","it","en","","","rod, shaft"
"scindere","separate","Non si possono scindere i due problemi.","It is not possible to separate the two problems.","it","en","","","split, break down"
"consiglio","council","Il rapporto ambientale ha sollevato un vespaio per il consiglio comunale.","The environmental report opened a can of worms for the city council.","it","en","","",""
"compiacere","please","Le risposte diplomatiche del politico erano progettate per compiacere tutti nel pubblico.","The politician's minced responses were designed to please everyone in the audience.","it","en","","",""
"guarito","healed","Il suo cuore guarito gli permise di amare di nuovo senza esitazioni.","His healed heart allowed him to love again without hesitation.","it","en","","","cured, recovered"
"arnia","hive","Abbiamo posizionato un'arnia vicino all'orto per favorire l'impollinazione.","We placed a hive near the vegetable garden to help with pollination.","it","en","","","beehive, apiary"
"liso","worn","Il tappeto ammuffito del soggiorno era consumato e liso da anni di incuria.","The mildewed rug in the living room was threadbare and worn from years of neglect.","it","en","","","threadbare, shabby"
"paludoso","marshy","Il paesaggio paludoso era ricco di piante verdi e fauna selvatica vibrante.","The marshy landscape was filled with rich green plants and vibrant wildlife.","it","en","","","swampy, boggy"
"schiacciante","overwhelming","Ha rifiutato di cedere nonostante la pressione schiacciante dei suoi coetanei.","He refused to back down despite the overwhelming pressure from his peers.","it","en","","",""
"attenersi","follow","Tutti devono attenersi al calendario provvisorio fino a nuovo avviso.","Everyone needs to follow the tentative schedule until further notice.","it","en","","","stick, adhere"
"disposto a","willing to","Era disposto a mettersi in gioco con la sua reputazione per questo progetto.","He was willing to put on the line his reputation for this project.","it","en","","",""
"dirigente","executive","Lo stress è parte integrante del lavoro quando sei un dirigente di alto livello.","Stress is part and parcel of the job when you're a high-level executive.","it","en","","","manager, leader"
"arare","plow","Il trattore si è impantanato mentre cercava di arare il terreno fradicio.","The tractor became bogged while attempting to plow the soggy land.","it","en","","","plough, till"
"in trattative","in talks","Dieulafait è fermo in trattative con il team.","Dieulafait is still in talks with the team.","it","en","","",""
"esitare","hesitate","Non esitare a donare; anche il poco è qualcosa per la causa benefica.","Don't hesitate to donate; every little bit helps the charity's cause.","it","en","","","falter, pause"
"per bene","right","Te l'ho detto sto cercando di fare le cose per bene.","I told you... I am trying to make things right.","it","en","","",""
"diradato","thinned","Dopo la potatura, il fogliame diradato offriva una vista migliore della casa.","After pruning, the thinned foliage offered a better view of the house.","it","en","","","sparse, thinning"
"relitto","wreck","La vita marina prosperava intorno al relitto sommerso, creando un vivace ecosistema subacqueo.","Marine life thrived around the sunken wreck, creating a vibrant underwater ecosystem.","it","en","","","wreckage, shipwreck"
"postino","postman","Si paga il prezzo del prodotto e la consegna direttamente al postino.","You pay the product and delivery price directly to the postman.","it","en","","","mailman, mail carrier"
"montare","mount","Ha deciso di montare un supporto a parete per la libreria pesante.","He decided to mount a wall bracket for the heavy bookshelf.","it","en","","","assemble, fit"
"slitta","sled","Hanno costruito la slitta con pattini lunghi per navigare nella neve profonda.","They built the sled with long runners to navigate deep snow.","it","en","","","sleigh, sledge"
"barca","boat","Si sentiva verde in viso mentre la barca ondeggiava avanti e indietro.","She felt green around the gills as the boat rocked back and forth.","it","en","","","sailboat, ship"
"incavo","socket","Il ferro è stato valutato dalla forza della vite di incavo esagonale.","The iron was evaluated by the strength of hexagonal socket screw.","it","en","","","recess, hollow"
"infossamento","sinking together","La causa di questo è data da un infossamento dei corpi vertebrali.","The cause of this is a sinking together of vertebrae.","it","en","","",""
"nicchia","niche","La band si è creata una nicchia mescolando diversi generi musicali.","The band carved a niche by blending different genres of music.","it","en","","","alcove, recess"
"svagare","amuse","Per alcune l'installazione stessa è un periodo di grande attività e impegno mentale, che contribuisce a distrarre e a svagare.","For some, getting installed was a period of great activity and mental effort, which helped to distract and amuse them.","it","en","","","entertain, divert"
"prosa","prose","La scrittrice mira a sfumare la sua prosa con sottotoni emotivi.","The writer aims to shade her prose with emotional undertones.","it","en","","","drama, plays"
"stuzzichino","snack","Ha detto che è un nuovo membro, non uno stuzzichino.","He said she's a new member, not a snack.","it","en","","","appetizer, pincho"
"consegna","delivery","La consegna è arrivata in orario, proprio come l'azienda aveva promesso.","The delivery arrived on time, just as the company had promised.","it","en","","","delivering, shipping"
"rione","ward","Nel rione trovò le sorelle che voleva e di cui aveva bisogno.","She found the sisters she wanted and needed in our ward.","it","en","","","district, neighborhood"
"antiruggine","anti-rust","Buona prestazione anticorrosiva ed antiruggine nel progetto del paesaggio dell'acqua.","Good anti-corrosion and anti-rust performance in the water landscape project.","it","en","","","antirust, rustproof"
"vernice","paint","La vernice avanzata dal progetto è stata conservata per un uso futuro.","The surplus paint from the project was stored for future use.","it","en","","","varnish, lacquer"
"piombo","lead","Il piombo martellato era stato modellato in intricati motivi per l'arte decorativa.","The beaten lead was fashioned into intricate patterns for decorative art.","it","en","","","plumb, sinker"
"guaire","yelp","Dopo la caduta, poteva solo guaire di dolore e frustrazione.","After her fall, she could only yelp in pain and frustration.","it","en","","","yap, whine"
"ritirare","withdraw","Si riserva la facoltà di ritirare la sua candidatura senza preavviso.","She reserves the right to withdraw her application without notice.","it","en","","","pick up, collect"
"tisana","herbal tea","Questa tisana fa miracoli per alleviare lo stress e favorire il rilassamento.","This herbal tea works wonders for relieving stress and promoting relaxation.","it","en","","","tea, infusion"
"ghiandola","gland","Una ghiandola linfatica ingrossata può indicare un grave problema di salute sottostante.","An enlarged lymph gland may signal a serious underlying health issue.","it","en","","","glandular, retinaculum"
"anagrafe","registry","Parlavano persino di togliere il suo nome dall'anagrafe di famiglia.","They even talked about removing his name from family registry.","it","en","","","register, registry office"
"trifolare","sautéed","Aromatizzare un filo d'olio con l'aglio e trifolare i funghi.","A little olive oil flavored with garlic and sautéed mushrooms.","it","en","","",""
"a iosa","aplenty","Il giardino è in fiore brillante, con fiori di ogni colore che crescono a iosa.","The garden blooms brightly, with flowers of every color growing aplenty.","it","en","","","out the wazoo, in plenty"
"esortare","urge","I cittadini si sono uniti per esortare i funzionari a bloccare la proposta di legge.","Citizens rallied together to urge the officials to veto the proposed law.","it","en","","","encourage, call on"
"dono","gift","Con il suo dono della parlantina, ha affascinato tutti all'evento di networking.","With his gift of the gab, he charmed everyone at the networking event.","it","en","","","present, giving"
"piega","fold","Ha tracciato con il dito la piega del libro logoro ma prezioso.","She traced her finger along the fold of the worn-out treasured book.","it","en","","","bend, turn"
"edile","construction","I contratti in economia sono comuni nel settore edile per lavori imprevedibili.","Time and material contracts are common in the construction industry for unpredictable work.","it","en","","","building, structural"
"issa","hoist","E quando hai finito di costruire, metti gli utensili nel nascondiglio segreto e issa la bandiera della casa sull'albero!","When you're done building, put your tools in the secret hiding place and hoist the treehouse flag!","it","en","","","oops-a-daisy, Lssa"
"lordare","soiling","Habitat che ha opportunamente imparato a frequentare sfidando spesso l'ira degli abitanti di quei luoghi in quanto, oltre al continuo lordare con il loro guano abbondante e puzzolente, anche per l'insistenza nell'avventarsi su qualsiasi cosa commestibile passi loro sotto gli occhi.","Habitats it has duly learnt to frequent often defying the rage of the people living in those sites as, besides the continuous soiling with their abundant and stinking guano, also for the insistence pouncing on any edible thing passing under their eyes.","it","en","","","begrime"
"fascicolo","file","Rimosse con attenzione il foglio macchiato dal fascicolo per evitare confusione.","He carefully removed the stained paper from the file to avoid any confusion.","it","en","","","dossier, record"
"pennuto","fowl","Caccia quel pennuto nel forno.","Just pop that fowl in the oven.","it","en","","","fowl, feathered"
"piangente","weeping","Ha parlato del suo passato piangente con autenticità e dolore.","He spoke about his weeping past with authenticity and pain.","it","en","","","crying, tearful"
"stalliera","groom","Si è presentata la moglie di Ed, ma per tua sfortuna, se n'è andata senza di lui, così hai fatto quello che dovevi per riavere la tua stalliera.","Ed's wife showed up, but to your chagrin, she left without him, so you do what you had to do in order to get your groom back.","it","en","","","stable hand, stablehand"
"lottatore","fighter","Il lottatore esperto ha dimostrato un'incredibile agilità durante l'incontro di campionato.","The skilled fighter demonstrated incredible agility during the championship bout.","it","en","","","wrestler, wrestling"
"bacchetta","wand","Abbiamo visto il mago far roteare la bacchetta prima di eseguire un trucco.","We watched the magician spin his wand before performing a trick.","it","en","","","rod, stick"
"bretella","suspender","Ha fissato saldamente la bretella prima di indossare il suo vestito preferito.","She fastened the suspender securely before putting on her favorite dress.","it","en","","","strap, harness"
"sganciare","drop","Si dice tu abbia una bomba da sganciare sulla task force.","Rumor is you got a bomb to drop on the task force.","it","en","","","unhook, release"
"salopette","overall","Ha scelto una salopette vivace che spiccava alla fiera dell'artigianato.","She chose a bright overall that stood out at the craft fair.","it","en","","","dungaree, salopettes"
"figliastro","stepson","Il mio figliastro si è diplomato di recente con ottimi voti.","My stepson recently graduated from high school with excellent grades.","it","en","","","stepchild, step-son"
"darsi alla macchia","jump bail","Il sospettato ha deciso di darsi alla macchia ed è fuggito in un altro paese.","The suspect decided to jump bail and fled to another country.","it","en","","","go bush, take it on the lam"
