source,target,source example,target example,source language,target language,source segment,url,comment
"cuscino","pillow","Notò la tendenza a prendere a pugni il cuscino di notte.","She noticed a tendency to punch her pillow at night.","it","en","","","cushion, pad"
"battaglia","battle","Il famoso attore è mancato dopo una lunga battaglia contro il cancro.","The famous actor passed away after a long battle with cancer.","it","en","","","fight, struggle"
"gabbiano","seagull's","Il volo elegante del gabbiano catturava l'essenza della tranquillità costiera.","The seagull's elegant soaring captured the essence of coastal tranquility.","it","en","","","gull, mew"
"allenamento","training","La palestra offre sessioni di allenamento personale in aggiunta per i membri interessati.","The gym offers personal training sessions on the side for interested members.","it","en","","","workout, practice"
"a prescindere da","regardless of","Sempre e a prescindere da qualsiasi situazione, è il mio motto.","Always and regardless of any situation, that's my motto.","it","en","","","apart from, aside from"
"limite","limit","Avevamo un tempo limite di tre ore per completare l'esame.","We had a time limit of three hours to complete the exam.","it","en","","","line, edge"
"sfumare","blend","Ha deciso di sfumare i colori per ottenere un effetto pittorico unico.","She decided to blend the colors for a unique painting effect.","it","en","","","fade, deglaze"
"premiare","reward","La campagna di crowdfunding includeva estrazioni casuali per premiare i sostenitori con premi esclusivi.","The crowdfunding campaign included random draws to reward backers with exclusive prizes.","it","en","","","award, recognize"
"prestare","pay","Quando la trasmissione di emergenza va in onda, tutti dovrebbero prestare molta attenzione alle istruzioni.","When the emergency broadcast comes online, everyone should pay close attention to the instructions.","it","en","","","provide, lend"
"aggirare","bypass","Escogitò un metodo ingegnoso per aggirare le misure di sicurezza in atto.","She devised a cunning method to bypass the security measures in place.","it","en","","","circumvent, get around"
"gerarchia","hierarchy","Si sta facendo strada verso i vertici della gerarchia aziendale.","He's making his way to the top of the company hierarchy.","it","en","","","ladder, pecking order"
"incanalare","channel","Nella meditazione, impara a incanalare i suoi pensieri per ottenere maggiore chiarezza.","In meditation, she learns to channel her thoughts for greater clarity.","it","en","","","funnel, harness"
"manovrizare","maneuver","Il polpo ha otto tentacoli per aiutarlo a manovrare sott'acqua.","An octopus has eight limbs to help it maneuver underwater.","it","en","","","manoeuvre, operate"
"esporre","expose","Gli investigatori hanno seguito la traccia cartacea per esporre lo schema di riciclaggio.","Investigators followed the paper trail to expose the money laundering scheme.","it","en","","","exhibit, display"
"pittore","painter","Il maestro pittore ha rivelato un segreto del mestiere ai suoi studenti.","The master painter revealed a trick of the trade to his students.","it","en","","","artist, brushman"
"passare la spirapolvere","vacuum","Io posso passare l'aspirapolvere nel corridoio mentre tu pulisci i bagni oggi.","I can vacuum the hallway while you clean the bathrooms today.","it","en","","","hoover up, hoover"
"racchiudere","enclose","La cupola richiede la minor quantità di materiale per racchiudere un'area.","The dome requires the least amount of material to enclose a given area.","it","en","","","contain, encompass"
"ci porta a","leads us to","Ogni decisione che prendiamo oggi ci porta a un momento cruciale domani.","Every decision we make today leads us to a critical juncture tomorrow.","it","en","","","brings us to, takes us to"
"chiocciola","snail","I bambini erano affascinati dalla chiocciola che avevano scoperto in giardino.","The children were fascinated by the snail they discovered in the backyard.","it","en","","",""
"perossido di idrogeno","hydrogen peroxide","La natura ossidante del perossido di idrogeno lo rende utile come disinfettante.","The oxidising nature of hydrogen peroxide makes it useful as a disinfectant.","it","en","","",""
"felpa","sweatshirt","La sua felpa preferita ha uno slogan divertente stampato sul davanti.","Her favorite sweatshirt has a funny slogan printed on the front.","it","en","","","hoodie, sweater"
"giacca","jacket","Porterò una giacca, non si sa mai se farà freddo più tardi.","I'll bring a jacket just in case it gets cold later.","it","en","","","coat, suit"
"mouthwash","collutorio","Choosing the right mouthwash can make a big difference in oral care.","Scegliere il collutorio giusto può fare una grande differenza nella cura orale.","en","it","","","colluttorio, sciacquo"
"marinare","marinate","Per marinare il pollo, usa un bicchiere di succo di limone.","To marinate the chicken, use a wineglass of lemon juice.","it","en","","","marinade, skip"
"a causa di","due to","La riunione ebbe luogo prima del previsto a causa di questioni urgenti.","The meeting took place earlier than scheduled due to urgent matters.","it","en","","","because of, as a result of"
"spassarsela","have fun","Nonostante la pioggia, erano entusiasti di divertirsi e spassarsela.","Despite the rain, they were excited to party and have fun.","it","en","","","fool around, have a good time"
"contenitore","container","Durante l'ispezione, il contenitore doveva essere posizionato in verticale.","During the inspection, the container needed to be positioned upright.","it","en","","","box, vessel"
"previsto","expected","Gli sponsor hanno dovuto sganciare più del previsto per l'evento.","The sponsors had to pony up more than expected for the event.","it","en","","","planned, scheduled"
"taccagneria","stinginess","La taccagneria del budget ha limitato ciò che il team poteva realizzare quest'anno.","The stinginess of the budget limited what the team could accomplish this year.","it","en","","","cheapness, penny-pinching"
"spoglio","barren","I giunchi aggiungono texture al paesaggio altrimenti spoglio vicino al fiume.","Rush adds texture to the otherwise barren landscape near the river.","it","en","","","barren, stark"
"occorrere","take","Se è una più piccola pianta può occorrere un altro anno.","If it is a smaller plant it may take another year.","it","en","","","occur, need"
"anulare","ring","Le patate colpite mostravano chiari sintomi di marciume anulare al mercato.","Affected potatoes showed clear symptoms of ring rot at the market.","it","en","","","annular, ring-shaped"
"avaro","stingy","Il ristorante avaro faceva pagare tutto, anche tovaglioli e acqua extra.","The stingy restaurant charged for everything, even extra napkins and water.","it","en","","","greedy, miserly"
"tuttavia","however","Le sue storie sembravano emozionanti; tuttavia, la realtà era piuttosto banale.","His stories sounded thrilling; however, the actuality was rather mundane.","it","en","","","but, nevertheless"
"massiccio","massive","Ammirava il massiccio artiglio dell'orso conservato nel museo di storia naturale.","He admired the massive bear claw preserved in the natural history museum.","it","en","","",""
"tradimento","betrayal","Il tradimento del suo migliore amico lo ha lasciato col cuore a pezzi.","The betrayal of his best friend left him sick at heart.","it","en","","",""
"spada","sword","Il cavaliere fece un rapido affondo con la spada durante il duello.","The knight made a quick thrust with his sword during the duel.","it","en","","",""
"spaziale","space","Il successo della missione spaziale è appeso a un filo mentre sorgono problemi tecnici.","The success of the space mission hangs in the balance as technical issues arise.","it","en","","","spatial, rocket"
"aggrappare","cling","La barca ondeggiante lottava contro le onde, facendo aggrappare saldamente tutti quelli a bordo.","The teetering boat struggled against the waves, making everyone inside cling tightly.","it","en","","",""
"coccola","cuddle","Prima di andare a dormire, chiede sempre l'ultima coccola al papà.","At bedtime, she always requests a last cuddle from her dad.","it","en","","",""
"ciuffo","tuft","Un morbido ciuffo d'erba spuntava nell'angolo del giardino trascurato.","A soft tuft of grass sprouted in the corner of the neglected garden.","it","en","","","clump, forelock"
"sopracciglio","eyebrow","Alzò un sopracciglio con sospetto quando lei menzionò il suo collega misterioso.","He raised an eyebrow suspiciously when she mentioned her mysterious co-worker.","it","en","","","brow, supercilium"
"puntale","tip","Questo puntale di scarico sembra ottimo e aggiunge il giusto tocco finale.","This exhaust tip looks great and add just the right final touch.","it","en","","","toe cap, ferrule"
"scarseggiare","scarce","La peste, fa scarseggiare il cibo, come potete bene immaginare.","The plague, it has made food scarce, as you can imagine.","it","en","","",""
"minacciare","threaten","Un'infestazione può minacciare la popolazione di frassino americano in alcune regioni.","An infestation can threaten the population of white ash in certain regions.","it","en","","",""
"pattuglia","patrol","Durante la pattuglia, il fante rimaneva vigile per qualsiasi segno di pericolo.","While on patrol, the private remained alert for any signs of danger.","it","en","","",""
"sgridare","yell at","Perché non avrai nessuno da sgridare per la sua incapacità di cucire.","Because you won't have someone to yell at about his sewing.","it","en","","",""
"inganno","deception","In politica, c'è spesso un sottile confine tra diplomazia e inganno.","In politics, there's often a fine line between diplomacy and deception.","it","en","","","deceit, trick"
"come tale","as such","È un'accusa fatta per vendetta e dovrebbe essere trattata come tale.","This is a vindictive prosecution and should be treated as such.","it","en","","",""
"tenda","tent","Montarono la tenda rivolta a nord-est per catturare il sole del mattino.","They pitched their tent facing northeast to catch the morning sun.","it","en","","",""
"occuparsi","take care","Il boss della mafia assunse un sicario per occuparsi dei suoi rivali.","The mob boss hired a hatchet man to take care of his rivals.","it","en","","",""
"brindare","toast","Hanno alzato i calici, tutti insieme, per brindare agli sposi.","They raised their glasses, altogether, to toast the newlyweds.","it","en","","",""
"schiamazzo","cackle","Il suo schiamazzo improvviso durante la seria riunione fece scoppiare tutti a ridere.","His unexpected cackle during the serious meeting made everyone burst into laughter.","it","en","","",""
"levataccia","early start","È stata una giornata lunga, iniziata con una levataccia, ma ne è valsa la pena.","It was a long day and an early start but well worth it.","it","en","","",""
"attrezzo","tool","Regolare la pinza ha permesso una presa più comoda sull'attrezzo.","Adjusting the jaw allowed for a more comfortable grip on the tool.","it","en","","",""
"filtro","filter","Il filtro utilizzato nel sistema deve essere sempre idoneo all'uso.","The filter used in the system must always be fit for purpose.","it","en","","",""
"peperoncino","chili","Per migliorare la zuppa, ha aggiunto del peperoncino tritato.","To make the soup better, she included some chopped chili.","it","en","","",""
"esporsi","expose themselves","E non dimenticare poi quello che hai detto, e quindi esporsi.","And do not forget later what you said, and then expose themselves.","it","en","","","be exposed, stick your neck out"
"commesso","clerk","Il commesso disonesto era noto per intascarsi i pagamenti dei clienti.","The dishonest clerk was known to pocket payments from customers.","it","en","","",""
"commozione","concussion","Non c'è alcun segno di commozione o di colpi alla testa.","No indication of a concussion or a blow to the head.","it","en","","",""
"sfuggire","escape","Guidava a rotta di collo attraverso la città, cercando di sfuggire alla polizia.","She drove fast and furious through the city, trying to escape the police.","it","en","","",""
"vita","life","Il giardino prende vita in primavera con la fioritura di colorati fiori.","The garden comes to life in spring with colorful flowers blooming.","it","en","","",""
"peso","weight","Il suo commento sul mio peso ha davvero toccato un nervo scoperto.","His comment about my weight really struck a nerve with me.","it","en","","",""
"circonferenza","circumference","Nel nostro esperimento, abbiamo misurato la circonferenza di diverse sfere.","In our experiment, we measured the circumference of different spheres.","it","en","","",""
"pallina","ball","Ha imparato a colpire la pallina da ping pong rapidamente e con precisione.","She learned to stroke the table tennis ball quickly and accurately.","it","en","","",""
"palline","balls","Le palline da lancio sono perfette per esercitare la mira in giardino.","The throwing balls are perfect for practicing your aim in the backyard.","it","en","","",""
"scatola","box","La scatola conteneva oggetti vari dei suoi giorni al college.","The box contained odds and ends from his college days.","it","en","","",""
"botte","barrel","Una singola doga può determinare la resistenza e la durata della botte.","A single stave can determine the strength and durability of the barrel.","it","en","","",""
"gradire","like","Non dimenticare di gradire i loro post e di impegnarsi in conversazioni.","Don't forget to like their posts and engage in conversations.","it","en","","",""
"imprevisto","unexpected","Un ostacolo imprevisto può cambiare il gioco in un istante.","An unexpected hazard can change the game in an instant.","it","en","","","unforeseen, unplanned"
"cercarsela","asking for trouble","Sfiderlo a saltare dal tetto è un modo perfetto per andare a cercarsela.","Daring him to jump off the roof is asking for trouble.","it","en","","",""
"cavarsela","get by","In qualche modo riescono sempre a cavarsela durante la bassa stagione.","Somehow, they always manage to get by during the off-season.","it","en","","",""
"tosto","tough","Non si era mai visto un giocatore così tosto ed elegante.","There's never been a player so tough, so graceful.","it","en","","",""
"svestito","undressed","Abbiamo asciugato e svestito gli scheletri, i pali con il filo avvolto.","We dried and undressed the skeletons, the poles wrapped in barbed wire.","it","en","","","stripped, naked"
"spachettare","unpack","Ok, vediamo se riesco a spacchettare un paio di cose.","Okay, let me see if I can unpack a few things here.","it","en","","","unwrap, uncrate"
"calzature","footgear","Le sue calzature erano sia eleganti che pratiche per il tempo piovoso.","His footgear was both stylish and practical for the rainy weather.","it","en","","",""
"autovelox","speed camera","Una autovelox mi ha beccato a superare il limite di velocità ieri.","A speed camera caught me driving over the limit yesterday.","it","en","","",""
"rimasuglio","remnant","Ecco come potevo usare quell'ultimo rimasuglio di farro.","That's how I could use that last remnant of farro.","it","en","","",""
"nutrirsi","feed","Una zecca potrebbe nutrirsi per diversi giorni prima di staccarsi dal suo ospite.","A tick might feed for several days before dropping off its host.","it","en","","",""
"scoppio","outbreak","Lo scoppio di incendi boschivi ha distrutto vaste aree di foresta quest'estate.","The outbreak of wildfires destroyed large areas of forest this summer.","it","en","","",""
"nodo","knot","Fare un nodo sicuro è essenziale quando si monta una tenda.","Tying a secure knot is essential when setting up a tent.","it","en","","",""
"gonfiare","inflate","La pubblicità dell'azienda era un espediente ideato per gonfiare le vendite.","The company's advertisement was a ruse designed to inflate their sales.","it","en","","",""
"filo","wire","Ha usato un filo metallico per appendere il quadro al muro.","He used a wire to hook the picture frame onto the wall.","it","en","","",""
"palloncino","balloon","Il palloncino esplose quando il bambino lo strinse troppo forte per sbaglio.","The balloon popped when the child accidentally squeezed it too hard.","it","en","","",""
"farcito","stuffed","Ha farcito i peperoni con un mix di riso e carne di salsiccia.","She stuffed the peppers with a mix of rice and sausage meat.","it","en","","",""
"traguardo","finish line","I corridori hanno tagliato il traguardo uno dopo l'altro in una gara emozionante.","The runners crossed the finish line one after another in a thrilling race.","it","en","","",""
"intellettivo","intellectual","Evocare la magia non è un uno sforzo intellettivo.","Conjuring magic is not an intellectual endeavor.","it","en","","",""
"foglia","leaf","Ammirò la parte superiore della foglia, notando i suoi intricati modelli di vene.","He admired the upside of the leaf, noting its intricate vein patterns.","it","en","","",""
"nido","nest","Morbide piume rivestivano il nido, proteggendo le uova al suo interno.","Soft down lined the nest, protecting the eggs nestled inside.","it","en","","",""
"oca","goose","Ho ammirato l'elegante oca mentre si lisciava le piume vicino al lago.","I admired the elegant goose as it preened its feathers by the lake.","it","en","","","oca, gander"
"sdraiare","lie down","Non questa, la camera dove fai sdraiare la gente.","Not this one, the room where people lie down.","it","en","","",""
"precludere","preclude","La loro disattivazione potrebbe precludere la fruizione ottimale di alcune aree del sito.","Their deactivation could preclude optimum use of some areas of the site.","it","en","","",""
"greed","avidità","The corporate boardroom had become a devil's playground of greed and corruption.","La sala del consiglio aziendale era diventata un nido di vipere di avidità e corruzione.","en","it","","",""
"reperibile","available","Elisabetta è stata molto gentile e sempre reperibile per ogni necessità.","Elizabeth was very friendly and always available for every need.","it","en","","",""
"rimetterci","get back","I piani sono saltati, ma possiamo ancora rimetterci in pista il mese prossimo.","Plans fell through, yet we can still get back on track next month.","it","en","","",""
"sfondare","break through","Ha inferto un colpo preciso per sfondare il muro spesso.","He delivered a precise thrust to break through the thick wall.","it","en","","",""
"sfogo","vent","La studentessa ha dato sfogo alla sua ansia prima dell'esame finale.","The student gave vent to her anxiety before the final exam.","it","en","","",""
"trionfo","triumph","Come nelle sfide della vita, la perseveranza porta spesso al trionfo.","As with life's challenges, perseverance often leads to triumph.","it","en","","",""
"congelatore","freezer","Un pezzo di ghiaccio è caduto dal congelatore sul pavimento.","A chunk of ice fell from the freezer onto the floor.","it","en","","",""
"grandine","hail","Il terreno brillava di grandine dopo l'intenso temporale estivo.","The ground was glistening with hail after the intense summer storm.","it","en","","",""
"delitto","crime","Un delitto passionale si è consumato rapidamente, lasciando la comunità incredula.","A crime of passion unfolded quickly, leaving the community in disbelief.","it","en","","",""
"compagnia","company","I bambini tenevano compagnia alla madre malata leggendo storie ad alta voce.","The children kept their sick mother company by reading stories aloud.","it","en","","",""
"avvolgente","enveloping","Avvolto in velluto scuro, la stanza sembrava lussuosa e avvolgente.","Swathed in dark velvet, the room felt luxurious and enveloping.","it","en","","",""
"colmi di","full of","Vi auguro pacchi colmi di felicità e fortuna, che servono sempre.","I wish boxes full of happiness and luck, that always serve.","it","en","","",""
"davanzale","windowsill","La neve si accumula sul davanzale, suggerendo il freddo invernale all'esterno.","The snow fringes the windowsill, hinting at the winter chill outside.","it","en","","","sill, window sill"
"dorso","back","La sella è stata sistemata con cura sul dorso del cavallo.","The saddle was placed carefully on the horse's back.","it","en","","",""
"carica","charge","Il fulmine è un fenomeno naturale che coinvolge una carica elettrica massiccia.","Lightning is a natural phenomenon that involves a massive electric charge.","it","en","","",""
"ricoprire","cover","Cominciamo a ricoprire i fiori con il restante gel di silice.","We begin to cover the flowers with the remaining silica gel.","it","en","","",""
"scorrere","slide","Puoi far scorrere il coperchio per rivelare lo scomparto nascosto.","You can slide the cover back to reveal the hidden compartment.","it","en","","",""
"ombelico","navel","Un tocco delicato intorno all'ombelico può essere rilassante durante un massaggio.","A gentle touch around the navel can be soothing during a massage.","it","en","","",""
"sconfitto","defeated","La squadra di casa ha sconfitto i rivali a valanga, segnando cinque gol a zero.","The home team defeated their rivals by a landslide, scoring five goals to none.","it","en","","",""
"disfatta","defeat","E confido di essere con te, in questa grande disfatta.","And I trust to be with you in that great defeat.","it","en","","",""
"mulo","mule","Ha imparato a gestire il mulo testardo con pazienza e perseveranza.","He learned to wrangle the stubborn mule with patience and perseverance.","it","en","","",""
"orto","garden","Il progetto di orto comunitario sta faticando a decollare quest'anno.","The community garden project is struggling to get off the ground this year.","it","en","","",""
"pollaio","chicken coop","Il loro pollaio era circondato da una forte barriera di rete metallica.","Their chicken coop was surrounded by a strong barrier of wire netting.","it","en","","",""
"porcellino","piggy","Durante il festival, abbiamo guardato una parata con un grande porcellino gonfiabile.","During the festival, we watched a parade featuring a giant inflatable piggy.","it","en","","",""
"fattoria","farm","Si diverte sempre un mondo quando visita la fattoria dei nonni.","He always has a blast when he visits his grandparents' farm.","it","en","","","farmhouse, homestead"
"riscatto","ransom","Molti credono che pagare il riscatto alimenti solo il ciclo di crimini.","Many believe that paying ransom only fuels the cycle of crime.","it","en","","",""
"inno","hymn","Un potente inno può elevare gli spiriti e ispirare momenti di preghiera.","A powerful hymn can uplift spirits and inspire moments of prayer.","it","en","","",""
"manicomio","asylum's","La cella imbottita del manicomio era progettata per prevenire l'autolesionismo nei pazienti agitati.","The asylum's padded cell was designed to prevent self-harm in agitated patients.","it","en","","",""
"restio","reluctant","Un testimone restio, ma lo abbiamo inchiodato per spaccio.","A reluctant witness, but we got him on a drug charge.","it","en","","",""
"meta","destination","Un tempo tranquilla cittadina, ora è diventata una popolare meta turistica.","Formerly a quiet town, it has become a popular tourist destination.","it","en","","",""
"fototessera","passport photo","Albert ha ottenuto questo effetto pensando a una fototessera.","Albert achieved this effect by thinking about a passport photo.","it","en","","",""
"scambiare","exchange","Ho proposto di stringere un accordo per scambiare servizi invece di denaro.","I proposed they make a deal to exchange services instead of cash.","it","en","","",""
"burrocacao","lip balm","La sua collezione di burrocacao include ogni colore e gusto immaginabile.","Her lip balm collection includes every color and flavor imaginable.","it","en","","",""
"labbra","lips","Strinse le labbra prima di parlare, scegliendo attentamente le sue parole.","She pursed her lips before speaking, choosing her words carefully.","it","en","","",""
"protetto","protected","Il club nautico aveva diverse barche alla fonda nel porto turistico protetto.","The yacht club had several boats at anchor in the protected marina.","it","en","","",""
"moneta","coin","Ha trovato una moneta rara come nuova al mercatino delle pulci.","She found a rare coin in mint condition at the flea market.","it","en","","",""
"omaggio","tribute","Il film è stato pensato come un omaggio ai classici film horror.","The film was conceived as a tribute to classic horror movies.","it","en","","",""
"situato","located","Hanno fatto un piccolo picnic nel parco situato accanto al viale.","They held a small picnic in the park located beside the avenue.","it","en","","",""
"pescare","fish","Siamo partiti per pescare in alto mare, lontano dalla costa.","We set out to fish in the open water far from the shore.","it","en","","",""
"fata","fairy","Le leggende parlano di una fata che protegge la foresta da danni e distruzione.","Legends speak of a fairy that protects the forest from harm and destruction.","it","en","","",""
"drago","dragon","Il drago nella storia poteva dar fuoco a interi villaggi.","The dragon in the story could set entire villages on fire.","it","en","","",""
"avvistamento","sighting","Ho registrato l'avvistamento della cometa ieri sera con gli amici.","I recorded the sighting of the comet last night with friends.","it","en","","",""
"scia","wake","Una scia sottile seguiva la canoa mentre scivolava dolcemente sul fiume.","A narrow wake followed the canoe as it glided smoothly over the river.","it","en","","",""
"velivolo","aircraft","Ogni velivolo deve passare alla modalità di volo mentre si innalza nei cieli.","Every aircraft must switch to flight mode as it ascends into the skies.","it","en","","",""
"orsetto","teddy bear","Stringeva forte un orsetto logoro, riluttante a lasciarlo andare.","She clutched the threadbare teddy bear tightly, reluctant to let go.","it","en","","",""
