source,target,source example,target example,source language,target language,source segment,url,comment
"essiccazione","drying","Dopo l'essiccazione, la zucchetta può durare molti anni.","After drying, the bottle gourd can last for many years.","it","en","","","curing, desiccation"
"secchione","eager beaver","Quel secchione arriva sempre un'ora prima per prepararsi alla riunione.","That eager beaver always arrives an hour early to prepare for the meeting.","it","en","","","geek, dweeb"
"sgabbare","grind","Durante l'estate, scelgo di sgobbare sulle mie competenze senza distrazioni.","During the summer, I choose to grind on my skills without distractions.","it","en","","","slave away, cram"
"bruciacchiato","singed","Dopo il falò, il legno bruciacchiato odorava di fumo e brace.","After the campfire, the singed wood smelled of smoke and char.","it","en","","","scorched, burnt"
"mendicante","beggar","Il mendicante all'angolo della strada era grato per qualsiasi spicciolo.","The beggar on the street corner was grateful for any small change.","it","en","","","mendicant, panhandler"
"leccarsi le dita","finger-lickin' good","La lasagna della mamma è così da leccarsi le dita che chiediamo sempre il bis.","Mom's lasagna is so finger-lickin' good that we always ask for seconds.","it","en","","","lick one's fingers, lick your fingers"
"leccarsi i baffi","lick their chops","È ora di leccarsi i baffi con i nostri gelati artigianali.","ice-cream It's time to lick their chops with our ice cream.","it","en","","","lick their chops, lick one's lips"
"nostrano","local","Dovrebbe leggerlo magari qualche imprenditore ""nostrano""...","Maybe some ""local"" entrepreneur should read it...","it","en","","","homegrown, home-grown"
"protezione","protection","La polizza assicurativa promette protezione finanziaria per le famiglie dalla culla alla tomba.","The insurance policy promises financial protection for families from cradle to grave.","it","en","","","security, protecting"
"sempliciotto","simpleton","Il sempliciotto pensava di poter riparare l'auto senza alcun attrezzo.","The simpleton thought he could fix the car without any tools.","it","en","","","half-wit, rube"
"analfabetismo","illiteracy","Combattere l'analfabetismo nelle competenze digitali è una priorità per molte istituzioni educative.","Combating illiteracy in digital skills is a priority for many educational institutions.","it","en","","","illiterate"
"pimpante","perky","Mi distrai di più da depressa che da pimpante.","You depressed is so much more distracting than you perky.","it","en","","","lively, bright-eyed and bushy-tailed"
"salvia","sage","Ha guarnito il piatto con foglie di salvia per un tocco rustico.","He garnished the dish with sage leaves for a rustic touch.","it","en","","","salvia, sagebrush"
"litigio","fight","Gli amici spesso si siedono per appianare i malintesi dopo un litigio.","Friends often sit down to smooth out misunderstandings after a fight.","it","en","","","argument, quarrel"
"volgere","turn","Con una risposta spiritosa, riuscì a volgere la discussione a suo favore.","With a witty comeback, he managed to turn the argument in his favor.","it","en","","","slue, weathercock"
"disarcionare","unseat","Dopo la carica iniziale, la lancia, se era rotta, veniva abbandonata, altrimenti era scagliata, in modo da non disarcionare il cavaliere, che quindi usava la spada (Kopis).","After the initial charge, if spear was broken, was abandoned, otherwise it was throwned in order not to unseat the knight, who then used the sword (Kopis).","it","en","","","unsaddle, unhorse"
"accantonare","set aside","Ha cercato di accantonare le sue frustrazioni durante la riunione.","He tried to set aside his frustrations during the meeting.","it","en","","","put aside, shelve"
"tirarsela","be smug","Non è un buon momento per tirarsela, cocco.","This isn't a good time to be smug, pet.","it","en","","","bragging rights, play hard to get"
"sgobbare","grind","Durante l'estate, scelgo di sgobbare sulle mie competenze senza distrazioni.","During the summer, I choose to grind on my skills without distractions.","it","en","","","slave away, cram"
"mettercela tutta","swing for the fences","Quando l'opportunità bussa, dovresti mettercela tutta e fare del tuo meglio.","When opportunity knocks, you should swing for the fences and do your best.","it","en","","","try hard, give it your all"
"mettere da parte","set aside","Non riusciva a mettere da parte il suo risentimento verso la decisione ingiusta.","He could not set aside his resentment towards the unfair decision.","it","en","","","put aside, save"
"cicale","cicadas","Fuori, le cicale ronzanti creavano una sinfonia estiva nella serata.","Outside, the whirring cicadas created a summer symphony in the evening.","it","en","","","crickets, grasshoppers"
"tranviere","tram driver","Il tranviere, quello che vende i biglietti.","A tram driver, the one who sells the tickets.","it","en","","","bus driver, streetcar"
"contratempo","setback","Non gettare via i tuoi sogni solo per un contratempo nella vita.","Don't throw away your dreams just because of one setback in life.","it","en","","",""
"impiccio","predicament","Non è tanto un'esistenza quanto un impiccio.","It's not so much an existence as a predicament.","it","en","","","nuisance, trouble"
"guaio","trouble","Entrò con un sorriso malizioso, pronto a combinare qualche guaio.","He walked in with a cheeky grin, ready to cause some trouble.","it","en","","","mess, problem"
"appagamento","fulfillment","Si rese conto che essere più facoltoso non avrebbe garantito felicità o appagamento.","He realized that being richer wouldn't guarantee happiness or fulfillment.","it","en","","","contentment, satisfaction"
"spruzzare","spray","Se schiacci quella lattina troppo forte, potrebbe esplodere e spruzzare ovunque.","If you squeeze that can too hard, it might pop and spray everywhere.","it","en","","","sprinkle, squirt"
"sprizzare","shoot out","The Hub è un posto che sembra davvero sprizzare energia da ogni angolo.","The Hub is a place that seems is a place that really seems to shoot out energy from every angle.","it","en","","","spurt, bubble with"
"bolla","bubble","Vivendo in una bolla, non avevano idea di come fosse il mondo esterno.","Living in a bubble, they had no idea what the outside world was like.","it","en","","","bull, blister"
"passaggio pedonale","walkway","Per migliorare la durabilità, gli operai stabilizzano il passaggio pedonale con supporti in cemento.","To improve durability, workers ballast the walkway with concrete supports.","it","en","","","pedestrian crossing, crosswalk"
"di corsa","in a hurry","Hanno finito il progetto di corsa per rispettare la scadenza.","They finished the project in a hurry to meet the deadline.","it","en","","","fast, in a rush"
"a spasso","walking","Fanno due chiacchiere ogni sera mentre portano a spasso i cani insieme.","They bat the breeze every evening while walking their dogs together.","it","en","","","for a walk, to walk"
"tavolino","coffee table","Disponiamo le riviste sul tavolino per averle a portata di mano.","Let's stack the magazines on the coffee table for easy access.","it","en","","","table, small table"
"perbene","decent","Ho sentito che insegnerà solo a bambini perbene, d'ora in poi.","I hear you'll be teaching decent children from now on.","it","en","","","good, nice"
"ciccione","fat man","Hamilton non troverebbe un ciccione ad una fiera di paese.","Hamilton couldn't find a fat man in a county fair.","it","en","","","fatty, porker"
"incensurato","uncensored","Le ricerche sono iniziate partendo da una ripresa di una videocamera di sorveglianza, così hanno avuto un'immagine del colpevole, ma era incensurato, quindi sui database della polizia non figurava.","The researches started from the shot of a surveillance camera, so they had an image of the murderer, but he was uncensored, so he didn't appear in the databases of the police.","it","en","","","clean-handed, uncensured"
"magazzino","warehouse","Il vecchio magazzino si presta perfettamente alla conversione in moderni appartamenti tipo loft.","The old warehouse lends itself perfectly to conversion into modern loft apartments.","it","en","","","stock, storage"
"spezia","spice","Notò una differenza minuscola nel gusto dopo aver aggiunto solo una spezia.","He noticed a miniscule difference in taste after adding just one spice.","it","en","","","seasoning, pimenta"
"contadino","farmer","Il contadino tiene per i giorni di magra raccolti extra in caso di siccità.","The farmer stores away extra crops to prepare for possible drought years.","it","en","","","peasant, farm"
"farm","fattoria","He always has a blast when he visits his grandparents' farm.","Si diverte sempre un mondo quando visita la fattoria dei nonni.","en","it","","","agriturismo, azienda agricola"
"foresta","forest","La foresta si anima di notte con le attività degli animali notturni.","The forest comes to life at night with nocturnal animal activities.","it","en","","","wood, jungle"
"da quest'ultimo","by the latter","La necessità è valutata al meglio da quest'ultimo.","The necessity is best assessed by the latter.","it","en","","","from the latter, from this last"
"perciò","so","Senza contare che non ti ho mai detto ""grazie"" perciò...","Not to mention, I never even said thank you so...","it","en","","","therefore, thus"
"logorare","wear down","Avanzare di corsa può logorare la difesa avversaria nel corso del tempo.","Rushing the ball can wear down an opposing defense over time.","it","en","","","wear out, fray"
"licenziamento","dismissal","Farsi al lavoro ha portato al suo immediato licenziamento dall'azienda.","Getting high at work led to his immediate dismissal from the company.","it","en","","","firing, termination"
"magro","thin","Il cane sembrava malcurato, con il pelo arruffato e il corpo magro.","The dog appeared uncared for, with matted fur and a thin frame.","it","en","","","lean, skinny"
"strabirdare","overflow","Vabbe', quello stava per strabordare in ogni caso.","Well, that one was starting to overflow anyway.","it","en","","","slop over, bubble over"
"scollatura","neckline","La scollatura vertiginosa del suo abito attirò l'attenzione all'evento glamour.","The plunging neckline of her dress turned heads at the glamorous event.","it","en","","","cleavage, neck"
"cucire","sew","Imparò a cucire alamari per personalizzare i suoi vestiti con dettagli affascinanti.","She learned to sew frogs and personalize her clothing with charming details.","it","en","","","stitch, knit"
"primeggiare","excel","Essi pensano che questi due discepoli vogliano primeggiare su di essi.","They think that these two disciples want to excel on them.","it","en","","","stand out, dominate"
"sarto","tailor","Il sarto cuce ogni bottone a mano per garantire la massima qualità della rifinitura.","The tailor sews each button by hand to ensure the highest quality finish.","it","en","","","dressmaker, couturier"
"collocare","place","La mappa termica ci ha aiutato a determinare dove collocare risorse aggiuntive durante l'evento.","The heat map helped us determine where to place additional resources during the event.","it","en","","","put, position"
"altezzoso","haughty","Con un sussiego altezzoso, ha respinto i suoi complimenti come mera adulazione.","With a haughty sniff, she dismissed his compliments as mere flattery.","it","en","","","condescending, snooty"
"e via discorrendo","and so on","Madre e figlio riuniti, lacrime di gioia e via discorrendo.","Mother and son reunited, tears of joy and so on.","it","en","","",""
"strada facendo","along the way","Se accetti tutti quelli che incontri strada facendo come insegnanti.","If you accept everyone you meet along the way as teachers.","it","en","","","en route, somewhere along the line"
"abbinarsi","match","Le decorazioni sono state scelte adeguatamente per abbinarsi al tema della festa.","The decorations were chosen appropriately to match the theme of the party.","it","en","","","pair, complement"
"indesiderato","unwanted","Ieri si è dimenticato di rimuovere un articolo indesiderato dal suo carrello.","He forgot to remove an unwanted item from his shopping cart yesterday.","it","en","","","undesirable, undesired"
"strillione","newsboy","E poi, mi sono ricordato dello strillone.","And then, I remembered the newsboy.","it","en","","","newsie, paperboy"
"destare","arouse","Parlava dolcemente per destare il suo interesse nella sua proposta.","He spoke softly to arouse her interest in his proposal.","it","en","","","awaken, rouse"
"brancolare","grope","Nel frattempo, la polizia continuò a brancolare nello stesso buio in cui agiva l'assassino.","Meanwhile, police continued to grope in the same darkness in which acted the murderess.","it","en","","","fumble, grope for"
"rittatto","portrait","Il ritratto ha catturato i lineamenti del soggetto a fuoco nitido a media distanza.","The portrait captured the subject's features in sharp focus at middle distance.","it","en","","","picture, portrayal"
"rapire","kidnap","Il film ruotava attorno a un audace piano per rapire un politico.","The movie revolved around a daring plot to kidnap a politician.","it","en","","","abduct, steal"
"abbondante","abundant","Molti animali danno alla luce in primavera quando il cibo è più abbondante.","Many animals give birth in spring when food is more abundant.","it","en","","","plentiful, hearty"
"allentare","loosen","Un po' d'olio d'oliva dovrebbe fare al caso per allentare quel bullone ostinato.","A little olive oil should do the trick to loosen that stubborn bolt.","it","en","","","ease, relax"
"saggezza","wisdom","Gli anziani del villaggio tramandano la loro saggezza dalla notte dei tempi.","The village elders have passed down their wisdom from time immemorial.","it","en","","","sense, wiseness"
"ossuto","bony","Sentiva un gomito ossuto spingerlo ogni volta che sedevano insieme a cena.","He felt a bony elbow poke him whenever they sat together at dinner.","it","en","","","scrawny, skinny"
"scorgere","see","Guardando verso sudovest, potevamo scorgere il profilo sfumato delle montagne in lontananza.","Looking southwest, we could see the faint outline of the distant mountains.","it","en","","","glimpse, spot"
"congendarsi","take leave","Mentre la festa volgeva al termine, gli ospiti cominciarono a congedarsi uno per uno.","As the party wound down, guests began to take leave one by one.","it","en","","","say goodbye, dismiss"
"tovagliolo","napkin","Dispiegò con cura il tovagliolo inamidato e lo posò sulle ginocchia.","He unfolded the crisp napkin and placed it on his lap carefully.","it","en","","","towel, serviette"
"impastare","knead","Le piace guardare video su come impastare il pane e migliorare le sue abilità.","She enjoys watching videos on how to knead bread and improve her skills.","it","en","","","mix, pug"
"premere","press","Ero tentato di premere il tasto snooze della sveglia invece di alzarmi.","I felt tempted to press snooze on my alarm instead of getting up.","it","en","","","push, hit"
"stendere","spread","Hanno creato una glassa spalmabile facile da stendere ma deliziosamente dolce.","They created a brushable frosting that was easy to spread but deliciously sweet.","it","en","","","roll out, apply"
"stendire","spread","Hanno creato una glassa spalmabile facile da stendere ma deliziosamente dolce.","They created a brushable frosting that was easy to spread but deliciously sweet.","it","en","","","roll out, apply"
"rivestire","cover","Ha studiato la tappezzeria per imparare a rivestire con eleganza i vecchi mobili.","She studied upholstery to learn how to cover old furniture beautifully.","it","en","","","coat, play"
"grattugiare","grate","Grattugiare finemente le carote e aggiungerle al composto di cuscus e ceci.","Finely grate carrots and add to the couscous and chickpea mixture.","it","en","","","zest"
"farcita","stuffed","La mamma ha comprato una torta farcita decorata con glassa colorata per il mio compleanno.","Mom bought a stuffed cake decorated with bright icing for my birthday.","it","en","","","filled, topped"
"vizio","vice","La sua dipendenza era un vizio che l'ha isolata da tutti.","Her addiction was a vice that isolated her from everyone.","it","en","","","habit, defect"
"intuitivo","intuitive","Preferisco usare un diagramma a torta per i dati demografici perché è più intuitivo.","I prefer using a pie chart for demographics because it is more intuitive.","it","en","","","user-friendly, easy-to-use"
"allevamento","breeding","Legge libri sull'allevamento di piccoli animali per migliorare il suo gregge.","He reads books about breeding small livestock to improve his flock.","it","en","","","farm, farming"
"prendere piede","take hold","Dopo il conflitto, il risentimento iniziò a prendere piede nella loro relazione.","After the conflict, resentment began to take hold in their relationship.","it","en","","","catch on, gain a foothold"
"stirare","iron","Si è ricordata di stirare i tovaglioli per la cena di festa.","She remembered to iron the table napkins for the festive dinner.","it","en","","","stretch, press"
"venire voglia","me want to","Mi fa venire voglia di cavalcare a torso nudo nella nebbia.","It makes me want to ride my horse shirtless through the mist.","it","en","","","you want to, me wanna"
"interruttore","switch","Nel vecchio edificio, la posizione dell'interruttore della luce era insolita.","In the older building, the light switch placement was unconventional.","it","en","","","breaker, circuit breaker"
"tagliare","cut","Pulire e lavare i fegatini, asciugarli e tagliarli, tagliare le verdure e soffriggerle in padella con olio.","Clean and wash the chicken livers, dry them and cut, cut vegetables and fry in a pan with oil.","it","en","","","cut off, trim"
"già a cavallo","fine!","Assicurati che i tuoi visitatori possano trovare al volo le informazioni più importanti e di seguire questi consigli, e vedrai che sarai già a cavallo!","Make sure your visitors can find the most important information straight away and then stick to the tips offered above and you'll be fine!","it","en","","",""
"gettare la spugna","throw in the towel","Dopo mesi di difficoltà, il proprietario della piccola impresa decise di gettare la spugna.","After months of struggling, the small business owner decided to throw in the towel.","it","en","","","give up, throw in the sponge"
"piaccia e non piaccia","like it or not","Dovrai accettare le conseguenze, piaccia o non piaccia.","You will have to accept the consequences, like it or not.","it","en","","",""
"sfottere","make fun","Tu per l'anno nuovo dovresti smettere di sfottere gli amici.","Maybe your resolution should be not to make fun of your friends.","it","en","","","tease, mock"
"dirittura","uprightness","Acton avviò un processo di rinnovamento che consentisse di rinforzare notevolmente la dirittura etico-morale degli ufficiali, in modo che essi potessero funzionare come esempio per il resto della popolazione.","Acton began a process of renewal that would allow considerably strengthen the ethical and moral uprightness of the officers, so that they could function as an example for the rest of the population.","it","en","","","integrity, straight"
"salvagente","life preserver","Hanno imparato a usare un salvagente durante le loro lezioni di nuoto.","They learned how to use a life preserver during their swimming lessons.","it","en","","","life preserver, lifesaver"
"banconota","banknote","Non fermate una banconota con i piedi se sta per volare via.","Do not stop a banknote with your feet if it's flying away.","it","en","","","bill, note"
"soprammobile","ornament","Non mi sembra un soprammobile che prende polvere.","Doesn't sound like an ornament gathering dust to me.","it","en","","","knick-knack, bent fork"
"sottobanco","backroom","Le negoziazioni erano piene di intrighi e accordi sottobanco.","The negotiations were filled with skulduggery and backroom deals.","it","en","","","under-the-table, undercounter"
"sopranome","nickname","Che mi rappresenta come uomo: incurabilmente ottimista e molto allegro, ma anche estremamente loquace: potrei descrivere il mondo in 48 ore senza smettere di parlare; ho anche un sopranome funny, ma lo divulgo soltanto personalmente.","What represents me as a person: hopeless optimist and very joyful, and also extremely talkative: I could describe the world in 48 hours without stopping from talking; as a result I received a funny nickname, but I will tell it to you only personally.","it","en","","","short name"
"dormisveglia","doze","Vi preghiamo di restituire la stessa dormiveglia di rispetto che hai da noi.","Please give us back the same doze of respect you got from us.","it","en","","","half-sleep, drowsiness"
"cassaforte","safe","I documenti sono custoditi in una cassaforte ignifuga per protezione.","The documents are stored in a fireproof safe for protection.","it","en","","","safety deposit box, vault"
"pioggia","rain","Il concerto è iniziato in orario, nonostante la forte pioggia fuori.","The concert started on time, despite the heavy rain outside.","it","en","","","rainfall, shower"
"rallentamento","slowdown","La scienza triste prevede un rallentamento della crescita economica per il prossimo anno.","The dismal science predicts a slowdown in economic growth for next year.","it","en","","","slowing, slow down"
"pron7ncia","pronunciation","Man mano che ti eserciti, la tua pronuncia migliorerà naturalmente.","As you practice more, your pronunciation will get better naturally.","it","en","","","ruling, decision"
"sconfitta","defeat","La squadra cercava grane per vendicarsi dopo la sconfitta precedente.","The team was spoiling for revenge after their previous defeat.","it","en","","","loss, losing"
"terrona","Southerner","500 gr (la dose è naturalmente terrona, diciamo che 300 gr possono andare più che bene) di pasta corta come rigatoni o penne rigate","500 grs (the dose is of course Southerner, let's say 300 grs can go just fine) short pasta such as rigatoni or penne","it","en","","",""
"everyone","tutti","The motivational speaker encouraged everyone to push it beyond their limits.","Il motivatore ha incoraggiato tutti a non mollare oltre i propri limiti.","en","it","","","ognuno, chiunque"
"polemica","controversy","Dopo la recente polemica, molti lo hanno esortato a dimettersi con grazia.","After the recent controversy, many urged the governor to stand down gracefully.","it","en","","","polemic, debate"
"umpteenth","ennesimo","After the umpteenth suggestion, they decided to pause for lunch.","Dopo l'ennesimo suggerimento, hanno deciso di fermarsi per pranzo.","en","it","","",""
"ribattere","argue","Anche se potrei ribattere che la soluzione più sana sarebbe la completa trasparenza.","Although I might argue that a healthier option would be full transparency.","it","en","","","talk back, reply"
"avvertire","warn","Quando si sentivano minacciati, abbaiavano per avvertire i loro padroni del pericolo.","When they felt threatened, they would bay to warn their owners of danger.","it","en","","","feel, experience"
"uscirsene con","come up with","Solo un avvocato poteva uscirsene con una frase del genere.","Only lawyers could come up with something like that.","it","en","","",""
"esclamare","exclaim","Scoprire che dovevo lavorare fino a tardi ha spinto il mio amico a esclamare grazie tante.","Finding out I had to work late prompted my friend to exclaim thanks a heap.","it","en","","","cry out, shout"
"scherzare","joke","Cercò debolmente di scherzare sulla situazione, ma cadde nel vuoto.","He feebly tried to joke about the situation, but it fell flat.","it","en","","","fool around, play"
"pagliaccio","clown","I bambini urlavano come matti quando hanno visto il pagliaccio.","The kids were screaming their heads off when they saw the clown.","it","en","","","joker, bozo"
"accalappiacani","dog catcher","Durante la festa, l'accalappiacani ha dimostrato come gestire gli animali randagi.","During the festival, the dog catcher demonstrated how to handle stray animals.","it","en","","","dogcatcher, animal control officer"
"beccato","caught","È stato beccato mentre tentava di rubare oggetti dal negozio.","He was caught attempting to pocket items from the store.","it","en","","","busted, picked up"
"medaglietta","medal","L'aggiunta della piccola medaglietta color oro impeziosisce e da luce alla lavorazione.","The addition of small gold medal embellishes and from light to processing.","it","en","","","dog tag, medallion"
"gallina","chicken","Vari fattori influenzano quante uova una gallina deporrà ogni anno.","Various factors influence how many eggs a chicken will lay each year.","it","en","","","hen, fowl"
"cestino","basket","Ha nove mele nel suo cestino, più di chiunque altro.","He has nine apples in his basket, more than anyone else.","it","en","","","trash, recycle bin"
"staccabile","detachable","Apprezzava la tracolla staccabile sulla sua borsa per opzioni di trasporto aggiuntive.","She appreciated the detachable strap on her purse for additional carrying options.","it","en","","","removable, peelable"
"immigrante","immigrant","Diventò selvaggio perché ogni immigrante bianco obbediva solo le sue proprie leggi.","It became wild because each white immigrant obeyed only his own laws.","it","en","","","migrant"
"miscuglio","mixture","Il miscuglio sgradevole di verdure avariate mi fece perdere l'appetito.","The unsavory mixture of spoiled vegetables made me lose my appetite.","it","en","","","mix, blend"
"proveniente","coming","I vicini si lamentavano della musica ad alto volume proveniente dallo stereo portatile accanto.","Neighbors complained about the loud music coming from the ghetto blaster next door.","it","en","","","originating, sourced"
